created_at,lang,screen_name,location,full_text,urls,tags,mentions,retweet_count,favorite_count
Wed May 29 15:11:49 +0000 2019,es,bluesalachilena,,Kim Jong-un y su nuevo amigo Donald Trump. Resultados elecciones europeas https://t.co/wBNjzX8mmJ,https://www.youtube.com/attribution_link?a=2ia8AbSI_7w&u=%2Fwatch%3Fv%3DvqzjEt203b0%26feature%3Dshare,,,0,1
Wed May 29 15:10:26 +0000 2019,es,Alonsotamez,"Glasgow, Scotland","En las elecciones europeas, el votante británico castigó la ambigüedad de conservadores y laboristas con respecto al #Brexit 🤔

Ganaron las opciones pro y anti más claras: el Partido Brexit y el Liberal Democrático 📊

Mi nota semanal desde UK 👇

https://t.co/wuKOw5dcgd https://t.co/dTYo4vGC4B",https://twitter.com/i/web/status/1133752463671078915,,,1,2
Wed May 29 15:10:26 +0000 2019,es,Alonsotamez,"Glasgow, Scotland","En las elecciones europeas, el votante británico castigó la ambigüedad de conservadores y laboristas con respecto al #Brexit 🤔

Ganaron las opciones pro y anti más claras: el Partido Brexit y el Liberal Democrático 📊

Mi nota semanal desde UK 👇

https://t.co/wuKOw5dcgd https://t.co/dTYo4vGC4B",https://twitter.com/i/web/status/1133752463671078915,,,1,2
Wed May 29 15:10:11 +0000 2019,es,PetrizzoNicolas,Argentina,🇪🇺 Cinco claves para entender los resultados de las europeas más importantes de la historia. https://t.co/quVBm1MpfJ,https://www.elconfidencial.com/mundo/europa/2019-05-27/elecciones-europeas-claves-resultados_2031214/,,,0,0
Wed May 29 15:09:12 +0000 2019,es,PetrizzoNicolas,Argentina,🇪🇺 Elecciones europeas.     https://t.co/6CRSXfeiii,https://www.elconfidencial.com/mundo/europa/2019-05-27/elecciones-europeas-liberales-verdes-euroescepticos_2035135/,,,0,0
Wed May 29 15:08:33 +0000 2019,es,pep_dos,"Vendrell, Tabarnia, Spain",Carles Puigdemont quiere reeditar la 'vía alemana' para recoger el acta de eurodiputado sin ser detenido | Elecciones Europeas 2019 https://t.co/82pxYX2c76,https://twitter.com/i/web/status/1133751991522549760,,,0,0
Wed May 29 15:08:21 +0000 2019,es,RockChildRock,Cerca d la Puerta d Tannhäuser,"(Mini Hilo) CAMBIO CLIMÁTICO. Las Elecciones Europeas han mostrado la verdadera finalidad tras la doctrina del cambio climático, aunar a la población ante el miedo a una crisis climática. El catalizador para esto son los PARTIDOS VERDES que se han disparado por toda Europa... https://t.co/EUxdHxZSJt",https://twitter.com/i/web/status/1133751942977597441,,,22,17
Wed May 29 15:02:50 +0000 2019,es,alonso_aparicio,La Coruña,"Borrell gana las elecciones Europeas también es catalán, pero le saca 18 escaños. 
No hay tal petición de la ONU.
Seguís tan lejos de la independencia como ayer. https://t.co/MoL1C7hLTL",https://twitter.com/i/web/status/1133750551001411584,,,0,1
Wed May 29 15:00:05 +0000 2019,es,maestroviejoes,España,.ELECCIONES MUNICIPALES Y EUROPEAS: SEGUNDO PUCHERAZO. https://t.co/oh98WnoXv1,https://wp.me/p8cQNN-10YL,,,0,0
Wed May 29 15:00:00 +0000 2019,es,UEprensa,"Madrid, Valencia, Canarias","Gran intervención de nuestro #ProfesorUE, de @DerechoRRIIUE en la @UEuropea, @benedictosolson, en @laSextaTV analizando las elecciones europeas 📥🇪🇺 https://t.co/Q1of1OQPYW",https://twitter.com/i/web/status/1133749841350332417,ProfesorUE,"DerechoRRIIUE, UEuropea, benedictosolson, laSextaTV",2,5
Wed May 29 14:59:35 +0000 2019,es,AlessiaPutin,"Madrid, Comunidad de Madrid","@ChemaVolt @yanisvaroufakis @DiEM25_ES @VoltEuropa En breve se pública el estudio académico del que te hablé en el cual pongo en valor justamente este hecho, entre otros análisis sobre Volt y las elecciones europeas! Enhorabuena!!! Este es solo el principio!",https://twitter.com/i/web/status/1133749736207466496,,"ChemaVolt, yanisvaroufakis, DiEM25_ES, VoltEuropa",1,5
Wed May 29 14:48:25 +0000 2019,es,Trassierra,Loscos (Teruel),"LAS ELECCIONES 2019 EN LOSCOS. Generales, europeas, autonómicas y municipales. https://t.co/Dr08sFHNBo https://t.co/u6KR8ciDzZ",http://blog.loscosnatural.es/2019/05/29/las-elecciones-2019-en-loscos-generales-europeas-autonomicas-y-municipales/,,,0,0
Wed May 29 14:47:42 +0000 2019,es,tiflonet,Olite/Barcelona/Roma,@Egocrata Yo no tengo tan claro que haya sido por eso. La prueba la puedes ver analizando los resultados de los partidos independentistas en las elecciones europeas.,https://twitter.com/i/web/status/1133746742732763136,,Egocrata,0,0
Wed May 29 14:45:44 +0000 2019,es,PA_Leibbrandt,Paris✈London✈Bilbo,"Se ha comido un cagao 💩 el @PartidoPACMA en las elecciones europeas 2019, no? @barquerosb se quedó sin mamandurria. Hasta los partidos bluf Unidas Podemos y VOX consiguieron escaño y los vividoristas de los animales un truño de vaca. Que locos están los electores españoles 🇪🇸🐂",https://twitter.com/i/web/status/1133746250694692870,,"PartidoPACMA, barquerosb",0,0
Wed May 29 14:45:34 +0000 2019,es,la_manquita,Málaga,Una larga noche de recuento https://t.co/b5UK70CPBV https://t.co/AbcTNTZg0M,http://dlvr.it/R5f0b2,,,0,0
Wed May 29 14:45:24 +0000 2019,es,jestradamo,,Elecciones Europeas: Pedro Sánchez arrancó a Macron el compromiso de echar a C’s del grupo liberal europeo si pacta con Vox https://t.co/hRF6uWv2jP https://t.co/zSjd5QBIMY,https://twitter.com/i/web/status/1133746164531179521,,,0,0
Wed May 29 14:43:09 +0000 2019,es,Greatsauron1,,"@aleixsarri Las elecciones europeas las ganó Borrel... 50% de un 65%, por lo tanto....",,,aleixsarri,0,1
Wed May 29 14:40:16 +0000 2019,es,daoryebba,,"@MagalyPatio3 @nezybit @aba261 @MercedesSabio @xxT1KExx @linaresfulo @maruvilla @Noralex06 @xvzla2009 @marco_roman @LatAmFr @_AnaMc_ @NOmasCNE @TRUESTEEL3 @albertpoli @_Gabbyta_ @l1Ruiz @MyrianeLibre @OviedoFanny @CeliaCruzZuiga2 @giank03 @omarbula @Panama6715 @realCarola2Hope @GiuseppeNoc @esteparialoba @Purpura007 @MovilupPolitic @DacervantesP @NENA7ESTRELLAS @Marcos54909144 @OrhVenezuela @magepetorr @geopolytica @habalianelie @EleonoreNemethM @RICHINFE @MIRANDALIBER24 @nejoviro @Adelkiiis @alenwriter @myriamwinner1 @FernandoAmandi @esferaceleste @FernandoCorreaJ @MiguelABernalV @estebangerbasi @Movil @alekboyd Xq izq. europea busca convertir a Europa, xq aliada del Islam. Xq afinidad d izq. española c/Islam? incluso tras ataques islamistas q han sembrado panico en Europa? 🤔

Italia y Hungria alertan:Si la izq. gana, Europa se convertira en un califato islamico”
https://t.co/3MpfQazcY4",https://twitter.com/i/web/status/1133744872031236101,,"MagalyPatio3, nezybit, aba261, MercedesSabio, xxT1KExx, linaresfulo, maruvilla, Noralex06, xvzla2009, marco_roman",5,4
Wed May 29 14:40:09 +0000 2019,es,enriquerguerrer,Antípodas,"SERÁ POR VOTACIONES,votar es equivocar, ni programa ni nada es verdadero, una vez se reparte la subasta a los mejores postores, a recaudar impuestos y, el 50% para los políticos&gt;industria del INEM institucional, después si queda se paga a Funcionarios y+¿. https://t.co/BQoMaA8LCT",https://twitter.com/i/web/status/1133744846018088961,,,0,0
Wed May 29 14:37:45 +0000 2019,es,Republicano1965,OPPIDUM NUMANCIA,Elecciones Europeas: Pedro Sánchez arrancó a Macron el compromiso de echar a C’s del grupo liberal europeo si pacta con Vox https://t.co/qNUCd5Jevb,https://twitter.com/i/web/status/1133744240998199296,,,1,4
Wed May 29 14:35:55 +0000 2019,es,Republicano1965,OPPIDUM NUMANCIA,Hundidos Podemos: el desastre del partido de Pablo Iglesias https://t.co/1svwY8An0q vía @MediterraneoDGT,https://www.mediterraneodigital.com/espana/nacional/podemos-pablo-iglesias-fracaso-elecciones-municipales-europeas-26m.html,,MediterraneoDGT,0,5
Wed May 29 14:30:03 +0000 2019,es,NuevaRevoluci0n,Galiza-Madrid-Barcelona,"""En España, las elecciones europeas rompieron con la dinámica de ser consideradas de segundo orden en 2014, ya que supusieron el inicio de un cambio de ciclo político.""

Artículo de @SantanaAndres3 y @JoseRamaC, de la @UAM_Madrid 

https://t.co/YpgzVy7IaE",https://twitter.com/i/web/status/1133742303410040832,,,3,1
Wed May 29 14:28:55 +0000 2019,es,TCyberdyne,,"Los medios d desinformación españoles no analizan los resultados d las elecciones Europeas.
El fracaso d los partidos globalistas masones ha sido de tal nivel, que los medios no quieren arriesgar a perder las sustanciosas subvenciones que reciben de sus amos al servicio de Soros.",https://twitter.com/i/web/status/1133742015924068352,,,1,0
Wed May 29 14:26:51 +0000 2019,es,CAPITALRADIOB,Madrid-New York-Bruselas,"🇪🇺¿Cómo afectan los resultados de las elecciones a la gestión de las distintas instituciones europeas?

👉Lo analizamos con @atalaveraEcon en la #tertulia de #MercadoAbierto, y con @blondieconomics y @maroelvi 

🔹En #MercadoAbierto con @LuisBlancoRRR 

🎙️https://t.co/s3zVmNxR2z https://t.co/Bewh33DvcA",https://twitter.com/i/web/status/1133741496497319936,,,3,1
Wed May 29 14:22:50 +0000 2019,es,EdConsciente,"Concón, Valparaíso, Chile",Kim Jong-un y su nuevo amigo Donald Trump. Resultados elecciones europeas https://t.co/IKNjs7WWea vía @YouTube,https://youtu.be/vqzjEt203b0,,YouTube,1,2
Wed May 29 14:12:26 +0000 2019,es,nanimiranda2014,Del mundo,"Cs se desmarca de la oferta de Valls a Colau y solo aceptaría investir a Collboni
😂😂😂😂 me parto. 
Pero éste quien se piensa que es??
Elecciones 2019: Resultados y últimas noticias de las elecciones municipales, europeas y autonómicas | Directo https://t.co/3sHJVC7nq5",https://twitter.com/i/web/status/1133737867719712768,,,0,1
Wed May 29 14:10:52 +0000 2019,es,ricrodel,"Madrid, España",Elecciones Europeas: Pedro Sánchez arrancó a Macron el compromiso de echar a C’s del grupo liberal europeo si pacta con Vox https://t.co/KCcsXR7Lpr,https://twitter.com/i/web/status/1133737474910543872,,,0,0
Wed May 29 14:10:29 +0000 2019,es,hoy_aragon,"Zaragoza, España",En varios países durante las elecciones europeas https://t.co/eAfbmLThAw,https://www.hoyaragon.es/2019/05/29/apunalamiento-zaragoza-viral-europa/,,,0,2
Wed May 29 14:04:47 +0000 2019,es,ElParlantepy,"Asuncion, Paraguay","Te preparamos un interesantísimo resumen de qué pasó en las Elecciones Parlamentarias Europeas del 26 de Mayo de 2019 y una opinión al respecto sobre su importancia.
https://t.co/55vHOF4fvp",https://twitter.com/i/web/status/1133735943725305856,,,2,5
Wed May 29 14:04:42 +0000 2019,es,Alfonsocalabia,Madrid,@_N_Jones @Inivelayensa Te refieres a cuando se presentaban a las elecciones europeas con unos fachas?,,,"_N_Jones, Inivelayensa",0,1
Wed May 29 13:52:58 +0000 2019,es,Ivan_Kudryashev,Mediterraneo,"@Gabrialf4 @AlvaroPavon_ +1
Si eres subalterno siempre, mueres tarde o temprano.

Voz ya ha sufrido una ostia en estas elecciones municipales y europeas.O se busca un hueco o muere por parecer inútil en cuatro años",https://twitter.com/i/web/status/1133732970290962434,,"Gabrialf4, AlvaroPavon_",0,1
Wed May 29 13:45:07 +0000 2019,es,ChitaRdn,,@hermanntertsch Sin olvidar q ha sido la dcha quien ha ganado en las Elecciones Europeas,,,hermanntertsch,0,0
Wed May 29 13:45:06 +0000 2019,es,elOrdenMundial,,"¿Sabrá VOX encontrar aliados en Europa? El partido de ultraderecha tendrá que entrar en un grupo tras las elecciones europeas, pero entre las derechas también hay intereses enfrentados. Analizamos las posibilidades de VOX en la Eurocámara: https://t.co/hwD2RBQRep",https://twitter.com/i/web/status/1133730990222979072,,,1,5
Wed May 29 13:45:04 +0000 2019,es,laverdad_es,Región de Murcia,¿Qué está ocurriendo con el recuento de votos del 26-M? Han pasado tres días desde las elecciones  y el Gobierno ya ha reconocido errores en la difusión de los resultados provisionales https://t.co/q3bT56IRNV,https://twitter.com/i/web/status/1133730981360340994,,,1,1
Wed May 29 13:44:40 +0000 2019,es,pichitaa,Valparaiso y Estocolmo,"@Goligerabaroa Partido pro brexit saco buen % en ultimas elecciones europeas, no es asi?",,,Goligerabaroa,0,0
Wed May 29 13:40:05 +0000 2019,es,Francesc140664,,"@jordievole Cerca del 50% de los votos
 El independentismo roza la mítica cifra  del 50% de los votos en las  elecciones europeas, la más alta conseguida  hasta ahora. En concreto,  las candidaturas de Puigdemont y Junqueras  suman el 49,71% y 1.720.000  votos.",https://twitter.com/i/web/status/1133729728697905154,,jordievole,0,9
Wed May 29 13:35:35 +0000 2019,es,TasioGJ,Las Rozas de Madrid,Las quejas se multiplican por toda España contra la pyme que se llevó más de 7 millones de euros por el recuento electoral de las municipales y europeas https://t.co/f56afROPX0 a través de @BIEspana,https://twitter.com/i/web/status/1133728596986662914,,,0,0
Wed May 29 13:34:31 +0000 2019,es,PLSDE,España,"Joan Tapia: el voto del cabreo?  quiénes han dado su confianza para gobernar los ayuntamientos. La segunda es qué lista ha ganado las europeas. La tercera, qué ha pasado en Barcelona y quién será el futuro alcalde. https://t.co/JFcYuGS0ZE",https://twitter.com/i/web/status/1133728327288668160,,,0,1
Wed May 29 13:32:45 +0000 2019,es,Miss_America_,Barcelona,"@jordievole Yo, personalmente, no le encuentro la gracia. La argumentación de la periodista es simplista. JxCat ha perdido fuerza en el ayuntamiento, pero ha ganado claramente las europeas. Como bien se dice, las elecciones municipales tienen muchas otras lecturas.",https://twitter.com/i/web/status/1133727881601929217,,jordievole,0,1
Wed May 29 13:32:00 +0000 2019,es,regnumcancun11,,Resultados de las elecciones europeas con más del 50% de participación https://t.co/Gs3Ekepvf8,https://buff.ly/2HEz0mU,,,0,0
Wed May 29 13:29:24 +0000 2019,es,Karandls,España,Elecciones Europeas: Pedro Sánchez arrancó a Macron el compromiso de echar a C’s del grupo liberal europeo si pacta con Vox https://t.co/1vAzknV1C0,https://twitter.com/i/web/status/1133727040874717184,,,0,0
Wed May 29 13:28:51 +0000 2019,ca,BiolegsCV,"Valencia, España","➡️➡️ María Garzon de Actúa y Gaspar Llamazares se reúnen con miembros del comité de empresa del IIS LA FE de Valencia // María Garzon d'Actúa i Gaspar Llamazares es reuneixen amb membres del comitè d'empresa de l’IIS LA FE de València

https://t.co/DIaTiyyfae",https://twitter.com/i/web/status/1133726900533305350,,,0,1
Wed May 29 13:28:51 +0000 2019,ca,BiolegsCV,"Valencia, España","➡️➡️ María Garzon de Actúa y Gaspar Llamazares se reúnen con miembros del comité de empresa del IIS LA FE de Valencia // María Garzon d'Actúa i Gaspar Llamazares es reuneixen amb membres del comitè d'empresa de l’IIS LA FE de València

https://t.co/DIaTiyyfae",https://twitter.com/i/web/status/1133726900533305350,,,0,1
Wed May 29 13:25:31 +0000 2019,es,pallaron12,"Asturias ,Aviles.",Elecciones Europeas: Pedro Sánchez arrancó a Macron el compromiso de echar a C’s del grupo liberal europeo si pacta con Vox https://t.co/4lz4OS1Weg,https://twitter.com/i/web/status/1133726062775558144,,,0,0
Wed May 29 13:24:48 +0000 2019,es,salvadorsanvil1,***SALAMANCA***,"""UE: El PSOE es el partido más votado en las elecciones europeas"" #EleccionesUE2019 https://t.co/7DQbaJS82R",https://twitter.com/i/events/1130792428074483712,EleccionesUE2019,,0,1
Wed May 29 13:24:21 +0000 2019,es,Malcon10000,,"@Ocevian @jordimunozm Ahora coge los resultados de las elecciones europeas y suma ERC+Puigdemont .
Gracias .
Por cierto , ya sabes que Colau tiene voto independentista y ya sabes por qué se hace la tonta con el tema",https://twitter.com/i/web/status/1133725768528400384,,"Ocevian, jordimunozm",0,0
Wed May 29 13:24:00 +0000 2019,es,ElSalto_Rioja,larioja@elsaltodiario.com,"El gobierno austriaco cae al completo, pero sus buenos resultados en las europeas le sitúan como favorita para las elecciones que se celebrarán en septiembre.
https://t.co/fMAY9H3cX8",https://twitter.com/i/web/status/1133725679831453696,,,0,0
Wed May 29 13:22:23 +0000 2019,es,MAlvarezRivera,Puerto Rico,"@jmdelalamo @FerR1979 @eivissenc92 En estos días me topé con discrepancias en los totales de las elecciones europeas publicados en la web oficial de resultados.  Son pequeñas, pero no había visto cosa semejante en largo tiempo.",https://twitter.com/i/web/status/1133725272308629508,,"jmdelalamo, FerR1979, eivissenc92",0,0
Wed May 29 13:15:34 +0000 2019,es,RedpresNews,World /,Le Pen vence a Macron en las elecciones europeas y le insta a disolver la Asamblea Nacional francesa https://t.co/LmZXMDYNlh … https://t.co/AxqALHI9eu https://t.co/UYFdqFP253,https://twitter.com/i/web/status/1133723556628422656,,,0,0
Wed May 29 13:13:05 +0000 2019,es,YahooActualidad,España,El vídeo viral de un youtuber que ha derrumbado al partido de Merkel en las elecciones europeas https://t.co/In7h5tgXHd,https://yhoo.it/2KaOe4v,,,0,0
Wed May 29 13:12:08 +0000 2019,es,leonoticias_,"León, España",NACIONAL Nació con el objetivo de especializarse en el desarrollo de software de seguridad en votaciones electrónicas. En los últimos meses ha tenido varios incidentes destacados https://t.co/34XViAYOpo,https://twitter.com/i/web/status/1133722692719452160,,,1,0
Wed May 29 13:11:20 +0000 2019,es,YahooNoticias,,El vídeo viral de un youtuber que ha derrumbado al partido de Merkel en las elecciones europeas https://t.co/MNYlMvbRVO,https://yhoo.it/2KaOe4v,,,1,1
Wed May 29 13:10:48 +0000 2019,es,ExIndepe_90,"Tractoria Central, Spain, Earth",@indapandrake @rebel_1O @royo1_royo Teniendo en cuenta que en las elecciones europeas no vota mucha gente y que en las municipales en muchos pueblos los no indepes no pueden ni votar a sus partidos porque no hacen lista,https://twitter.com/i/web/status/1133722357170880512,,"indapandrake, rebel_1O, royo1_royo",0,0
Wed May 29 13:10:27 +0000 2019,es,ElianaCabrera9,Ecuador,El titular del artículo es tendencioso: lo único que quieren estos patriotas es DEFENDER A SU GENTE de la muy bien orquestada y financiada invasión de terroristas islámicos ordenada por el NOM y disfrazada de «acogida a refugiados». https://t.co/MNkBWPo4Vt vía @casoaislado_es,https://twitter.com/i/web/status/1133722270457892864,,,0,3
Wed May 29 13:06:09 +0000 2019,es,Pibe_Paliza,San Miguel de Tucuman,Balance de las elecciones europeas - Noticias del movimiento obrero y análisis político. https://t.co/t2tM3wQNG3,http://bit.ly/2MfBRXO,,,0,0
Wed May 29 13:04:40 +0000 2019,es,TribuleteBcn,,"Elecciones 2019: Resultados y últimas noticias de las elecciones municipales, europeas y autonómicas | Directo https://t.co/xVxmlZ9DZB",https://www.elperiodico.com/es/politica/20190529/elecciones-2019-resultados-ultimas-noticias-municipales-europeas-autonomicas-7467426,,,0,0
Wed May 29 13:00:53 +0000 2019,es,Llawengaft,,"@juansotoivars @IgnatiusFarray Cabe la posibilidad de que las elecciones municipales, comunitarias y europeas sean diferentes, ¿no?",,,"juansotoivars, IgnatiusFarray",0,0
Wed May 29 13:00:01 +0000 2019,es,instituto_dm,"Madrid, Comunidad de Madrid","La corrupción saca a la extrema derecha del Gobierno austriaco, pero puede volver en septiembre

El gobierno austriaco cae al completo, pero sus buenos resultados en las europeas le sitúan como favorita para las elecciones que se celebrarán en septiembre.

https://t.co/sEi4nyLPMY",https://twitter.com/i/web/status/1133719645725155328,,,1,0
Wed May 29 12:59:55 +0000 2019,es,Pablo_lm11,"Valencia, España",Este es el resultado de las elecciones europeas. El @PSOE de @sanchezcastejon y el Partido Socialista portugués de @antoniocostapm se reafirman como la esperanza de la socialdemocracia en #Europa gobernando para el progreso y para la gente. #LaFuerzaIberica #LaFuerzaDelSur 🌹✊🏼. https://t.co/rbNGpINw76,https://twitter.com/i/web/status/1133719619766824960,,"PSOE, sanchezcastejon",18,20
Wed May 29 12:59:45 +0000 2019,es,alejancamino,"Montevideo, Uruguay.","Desde las 10 ponemos “La mañana en Camino” con el Dr. JUAN RAÚL WILLIMAN (Caso Lola Chomnalez); Elecciones Europeas: JUAN RAÚL FERREIRA, Análisis Internacional; FABIANA CANTILO...
(LmC, LaV,10a12; FM98.7Diamante/FM92.5Cielo,PdelE).
TRECE temporadas!
Nos importan las ideas. https://t.co/9V5Gr8ExZ6",https://twitter.com/i/web/status/1133719578666835968,,,4,13
Wed May 29 12:49:10 +0000 2019,es,Paco__Roca,"Bogotá, DC, Colombia",Elecciones Europeas: Pedro Sánchez arrancó a Macron el compromiso de echar a C’s del grupo liberal europeo si pacta con Vox https://t.co/h11eEKOnAq,https://twitter.com/i/web/status/1133716915245993985,,,0,0
Wed May 29 12:46:57 +0000 2019,es,NEWSANTANDER,,"¿Por qué no hay una, sino tres elecciones europeas en España el 26 de mayo? https://t.co/ZD2Kk7zhUh",https://thenewsatyourfingertips.wordpress.com/2019/05/29/por-que-no-hay-una-sino-tres-elecciones-europeas-en-espana-el-26-de-mayo/,,,0,0
Wed May 29 12:43:30 +0000 2019,es,unaterricola,el planeta,Elecciones Europeas: Pedro Sánchez arrancó a Macron el compromiso de echar a C’s del grupo liberal europeo si pacta con Vox https://t.co/Ek3GWAdFyB,https://twitter.com/i/web/status/1133715489866342401,,,0,0
Wed May 29 12:39:48 +0000 2019,es,ajegea,,"Rajoy,el hombre que perdió una mayoría absoluta y que hundió al PP, sigue presente en personajes como el de la Junta de Galicia, Feijoo. Claramente ha perdido estas elecciones municipales y europeas pero se sigue presentando como el salvador del PP. ¿En la línea de Juanma Moreno?",https://twitter.com/i/web/status/1133714558584074241,,,0,0
Wed May 29 12:38:59 +0000 2019,es,leonoticias_,"León, España",PSOE y UPL presentarán un recurso y creen que Europeas y Autonómicas confirmarán el error https://t.co/eDQ9tgYa3G,https://www.leonoticias.com/elecciones/autonomicas-municipales/psoe-presentaran-recurso-jose-antonio-diez-upl-vox-20190529143242-nt.html#vca=fixed-btn&vso=rrss&vmc=tw&vli=Elecciones-Autonómicas-y-Municipales,,,0,0
Wed May 29 12:37:42 +0000 2019,es,guidolarson,,La ola verde que que se vio en las elecciones europeas llegará tarde o temprano a este país.,,,,1,3
Wed May 29 12:36:53 +0000 2019,es,ConsolConlluvia,"Cataluña, España",Elecciones Europeas: Pedro Sánchez arrancó a Macron el compromiso de echar a C’s del grupo liberal europeo si pacta con Vox https://t.co/eZOHMLoQ1o,https://twitter.com/i/web/status/1133713821539995648,,,1,1
Wed May 29 12:36:47 +0000 2019,es,Zibelinam,"Mundo, Europa, España",Elecciones Europeas: Pedro Sánchez arrancó a Macron el compromiso de echar a C’s del grupo liberal europeo si pacta con Vox https://t.co/0synxzMgdI,https://twitter.com/i/web/status/1133713797741461510,,,0,0
Wed May 29 12:36:00 +0000 2019,es,ErnestoSuidry,,"Algunos datos sobre la UTE que ha gestionado las elecciones en #Spain el #26M

https://t.co/wd4aA0Q3QE",https://www.laverdad.es/elecciones/autonomicas-municipales/vectorscytl-empresa-gestiona-datos-elecciones-municipales-europeas-26-mayo-punto-de-mira-criticas-errores-20190529130045-ntrc.html,"Spain, 26M",,10,2
Wed May 29 12:35:07 +0000 2019,es,Josele_P_,Valdecuñao,"""La decisión de arremeter contra Más Madrid sin pensar en las consecuencias ha conducido a Podemos a una hecatombe en las elecciones municipales, autonómicas y europeas""",https://twitter.com/i/web/status/1133713379422605312,,,0,0
Wed May 29 12:34:17 +0000 2019,es,Indiopina,España,Elecciones Europeas: Pedro Sánchez arrancó a Macron el compromiso de echar a C’s del grupo liberal europeo si pacta con Vox https://t.co/r60Srp8lIE,https://twitter.com/i/web/status/1133713167144632321,,,0,0
Wed May 29 12:33:54 +0000 2019,es,maylwino,Chile,La desorientación en las elecciones europeas y sus implicancias | El Dínamo https://t.co/IF8ukBdTz6,https://www.eldinamo.cl/blog/la-desorientacion-en-las-elecciones-europeas-y-sus-implicancias/,,,0,0
Wed May 29 12:30:48 +0000 2019,es,pgargor,,"Menudo fulero el doctor fraudez, todo lo hace igual... Elecciones Europeas: Pedro Sánchez arrancó a Macron el compromiso de echar a C’s del grupo liberal europeo si pacta con Vox https://t.co/wKglsuJMPQ",https://twitter.com/i/web/status/1133712292485488641,,,0,0
Wed May 29 12:30:39 +0000 2019,es,carlos_1377,,"Elecciones europeas: 114 salmantinos votaron a Puigdemont y 126 al “pirata” charro via @LaGacetaSA
https://t.co/m7dQRHoHUL",https://www.lagacetadesalamanca.es/salamanca/elecciones-europeas-114-salmantinos-votaron-a-puigdemont-y-126-al-pirata-charro-BF1070571,,LaGacetaSA,0,3
Wed May 29 12:29:08 +0000 2019,es,Lluisgjf,,"@viclasga @ErnestoSuidry @LibertoPalauSer ¿Quién está detrás de Vector-Scytl, la UTE que gestiona los datos del 26-M?
https://t.co/Hb9OMJJRQv",https://twitter.com/i/web/status/1133711872316850176,,"viclasga, ErnestoSuidry, LibertoPalauSer",2,2
Wed May 29 12:27:03 +0000 2019,es,frandevox,España,"@agustiiniita241 @OrtizPrez @luczesp @vox_es @Santi_ABASCAL @Ortega_Smith @ivanedlm @monasterioR @voxnoticias_es Desde luego que sí.
Hay muchísima gente que se está tragando el bulo de que en estas elecciones hay montones de fallos informáticos que, al corregirse, van a favorecer al PSOE y, sin embargo, el 28A fue todo perfecto, al igual que en las europeas.
BULO TOTAL!!",https://twitter.com/i/web/status/1133711347244576768,,"agustiiniita241, OrtizPrez, luczesp, vox_es, Santi_ABASCAL, Ortega_Smith, ivanedlm, monasterioR, voxnoticias_es",6,10
Wed May 29 12:23:38 +0000 2019,es,Zibelinam,"Mundo, Europa, España","Elecciones europeas, lo que se juega Alemania https://t.co/4axTsPmgge",https://www.larazon.es/internacional/alemania-la-gran-coalicion-se-juega-su-futuro-en-las-urnas-FM23498159,,,0,0
Wed May 29 12:22:17 +0000 2019,es,urjc,"Móstoles, Comunidad de Madrid","Gran participación en el debate sobre los retos de Europa y las elecciones europeas.
ℹ Más información: https://t.co/ArB84cFKzP https://t.co/pNRG08xxTP",https://twitter.com/i/web/status/1133710148113960960,,,4,6
