created_at,lang,screen_name,location,full_text,urls,tags,mentions,retweet_count,favorite_count
Wed May 29 04:58:24 +0000 2019,es,spaincrisis,Sant Esteve de les Roures,"@MundoAres Por eso en algunos países -en las 
Elecciones europeas- hacen circunscripciones regionales para evitar el fraude. Junts no puede enviar apoderados a Cuelgamures pero sí a todos los pueblos de Catalunya.",https://twitter.com/i/web/status/1133598440494120960,,MundoAres,1,4
Wed May 29 04:36:56 +0000 2019,es,BorrullLara,"Valencia, España.","Segundo PUCHERAZO.
 https://t.co/kboeFad6h0",https://eladiofernandez.wordpress.com/2019/05/26/elecciones-municipales-y-europeas-segundo-pucherazo-espana-ya-no-importa-a-nadie-ha-sido-abandonada-a-planes-de-guerra-que-comenzaran-en-ceuta-y-melilla-pero-antes-comenzara-en-grecia-con-credito/,,,0,0
Wed May 29 04:34:28 +0000 2019,es,UTRERAWeb,El Diario Digital de Utrera,Isabel González Blanquero agradece el apoyo recibido por Ciudadanos Utrera durante las elecciones europeas y municipales: UTRERAWeb.  Noticias de Utrera  https://t.co/uSHOF1j8Z7  #Utrera https://t.co/Rlxa6WRAJw,https://twitter.com/i/web/status/1133592420866772997,,,3,4
Wed May 29 04:34:28 +0000 2019,es,UTRERAWeb,El Diario Digital de Utrera,Isabel González Blanquero agradece el apoyo recibido por Ciudadanos Utrera durante las elecciones europeas y municipales: UTRERAWeb.  Noticias de Utrera  https://t.co/uSHOF1j8Z7  #Utrera https://t.co/Rlxa6WRAJw,https://twitter.com/i/web/status/1133592420866772997,,,3,4
Wed May 29 04:28:26 +0000 2019,es,ManuelCumbres,,"El PSOE gana las elecciones europeas en España con el 32% del voto.🌹
➡️ Enlace a la noticia: https://t.co/OueAYx76v3
⏩🌹En Cumbres Mayores también gana el PSOE las elecciones europeas.🌹
Una vez más,🌹“Gracias Cumbres Mayores""🌹, por confiar en el @PSOE🌹#SiempreHaciaDelante/❤️ https://t.co/HPHqxqKs84",https://twitter.com/i/web/status/1133590898841985024,,,0,1
Wed May 29 04:06:45 +0000 2019,es,Flopi_Jackson_,Isla de Pascua - Chile,"☑️B I E N 🇮🇹y 🇭🇺 En Chile tenemos una avalancha de Ilegales comencemos a limpiar la casa🆘🆑🆘🆑 
#DeportarSinPreguntar  
Salvini y Orbán confían en ""limpiar"" Europa de inmigrantes ilegales tras ganar las elecciones europeas https://t.co/iV8NBKyHPH vía @casoaislado_es",https://twitter.com/i/web/status/1133585444636188673,DeportarSinPreguntar,,34,29
Wed May 29 04:06:10 +0000 2019,es,enlagrillacom,Juárez Mexico,"Macron recibe un ""dulce"" castigo en las elecciones europeas https://t.co/UtgGVYbRt9 https://t.co/lY65CqqGtl",http://enlagrilla.com/not_detalle.php?id_n=105326,,,0,0
Wed May 29 04:05:53 +0000 2019,es,enlagrillacom,Juárez Mexico,"Macron recibe un ""dulce"" castigo en las elecciones europeas https://t.co/UtgGVYbRt9 https://t.co/N0hTVCaSW6","http://enlagrilla.com/not_detalle.php?id_n=105326, http://enlagrilla.com/not_detalle.php?id_n=105326#.XO4FARNtPCs.twitter",,,0,0
Wed May 29 04:05:51 +0000 2019,es,enlagrillacom,Juárez Mexico,"Macron recibe un ""dulce"" castigo en las elecciones europeas https://t.co/UtgGVXUgBB https://t.co/St6XHXAveN","http://enlagrilla.com/not_detalle.php?id_n=105326, http://enlagrilla.com/not_detalle.php?id_n=105326#.XO4FA1z-MTM.facebook",,,0,0
Wed May 29 04:04:33 +0000 2019,es,silvias_salas,,"Salvini y Orbán confían en ""limpiar"" Europa de inmigrantes ilegales tras ganar las elecciones europeas https://t.co/lsfIin7Led",https://casoaislado.com/salvini-y-orban-confian-en-limpiar-europa-de-inmigrantes-ilegales-tras-ganar-las-elecciones-europeas/,,,0,1
Wed May 29 04:01:36 +0000 2019,es,NovaVitaHispan,,"@AuthorLeonel @Christian8Pics @RightWingArwen Las elecciones europeas las ganó el partido de Le Pen, en eso les agradezco la prudencia, igual el otro proyecto no se veía mal https://t.co/wmPmauNWjK",https://twitter.com/i/web/status/1133584147715416064,,"AuthorLeonel, Christian8Pics, RightWingArwen",0,1
Wed May 29 03:38:07 +0000 2019,es,LuciaLopezGmez1,,"@pasandoeldia1 @Robi45852533 @CiudadanosCs @abcespana @manuelvalls este fracasado ha metido a C´s en un túnel sin salida... tremendo... y luego ese delirio de adorar a Macron que es el bicho más impopular de Francia, que si chalecos, que si pierde las elecciones europeas....vaya trozo de perdedor",https://twitter.com/i/web/status/1133578238184304640,,"pasandoeldia1, Robi45852533, CiudadanosCs, abcespana, manuelvalls",0,1
Wed May 29 03:31:47 +0000 2019,es,hesuslopezrojas,Donde escuchar y me escuchen,"@Nayoxrepublik1 Recuerda tu: 1.720.000 personas de un censo de 5,4 millones sirven para ganar 5 diputados de 54 en unas elecciones europeas.
Però ja saps que jo vull votar i que vol fer soroll ets tú. Si has canviat d’ideia, fenomenal i ho celebrem",https://twitter.com/i/web/status/1133576643753201664,,Nayoxrepublik1,0,0
Wed May 29 03:30:09 +0000 2019,es,qmunty,Zürich,"Baleares, País Vasco y Madrid: los otros 'graneros' de votos de Puigdemont fuera de Cataluña https://t.co/Nq9bT376Iw",http://j.mp/2wrp3CG,,,0,0
Wed May 29 03:25:00 +0000 2019,es,ATodoMomento_,"Caracas, Venezuela",#Derecha italiana obtuvo amplia victoria en las elecciones europeas https://t.co/Zpqs2McxsW #ATodoMomento,http://bit.ly/2W5ABLg,"Derecha, ATodoMomento",,1,0
Wed May 29 03:23:36 +0000 2019,es,LimaNoticia,"Lima, Peru",#Mundo | El ultraderechista Matteo Salvini triunfó en las elecciones europeas en Italia - Infobae America https://t.co/gWxWxuLEqE https://t.co/JwRUYekP6j,https://twitter.com/i/web/status/1133574586715508741,Mundo,,0,0
Wed May 29 03:02:31 +0000 2019,es,ALZIRALMUNDO,"Alzira (Valencia),(España)","Los pupilos de la élite global, de Rostchild, Rockefeller &amp; Cía, reunidos 24 horas después de las elecciones europeas y a solo días de la próxima reunión Bilderberg. https://t.co/xrr9sICgt7",https://twitter.com/i/web/status/1133569279427796992,,,0,0
Wed May 29 02:55:35 +0000 2019,es,Jon_Cents,"Distrito Federal, México",La ultraderecha ganó las elecciones europeas en Francia https://t.co/tcG5dInERP,https://www.analitica.com/actualidad/actualidad-internacional/la-ultraderecha-gano-las-elecciones-europeas-en-francia/,,,0,0
Wed May 29 02:38:31 +0000 2019,es,Horlo99,,Panorama de las fuerzas que intervienen en las elecciones europeas https://t.co/uFRpKa1GyA,https://www.prensaobrera.com/internacionales/63982-panorama-de-las-fuerzas-que-intervienen-en-las-elecciones-europeas#.XO3wot5rOOo.twitter,,,0,1
Wed May 29 02:19:04 +0000 2019,es,EDWARDRADIO,Mérida Edo. Mérida,Chalecos amarillos protestan en víspera de las elecciones europeas https://t.co/osH8pLDZkZ https://t.co/fSi0d1huHt,http://dlvr.it/R5c59q,,,0,0
Wed May 29 02:19:04 +0000 2019,es,EDWARDRADIO,Mérida Edo. Mérida,Chalecos amarillos protestan en víspera de las elecciones europeas https://t.co/osH8pLDZkZ https://t.co/fSi0d1huHt,http://dlvr.it/R5c59q,,,0,0
Wed May 29 02:13:54 +0000 2019,es,CarlaChamorros,Granada,Marine Le Pen gana las europeas en Francia con dos puntos más que Macron https://t.co/sBtv1OqttH via @ABC_Mundo,https://www.abc.es/internacional/abci-partido-marine-gana-elecciones-europeas-francia-segun-sondeos-201905262011_noticia.html#ns_campaign=rrss-inducido&ns_mchannel=abc-es&ns_source=tw&ns_linkname=noticia.video&ns_fee=0,,abc_mundo,2,5
Wed May 29 02:09:33 +0000 2019,es,AmadoBC,"Ensenada, BC.","El Porqué de las Noticias con @jgabrielgordin
#Trump baja el tono hacia #Irán. Elecciones europeas. Protestas en #Honduras 
@pablojofreleal, Analista Internacional
Francisco José Saavedra, Periodista
@BigQuesada, Analista Internacional
https://t.co/IjoptWvhcT",https://twitter.com/i/web/status/1133555948805599233,"Trump, Irán",jgabrielgordin,2,3
Wed May 29 02:08:33 +0000 2019,es,abelardoolmosme,,https://t.co/Dg9p5NpIj0 Elecciones en Europa un aviso del avance electoral del nacional populismo.,https://mundo.sputniknews.com/firmas/201905271087404454-elecciones-europeas-resultados-derecha/,,,0,0
Wed May 29 01:59:01 +0000 2019,es,DiariodeCaracas,"Caracas, Venezuela",Los liberales ganan elecciones europeas danesas y ultraderecha se derrumba https://t.co/4riSyVIwLO https://t.co/Mb7SdSjxgt,http://j.mp/2Mcztkw,,,0,0
Wed May 29 01:47:24 +0000 2019,es,Axarquia_hoy,"Vélez-Málaga, Andalucía",El PSOE destaca su victoria en Málaga en las elecciones europeas y que es primera fuerza en las municipales en 47 localidades https://t.co/siVpy8E5OP,https://twitter.com/i/web/status/1133550377331245056,,,0,0
Wed May 29 01:45:07 +0000 2019,es,TodoEsPolitic,Ceuta,Los Verdes ganan las elecciones europeas en Alemania https://t.co/vSRaePqPET,https://www.elplural.com/politica/los-verdes-ganan-elecciones-europeas-en-alemania_217199102,,,0,0
Wed May 29 01:40:00 +0000 2019,es,EnClavePolitik,,"Hoy, en @EnClavePolitik, el periodista y escritor @OrlandoPerezEC analizaremos los resultados de las elecciones europeas. https://t.co/vtup5xVsku",https://twitter.com/i/web/status/1133548512489148417,,"EnClavePolitik, OrlandoPerezEC",8,13
Wed May 29 01:35:09 +0000 2019,es,JosueDZ05,,"La candidata de Podemos a Bruselas: ""El cambio climático se debe al colapso de los valores masculinizantes"" | Elecciones europeas 2019 https://t.co/vbVjlAlUpm",https://twitter.com/i/web/status/1133547293582548995,,,0,0
Wed May 29 01:24:01 +0000 2019,es,DiariodeCaracas,"Caracas, Venezuela","Los socialistas españoles ganan elecciones europeas con un 32,9 % https://t.co/0FjmVrXXWG https://t.co/huguPuXrTN",http://j.mp/2YP2GTR,,,0,1
Wed May 29 01:21:19 +0000 2019,es,barderoforever5,🇺🇸🇭🇺🇵🇱🇧🇷🇦🇹🇪🇪🇮🇹,Mientras tanto Salvini despues de las elecciones europeas. https://t.co/LABALEEOg0,,,,1,1
Wed May 29 01:20:18 +0000 2019,es,jpasalf,redondela,"Los socialistas ganan las elecciones europeas en España, con el 82% escrutado - https://t.co/5PtKMExkRe #GoogleAlerts",http://goo.gl/alerts/oiZMv,GoogleAlerts,,0,0
Wed May 29 01:15:24 +0000 2019,es,neutralbad,arg,bueno POR FIN entendí las elecciones parlamentarias europeas gracias a un europeo god bless u.,,,,0,0
Wed May 29 01:15:03 +0000 2019,es,NoticieroHechos,"Antiguo Cuscatlan, El Salvador","El Partido Popular Europeo que perdió 36 escaños en las elecciones europeas, se reunió antes de una cumbre de la UE, donde se decidirá quién debería liderar las instituciones clave del bloque para los próximos cinco años. https://t.co/toSxUG2rji",https://twitter.com/i/web/status/1133542235205722112,,,0,0
Wed May 29 01:09:41 +0000 2019,es,uxo88,España,¿Qué opinas de Amanecer Dorado? — Después de la hostia que se ha dado estas elecciones europeas está bastante jodido. https://t.co/iSr27woC6i,https://twitter.com/i/web/status/1133540882840469504,,,0,0
Wed May 29 01:05:27 +0000 2019,es,paralelo_el,,"🇬🇷Nueva Democracia recupera su trono. La triple convocatoria a la que estaban citados los griegos (Elecciones europeas, regionales y locales) se sintió como un plebiscito hacia Alexis Tsipras y en vista de los resultados, el presidente decidió adelantar las elecciones a junio. https://t.co/DXipUhFYM2",https://twitter.com/i/web/status/1133539817348894720,,,0,0
Wed May 29 01:03:22 +0000 2019,es,paralelo_el,,🇮🇹 Las elecciones europeas confirman la mayoría de partidos euroescépticos y colocan a La Liga como el partido más votado. La formación de Matteo Salvini dobla sus apoyos respecto a las elecciones generales y duplica su ventaja respecto al Movimiento Cinco Estrellas (M5E). https://t.co/tiJxS2vccY,https://twitter.com/i/web/status/1133539291966189568,,,0,0
Wed May 29 01:01:26 +0000 2019,es,paralelo_el,,"🇬🇧 En sus elecciones europeas más atípicas, Reino Unido votó por la opción nacionalista de Nigel Farage. El Partido del Brexit, creado hace solo unos meses, obtuvo el 30,5 % de los votos y pone en un aprieto a la primera ministra británica, Theresa May, que se hunde. https://t.co/H4mhw8yfV2",https://twitter.com/i/web/status/1133538806576107520,,,0,0
Wed May 29 00:59:38 +0000 2019,es,miotepix_veron,"San Isidro, Argentina","ANÁLISIS RESULTADO ELECCIONES 26-M - Municipales, Autonómicas y Europeas https://t.co/ncVgHO6u2l vía @YouTube",https://youtu.be/5SAGxIMafOM,,YouTube,0,0
Wed May 29 00:58:00 +0000 2019,es,rsumen,Concepción,"Este domingo, con las elecciones municipales, regionales y europeas, se jugó el segundo tiempo de un partido que iniciado el 28 de abril con las parlamentarias, 2 elecciones en menos de un mes que redefinirán el mapa político español por unos cuantos años https://t.co/ELqZtPDgWL",https://twitter.com/i/web/status/1133537942977286144,,,0,0
Wed May 29 00:53:43 +0000 2019,es,paralelo_el,,🇪🇺Esta semana analizamos qué ha ocurrido en las elecciones europeas de los países de nuestro entorno. https://t.co/YFg9IeY0gy,https://elparaleloint.wixsite.com/elparalelo/inicio/elecciones-europeas-qu%C3%A9-ha-sucedido-en-los-pa%C3%ADses-de-nuestro-entorno,,,0,0
Wed May 29 00:53:40 +0000 2019,es,FabrizioLorusso,Messico,Trotamundos político: Elecciones europeas 2019 https://t.co/vOAunm3JQ7 via @YouTube,https://youtu.be/-TQXIGRlSDQ,,YouTube,0,1
Wed May 29 00:52:37 +0000 2019,es,GuadalupeJanne6,,La prima de riesgo italiana roza los 290 puntos básicos tras la victoria de la Liga en las elecciones europeas https://t.co/mKbr1hMVT9 via @elEconomistaes @Enrique_GDP,https://twitter.com/i/web/status/1133536589022236672,,,0,1
Wed May 29 00:50:52 +0000 2019,es,ecotvpanama,Panamá,La emergencia ecológica es un mensaje fuerte de las elecciones europeas https://t.co/4gDuXolVpM,http://www.ecotvpanama.com/actualidad/la-emergencia-ecologica-es-un-mensaje-fuerte-de-las-elecciones-europeas_0_34793/#.XO3XZiHv16M.twitter,,,0,0
Wed May 29 00:40:00 +0000 2019,es,maduradascom,"Caracas, Distrito Capital",¡ENTÉRESE! Los socialistas españoles del PSOE ganan las elecciones europeas este #26May (+Video) #Venezuela #28Mayo  https://t.co/pBelKrp1ZP,http://bit.ly/2HD7plR,"26May, Venezuela, 28Mayo",,2,0
Wed May 29 00:35:00 +0000 2019,es,lajornadaonline,México,"#Infografía Partidos euroescépticos gozaron de un significativo impulso en las elecciones europeas, cuando muchos votantes abandonaron los bloques tradicionales de centroizquierda y centroderecha que han dominado la política de la Unión Europea durante 40 años. https://t.co/0KBQZ6vidR",https://twitter.com/i/web/status/1133532154351112192,Infografía,,4,13
Wed May 29 00:34:10 +0000 2019,es,consulborrego,,Resultado de las elecciones europeas por países https://t.co/3Y524kIHaS vía @elpais_inter,https://elpais.com/internacional/2019/05/26/actualidad/1558887557_711798.html?id_externo_rsoc=TW_CC,,elpais_inter,0,1
Wed May 29 00:31:19 +0000 2019,es,DanielNavasSund,Barcelona,La batalla política por Francia se libra en las elecciones europeas - El Orden Mundial - EOM https://t.co/ChCqNTCbog vía @elordenmundial,https://elordenmundial.com/la-batalla-politica-por-francia-se-libra-en-las-elecciones-europeas/,,elOrdenMundial,0,0
Wed May 29 00:30:00 +0000 2019,es,Notas_arg,,#UnionEuropea | Elecciones europeas: la derecha se impuso en cuatro países clave https://t.co/Vem3M8aaPu por @Martinraschin https://t.co/Kr65P5fkb0,"https://wp.me/p4sdyK-j8f, https://twitter.com/i/web/status/1133530896915730432",UnionEuropea,,0,0
Wed May 29 00:18:43 +0000 2019,es,DiarioSUR,Málaga,#EleccionesEuropeas #26M 🗳️ Los progresistas inician el asalto a la Comisión. Nos lo cuenta @sarroyo71  https://t.co/MegCRcCwv5,https://www.diariosur.es/elecciones/europeas/progresistas-inician-asalto-comision-20190529233433-ntrc.html#ns_campaign=jcbt&ns_mchannel=diariosur&ns_source=tw&ns_linkname=ltl&1559089123,"EleccionesEuropeas, 26M",sarroyo71,0,1
Wed May 29 00:08:13 +0000 2019,es,ciudadanoRASO,♟estadoLLANO♙♟,"@enlafronteratv @pardodevera @MonederoJC Se ha dado por amortizada la corrupción aunque el PSOE lo puede necesitar para el ""y tú más"" corrupto y el ""y tú menos"" responsable. El PP conserva Madrid, entró recién en Andalucía y recibe oxígeno de las elecciones europeas. Es la 2ª fuerza parlamentaria. No hay sorpasso de Cs.",https://twitter.com/i/web/status/1133525413966352386,,"enlafronteratv, pardodevera, MonederoJC",3,1
Wed May 29 00:05:00 +0000 2019,es,alnaviocom,Iberoamérica,Las elecciones europeas demostraron que hay 6.000 españoles que creen en el fin de la muerte https://t.co/BQ4aCrxMfp,https://alnavio.com/noticia/18854/actualidad/mas-de-6.000-espanoles-votaron-para-vencer-a-la-muerte-en-las-elecciones-europeas.html,,,2,2
Tue May 28 23:59:40 +0000 2019,es,cuin1425,"Ayamonte, España","Interior reconoce que la empresa encargada del recuento de las pasadas elecciones europeas, municipales y autonómicas del 26-M incurrió en fallos a la hora de volcar los... https://t.co/IlwOaQTg2V",https://twitter.com/i/web/status/1133523261747343360,,,0,0
Tue May 28 23:58:15 +0000 2019,es,erickbecerra1,"Puebla, México.",#Opinión de @Jacinto_HS @Puebla_IEE Elecciones europeas 2019  https://t.co/Zlv0tST7GS https://t.co/qICBcJ52y1,https://erickbecerra.com/elecciones-europeas-2019/,Opinión,"Jacinto_HS, Puebla_IEE",1,1
Tue May 28 23:58:04 +0000 2019,es,verina1984,Panamá Oeste,Macron: La emergencia ecológica es un ‘mensaje muy fuerte’ de las elecciones europeas https://t.co/cdtw1jFrC5 https://t.co/doOSVn9UfS,http://dlvr.it/R5brvL,,,0,0
Tue May 28 23:51:53 +0000 2019,es,blanca_mar2004,"Puebla,Pue y Lerma, edo de Mex",Elecciones europeas: Se aleja el fantasma del populismo https://t.co/DSDNxP2Drr,https://es.aleteia.org/2019/05/28/elecciones-europeas-se-aleja-el-fantasma-del-populismo/,,,0,0
Tue May 28 23:50:25 +0000 2019,es,Perra_Calata,"La Haya, Holanda","En Europa ha ganado la extrema derecha estas ultima elecciones europeas.
Esta d emorda por todo el planeta.
Aqui los nazis de Perú ya se prep.......ajajjaja...es broma https://t.co/1maND5AYhP",https://twitter.com/i/web/status/1133520937435959296,,,0,1
Tue May 28 23:47:46 +0000 2019,es,aneshali,España,La extrema derecha de Le Pen se adueña del voto obrero https://t.co/n0FyiBn57P vía @ABC_Mundo,https://www.abc.es/internacional/abci-elecciones-europeas-extrema-derecha-aduena-voto-obrero-201905280137_noticia.html#ns_campaign=amp-rrss-inducido&ns_mchannel=abc-es&ns_source=tw&ns_linkname=noticia.foto&ns_fee=0,,abc_mundo,1,0
Tue May 28 23:44:36 +0000 2019,es,Egaroni,Tabarnia - Ponferrada - Mallorca,"@states_spain @sanchezcastejon @EmmanuelMacron Los garantes de la unidad nacional e integridad de España son la CE y la Resolución 1514 de la ONU. Ni Francia, ni Macron. Es más, Macron ahora mismo debería prodigarse más en la humildad, porque Sánchez es posible que se esté confundiendo de chantajista: https://t.co/voaJJ0nCGg",https://twitter.com/i/web/status/1133519470415233024,,"states_spain, sanchezcastejon, EmmanuelMacron",0,0
Tue May 28 23:30:03 +0000 2019,es,Rosell_Surfer,,"Con novedades en el frente: Apenas silenciado el oropel o la “tormenta local severa” de las elecciones europeas, en la tamiz quedan varias piedras. Algunas son grandecitas y no atañen a un solo país. Si se mira con relativa preocupación que Marine Le Pen… https://t.co/w8IBrpqOtj https://t.co/zkRqeNqvwe",https://twitter.com/i/web/status/1133515811031674881,,,0,0
Tue May 28 23:27:01 +0000 2019,es,Karol_en_Red,Nearby,@ggohom @alfredo_hurtado @Rosa_in_Mundo @AmalCandanguera @Harkonen_1 @orhpositivoatak @kalindama @Larissacostas @carvajalinop @lubrio @planwac @QueraElse @carollafra @MariaesPueblo @LaHojillaenTV @GBorgesRevilla @williamserafino @ErikaOSanoja @tongorocho @LOQUEDIGAELFMI @Anti_otan1984 @alacarga2017 @LailaTajeldine @BasemTajeldine @gabrielrufian @PedroKonductaz @mangozurda @RicardoGZK @CELAGeopolitica @Pablo_Iglesias_ @ierrejon @dcabellor @JuanMarinoTPR @luciateleSUR @carolyshelena @Hernancanorea @MonederoJC @MarcioVargasA @Marco_Teruggi @madeleintlSUR @TarekWiliamSaab @aran_tirado @latablablog @mmendizabal1 @MVTARDE @sextaNoticias @laSextaTV El Grupo de Contacto morirá con los cambios de las elecciones europeas en unas semanas.,https://twitter.com/i/web/status/1133515047949541379,,"ggohom, alfredo_hurtado, Rosa_in_Mundo, AmalCandanguera, Harkonen_1, orhpositivoatak, kalindama, Larissacostas",0,1
Tue May 28 23:23:36 +0000 2019,es,sumariumcom,Venezuela / España (+34 657821628),"📌 El presidente del Consejo europeo, Donald Tusk, asegura que los resultados de las elecciones 🗳 europeas muestran el apoyo masivo de los europeos a una UE 🇪🇺 ""fuerte y unida"" frente a quienes quieren debilitarla.",https://twitter.com/i/web/status/1133514185676083200,,,2,2
Tue May 28 23:19:22 +0000 2019,es,MILANJHAIR,La Paz Bolivia,"que felicidad, ya no mas terroristas musulmanes, piratas etc en francia https://t.co/MnA2mkOTJ2",https://www.cronica.com.ar/mundo/Duro-derechazo-Le-Pen-derroto-a-Macron-en-elecciones-europeas-20190527-0009.html?fbclid=IwAR3bt8sYvlJ93IpEf8YOK2NI92FZclSC6aDimSiEJBlwClhCe62AsShKlBY,,,0,0
Tue May 28 23:16:54 +0000 2019,es,FLXJ_70,"Alicante, Comunidad Valenciana",Este Pedro va a ser algo más listo de los que muchos piensan. Elecciones Europeas: Socialistas y liberales se alían para quitar al PPE el mando en la Comisión | Internacional | EL PAÍS https://t.co/1WcjP3YzAg,https://twitter.com/i/web/status/1133512499893026822,,,0,0
Tue May 28 23:13:14 +0000 2019,es,MariaCalleSanti,Madrid,"@PartidoPACMA Estaba leyendo antes que la gente no sabía si PACMA había crecido o no había crecido.  Soy apoderada desde el 2014 en las elecciones Europeas, Municipales y Autonómicas y os dejo esto.. Ánimo seguiremos luchando por ellos... https://t.co/3sCpiFgbtX",https://twitter.com/i/web/status/1133511576395374592,,PartidoPACMA,0,0
Tue May 28 23:08:03 +0000 2019,es,Mayka41328150,España,"@bossssito @Enigma25799141 @currante_rojo @Pablo_Iglesias_ @vox_es @Igarrigavaz Te refieres a gente así 
https://t.co/y6rSHKYEqH
https://t.co/4WY75AMcX7 anda que menudas joyas 😂😂😂😂😂 para ti todos",https://twitter.com/i/web/status/1133510274886053888,,"bossssito, Enigma25799141, currante_rojo, Pablo_Iglesias_, vox_es, Igarrigavaz",0,0
Tue May 28 23:06:08 +0000 2019,es,CarinesMoncada,OpinionsMyOwn.RTsNotEndorsment,"#CadaTardeTitulares ||Los partidos de derecha capturaron la comunidad de Madrid y la alcaldia de la ciudad en las elecciones europeas celebradas este fin de semana.
#28Mayo",https://twitter.com/i/web/status/1133509790754312193,CadaTardeTitulares,,1,5
Tue May 28 23:05:57 +0000 2019,es,paleman_am,Querétaro,"#Entérate #EstrategiaInfo Internacional, Kosovo.- LOS SOCIALDEMÓCRATAS GANAN LAS ELECCIONES EUROPEAS EN HOLANDA. https://t.co/VWVmlbtVfl https://t.co/CXSyI13Rzw",https://twitter.com/i/web/status/1133509747129425920,"Entérate, EstrategiaInfo",,0,0
Tue May 28 23:05:17 +0000 2019,es,aloap_onerom,"Tarifa, España",El carácter de Luke Stagnetto invade Gibraltar https://t.co/THrSnRoMjg vía @europa_sur,https://www.europasur.es/_50fa0c83,,europa_sur,0,0
Tue May 28 23:01:57 +0000 2019,es,gavdivm,México,Asi están los resultados en la Unión Europea. https://t.co/Ia6IGU1who,https://oal.lu/OlBaS,,,0,0
Tue May 28 23:00:31 +0000 2019,es,Cambio16,"Madrid, España","Los dos principales partidos británicos prometieron trabajar para resolver el bloqueo del Brexit, con la esperanza de recuperar a los votantes que los abandonaron por un nuevo movimiento liderado por el euroescéptico Nigel Farage en las elecciones europeas https://t.co/GY7QZoOEyC https://t.co/rFPSxC4eXW",https://twitter.com/i/web/status/1133508377642971136,,,0,0
Tue May 28 23:00:05 +0000 2019,es,Analitica,"Caracas, Venezuela",López resultó elegido como independiente en la lista del Partido Popular (conservador) en las elecciones europeas del domingo #28May https://t.co/a334WBBJht,https://twitter.com/i/web/status/1133508266707824643,,,0,1
Tue May 28 22:57:08 +0000 2019,es,reformainter,México,"El Premier griego, Alexis Tsipras, convocó a elecciones parlamentarias tras derrota de su partido en las europeas frente a conservadores. https://t.co/SwkLjr9PQX",https://twitter.com/i/web/status/1133507524722876417,,,0,0
Tue May 28 22:50:43 +0000 2019,es,FELIBERTY,PUERTO RICO,Resultados elecciones europeas 2019 https://t.co/44vBe6ccdp vía @epinternacional,https://www.europapress.es/internacional/noticia-resultados-elecciones-europeas-2019-20190526210348.html,,EPinternacional,0,0
Tue May 28 22:48:57 +0000 2019,es,FELIBERTY,PUERTO RICO,"El PPE gana las europeas con 173 escaños, seguido de los socialistas con 147, según datos preliminares https://t.co/RBybmtnH2W vía @epinternacional",https://twitter.com/i/web/status/1133505466225577984,,,0,0
Tue May 28 22:47:34 +0000 2019,es,EDWARDRADIO,Mérida Edo. Mérida,"Eslovaquia, Malta y Letonia se suman a elecciones europeas https://t.co/w7YK6zIxDv https://t.co/DicKy8EGV5",http://dlvr.it/R5bjtV,,,0,0
Tue May 28 22:45:37 +0000 2019,es,teleSURtv,Caracas,"Líderes europeos se reúnen en Bélgica para renovar la Unión Europea https://t.co/fLap9aCI3a
 
Los jefes de Estado y de Gobierno de la UE celebraron este martes una cumbre extraordinaria, tras las elecciones europeas https://t.co/32DKWRwLds","http://bit.ly/2WwRDBj, https://twitter.com/i/web/status/1133504628375605250",,,7,6
Tue May 28 22:44:34 +0000 2019,es,TeleTaxiTF,Santa Cruz de Tenerife,"López Aguilar: ""No me alegra ser la única voz canaria en la Eurocámara"" https://t.co/VaPDCyPcEL Vía @la_opinion https://t.co/VWnhbpgsGq",http://dlvr.it/R5bjYt,,la_opinion,0,0
Tue May 28 22:44:10 +0000 2019,es,churchilla71,"Madrigal de las Altas Torres,","Alguien sabe lo que ha pasado con las elecciones europeas,no sale en los medios???????????...dicen las buenas lenguas que están ganando los conservadores y megaconsevadores por ahí.",https://twitter.com/i/web/status/1133504261235593216,,,7,25
Tue May 28 22:39:14 +0000 2019,es,ldga123456,,BBC News Mundo - Brexit: qué dicen las elecciones europeas sobre la salida del Reino Unido de la Unión Europea https://t.co/JEOviMtSYd,https://www.bbc.com/mundo/noticias-internacional-48422341,,,0,0
