created_at,lang,screen_name,location,full_text,urls,tags,mentions,retweet_count,favorite_count
Tue May 28 08:13:25 +0000 2019,nl,EPinNL,"Den Haag, Nederland",Wat gebeurt er na de Europese verkiezingen? In juli stemmen de nieuwe Europarlementariërs over de voorzitter van de Europese Commissie. Meer info: https://t.co/23hwuje8G6 #EP2019 #EuropeseVerkiezingen,https://twitter.com/i/web/status/1133285133446987776,,,4,1
Tue May 28 08:10:33 +0000 2019,nl,abflipse,Holland,"50,5% v.d. ruim 400 miljoen stemgerechtigde Europeanen hebben hun stem uitgebracht. Vooral de grensoverschrijdende thema's waaronder migratie, belastingontwijking, klimaat en de Unie zelf zorgden voor deze hoge opkomst. https://t.co/N72TqMYoA3 via @Knack",https://twitter.com/i/web/status/1133284409052925952,,,2,2
Tue May 28 08:10:17 +0000 2019,nl,Hellas_nieuws,Greece & The Netherlands,Europese verkiezingen 2019: extreemrechts en groenen rukken op ten koste van traditionele partijen - newsmonkey https://t.co/aUYJ64CD61,https://newsmonkey.be/europese-verkiezingen-2019-extreemrechts-en-groenen-rukken-op-ten-koste-van-traditionele-partijen/,,,0,0
Tue May 28 08:05:29 +0000 2019,nl,tijnsadee,Brussel,"Wordt het Weber, Timmermans of een vrouw uit een klein Oost-Europees land? Wie wint de strijd om de Brusselse macht? In 17 vragen praat NRC je bij: https://t.co/XMEAjDGdjt @WilmerHeck @renemoerland @alonsoNRC @LamyaeA @CarolineGruyter @mgarschagen @mwleijendekker @claudiakammer",https://twitter.com/i/web/status/1133283136442425344,,,6,0
Tue May 28 08:02:00 +0000 2019,nl,lelystad_online,Lelystad,Europese #verkiezingen: #PvdA grootste in #Lelystad https://t.co/1e94MYL3F2 gedeeld door @lelystad_online,https://flevopost.nl/artikel/1021022/europese-verkiezingen-pvda-grootste-in-lelystad.html,"verkiezingen, PvdA, Lelystad",lelystad_online,0,0
Tue May 28 08:00:16 +0000 2019,nl,FrankSlegers,Utrecht,"Voor Herman Michiel vormen de Europese verkiezingen een mooie röntgenfoto van wat in de maatschappij leeft. #EP2019 #EuropeanElectionResults 
https://t.co/41PgmJlig0",https://twitter.com/i/web/status/1133281822274727941,EP2019,,0,0
Tue May 28 08:00:08 +0000 2019,nl,marchabing,,"Weer dreun voor Wilders, dus in zijn achterban borrelt het https://t.co/GvisCC0Cl5",https://www.ad.nl/dossier-europese-verkiezingen/weer-dreun-voor-wilders-dus-in-zijn-achterban-borrelt-het~a266f9cd09/?utm_source=twitter&utm_medium=social&utm_campaign=socialsharing_web,,,0,1
Tue May 28 07:59:57 +0000 2019,nl,MarjorieRijkse,Den Haag,"De Europese verkiezingen zijn achter de rug. Wat betekent de verkiezingsuitslag en het vertrek van de Britse premier #May voor #Brexit? Leon Kanters, Brexit-expert KPMG Meijburg &amp; Co, licht de status toe.https://t.co/MpBMUMnt9l",https://twitter.com/i/web/status/1133281741056094208,,,0,0
Tue May 28 07:49:24 +0000 2019,nl,PolPoll3,NL,"De PVV haalde nul zetels bij de Europese Verkiezingen. Na de brexit krijgt de PVV er één.  Ze hadden vier zetels.

Wat moet Geert Wilders doen volgens jou?

#EuropeseVerkiezingen #pvv",https://twitter.com/i/web/status/1133279089064849408,,,0,0
Tue May 28 07:45:58 +0000 2019,nl,paulbrasser,"Amsterdam, The Netherlands",De Europese verkiezingen zijn achter de rug. Wat betekent de verkiezingsuitslag en het vertrek van de Britse premier #May voor #Brexit? Leon Kanters licht de status toe. #deal #nodeal #uk #elections #EU https://t.co/pY4aNmbNYg,https://twitter.com/i/web/status/1133278223985303553,,,0,0
Tue May 28 07:45:57 +0000 2019,nl,PolPoll3,NL,"Na de nederlaag bij de Europese Verkiezingen gaat Ron Meyer van de #sp zich niet meer verkiesbaar stellen voor een volgende termijn als voorzitter.

Wat is je mening hierover?",https://twitter.com/i/web/status/1133278220856561664,sp,,0,0
Tue May 28 07:45:44 +0000 2019,nl,_pvda,,#PvdA winnaar Europese verkiezingen Bergen https://t.co/BuYJ9A2EGF De opkomst voor de Europese verkiezingen was in de gemeente Bergen zo&amp;acute;n 15 procent lager dan het landelijk gemiddelde....,"http://bit.ly/2WqGYrT, https://twitter.com/i/web/status/1133278164552167424",PvdA,,0,0
Tue May 28 07:44:43 +0000 2019,nl,Meijel24,,Definitieve uitslag Europese Verkiezingen @gempeelenmaas https://t.co/2CfVY5w3tU https://t.co/P3DUQJC72r,https://meijel24.nl/2019/05/28/definitieve-uitslag-europese-verkiezingen/,,gempeelenmaas,0,0
Tue May 28 07:44:10 +0000 2019,nl,gouweijssel,Zuidplas,Zevenhuizen slaat stembus massaal over bij Europese verkiezingen  https://t.co/ZotKIfyNLG,https://gouweijsselnieuws.nl/2019/05/28/zevenhuizen-slaat-stembus-massaal-over-bij-europese-verkiezingen/,,,1,0
Tue May 28 07:42:10 +0000 2019,nl,_Venray,,#PvdA winnaar Europese verkiezingen Bergen https://t.co/LcMwXq1fl9 De opkomst voor de Europese verkiezingen was in de gemeente Bergen zo&amp;acute;n 15 procent lager dan het landelijk gemiddelde....,"http://bit.ly/2YOkPRV, https://twitter.com/i/web/status/1133277265784127488",PvdA,,0,0
Tue May 28 07:40:17 +0000 2019,nl,PetrusNelissen,"Oss, Nederland",Een prachtig begin van de dag voor de Europese verkiezingen in #Maren-Kessel op 23 mei 2019. #oss #kroniekoss #maasgemeente #netherlands #noordbrabant #meijerij #streetphotography #photosociology #photoanthropology… https://t.co/ezOMlwEqGB,https://twitter.com/i/web/status/1133276793685839873,"Maren, oss, kroniekoss",,0,0
Tue May 28 07:36:19 +0000 2019,nl,cda_nieuws,,#PvdA winnaar Europese verkiezingen Bergen https://t.co/eFiISETfTD De opkomst voor de Europese verkiezingen was in de gemeente Bergen zo&amp;acute;n 15 procent lager dan het landelijk gemiddelde....,"http://bit.ly/2Ws2jBg, https://twitter.com/i/web/status/1133275796980871168",PvdA,,0,0
Tue May 28 07:31:51 +0000 2019,nl,KPMG_NL,Netherlands,"De Europese verkiezingen zijn achter de rug. Wat betekent de verkiezingsuitslag en het vertrek van de Britse premier #May voor #Brexit? Leon Kanters, Brexit-expert @KPMG_Meijburg, licht de status toe. @NBCC, @VNONCW https://t.co/ARFNuKghHd",https://twitter.com/i/web/status/1133274670470500353,,,3,2
Tue May 28 07:28:08 +0000 2019,nl,Gem_OostGelre,"Oost Gelre, Echt Achterhoek","Alle stemmen in de gemeente Oost Gelre zijn geteld. Daarmee is de uitslag verkiezingen Europees Parlement voor de gemeente Oost Gelre officieel.

De uitslag is opgenomen in een proces-verbaal. Die kunt u downloaden op onze website: https://t.co/BldPG9cdMI https://t.co/VjEZqYimL8",https://twitter.com/i/web/status/1133273736533237761,,,0,1
Tue May 28 07:26:42 +0000 2019,nl,Maaslandradio,"Nieuw-Bergen, Bergen",PvdA winnaar Europese verkiezingen Bergen - De opkomst voor de Europese verkiezingen was in de gemeente Bergen zo' https://t.co/r2KymeLSU9,http://bit.ly/2MmV3Tc,,,0,0
Tue May 28 07:21:32 +0000 2019,nl,020amstelveen,,Voorlopige uitslag Europese verkiezingen: GroenLinks grootste in de stad https://t.co/XVWckMpHO9,https://020amstelveen.nl/voorlopige-uitslag-europese-verkiezingen-groenlinks-grootste-in-de-stad/?utm_source=ReviveOldPost&utm_medium=social&utm_campaign=ReviveOldPost,,,0,0
Tue May 28 07:16:51 +0000 2019,nl,largitio,,@Zulianello_M Oude links populistische partijen hebben ten opzichte van 2014 vrijwel allemaal verloren in deze Europese verkiezingen.  Is dus ook een Europese trend. @SPnl,https://twitter.com/i/web/status/1133270896225996800,,Zulianello_M,0,0
Tue May 28 07:11:26 +0000 2019,nl,cda_nieuws,,"#CDA en #VVD grootsten in regio https://t.co/N8ITNTJm22 Net als in #Woerden is het #CDA ook in drie van onze buurgemeenten de winnaar van de Europese verkiezingen. In #Bodegraven-#Reeuwijk,...","http://bit.ly/2K9wW7O, https://twitter.com/i/web/status/1133269533421166592","CDA, VVD, Woerden, CDA",,0,0
Tue May 28 07:11:00 +0000 2019,nl,kiliandejager,,"Europa polariseert: extreemrechts groeit, maar pro-Europese partijen winnen verkiezingen https://t.co/jsoZiCVsw3",https://buff.ly/2YTwbE9,,,0,0
Tue May 28 07:06:03 +0000 2019,nl,_pvda,,Europese verkiezingen: zo stemde #Helmond https://t.co/mTJc34hk8V De Europese Parlementsverkiezingen 2019 zitten erop en de stemmen zijn geteld. Zo stemde #Helmond: #PvdA grootste partij In de gemeente...,"http://bit.ly/2HJCmoN, https://twitter.com/i/web/status/1133268179713765376",Helmond,,0,0
Tue May 28 07:06:03 +0000 2019,nl,_pvda,,Frans Timmermans schudt ook Maas en Waal op https://t.co/BPNNDDkd0J WIJCHEN/ BEUNINGEN/ DRUTEN/ WEST MAAS EN WAAL - Ook het Land van Maas en Waal is bij de Europese verkiezingen als een blok...,"http://bit.ly/2YSEwbk, https://twitter.com/i/web/status/1133268177369092096",,,0,0
Tue May 28 07:04:26 +0000 2019,nl,qlaun,Veghel ,"@EenVandaag @PvdA @LodewijkA De winst bij de Europese verkiezingen zijn niet op het conto van Ascher te schrijven, maar hij gedraagt zich nu wel zo, Lodewijk zou beter pas op de plaats maken, anders wordt hij bij de volgende verkiezingen afgestraft.",https://twitter.com/i/web/status/1133267770391617538,,"EenVandaag, PvdA, LodewijkA",0,0
Tue May 28 07:00:18 +0000 2019,nl,EP_Belgium,Brussels,#EUverkiezingen2019 : wat gebeurt er na de Europese verkiezingen? Bekijk het in onze infografiek ➡️https://t.co/mrmIKdqpVF https://t.co/yUrpYmFA4U,https://twitter.com/i/web/status/1133266732322304000,EUverkiezingen2019,,0,0
Tue May 28 06:59:07 +0000 2019,nl,bvdstock,,"@TinekeSenf @jesseklaver @henribeunders Onzin. Het verlies van de groenen dateert van voor Greta, met dieptepunt tijdens de parlementsverkiezingen in september 2018: 4,4%. Sinds Greta veren ze weer spectaculair op, met nu 11,4% in de Europese verkiezingen.",https://twitter.com/i/web/status/1133266434841300994,,"TinekeSenf, jesseklaver, henribeunders",1,0
Tue May 28 06:57:00 +0000 2019,nl,harbrinkhoek_nl,Harbrinkhoek - Mariaparochie,"De uitslag van de Europese verkiezingen in de @Gem_Tubbergen. Bekijk meer via Tubantia: https://t.co/5YLwM7h6js
De uitslag per kandidaat: https://t.co/2XJxdHyoR2. Annie Schreijer behaalde in Tubbergen 3128 stemmen, Bart Groothuis behaalde er 344","https://www.tubantia.nl/regio/hoe-stemde-twente-bekijk-hier-de-uitslagen-in-jouw-gemeente~adfd3dff/, https://twitter.com/i/web/status/1133265901543940096",,Gem_Tubbergen,0,0
Tue May 28 06:55:21 +0000 2019,nl,KPMG_Meijburg,,"De Europese verkiezingen zijn achter de rug. Wat betekent de verkiezingsuitslag en het vertrek van de Britse premier May voor Brexit? Leon Kanters, Brexit-expert KPMG Meijburg &amp; Co, licht de status toe. @KPMG_NL, @NBCC, @VNONCW https://t.co/LulY9c02xn https://t.co/xJUki7IklJ",https://twitter.com/i/web/status/1133265484395307009,,,0,1
Tue May 28 06:55:21 +0000 2019,nl,KPMG_Meijburg,,"De Europese verkiezingen zijn achter de rug. Wat betekent de verkiezingsuitslag en het vertrek van de Britse premier May voor Brexit? Leon Kanters, Brexit-expert KPMG Meijburg &amp; Co, licht de status toe. @KPMG_NL, @NBCC, @VNONCW https://t.co/LulY9c02xn https://t.co/xJUki7IklJ",https://twitter.com/i/web/status/1133265484395307009,,,0,1
Tue May 28 06:54:00 +0000 2019,nl,hvlint,amsterdam,Zeventien vragen over de uitslagen van de Europese verkiezingen https://t.co/1t5lBpJAo3 Via @nrc,https://buff.ly/2HFu4xV,,nrc,0,0
Tue May 28 06:51:33 +0000 2019,nl,mondiaalnieuws,"Belgium, Brussels","Europa polariseert: extreemrechts groeit, maar pro-Europese partijen winnen Europese verkiezingen. Analyse van @VRIJHEIDenGELUK en @MissTie https://t.co/XRNZ5IxFY6 https://t.co/iM0lWEwRrq",https://twitter.com/i/web/status/1133264531109634048,,,0,2
Tue May 28 06:50:48 +0000 2019,nl,ChrisAalberts,In een waterschap,Ik volg sinds een paar dagen een hoogleraar politicologie op Twitter. De commentaren over de Europese verkiezingen van die hoogleraar klinken hetzelfde als die van een journalist. Wat daarvan te vinden.,https://twitter.com/i/web/status/1133264341531353088,,,1,3
Tue May 28 06:47:43 +0000 2019,nl,arnoyuma,"Lelystad, Nederland",Bekende PVV-bolwerken dumpen Wilders massaal in Europese verkiezingen https://t.co/D1TKawmeu6 via @TPOnl,https://tpo.nl/2019/05/27/bekende-pvv-bolwerken-dumpen-wilders-massaal-in-europese-verkiezingen/?utm_source=twitter&utm_medium=social&utm_campaign=sharing_standard,,TPOnl,0,0
Tue May 28 06:44:41 +0000 2019,nl,sonowelmoed,"London, England","Die Europese verkiezingen dat voelt in DE, UK, FR toch wel heel rechts hea. In NL is het nog goed maar het doet allemaal wel een beetje DE circa 1930ish aan.",https://twitter.com/i/web/status/1133262802389544960,,,0,0
Tue May 28 06:42:57 +0000 2019,nl,Wenters_Nu,Winterswijk,"Afgezien van Doesburg, had Winterswijk de hoogste Gelderse PvdA-score bij de Europese verkiezingen. Als ik al die cijfertjes in de gauwigheid goed visueel gescand heb tenminste. #winterswijk #pvda @pvda",https://twitter.com/i/web/status/1133262363828867072,,,2,5
Tue May 28 06:35:59 +0000 2019,nl,Resoundeffects,Heerlen (Zlb),De opvallendste politieke verschuivingen in Europese lidstaten https://t.co/rkob1LD224 via @NUnl,https://www.nu.nl/europese-verkiezingen-2019/5909838/de-opvallendste-politieke-verschuivingen-in-europese-lidstaten.html,,NUnl,0,0
Tue May 28 06:35:59 +0000 2019,nl,marctimmermans,Utrecht,"Goede genuanceerde (en bescheiden, kom daar nog maar eens om) analyse van @trouwschmidt. https://t.co/XsXYvtj7kJ",https://www.trouw.nl/democratie/de-conclusie-na-de-europese-verkiezingen-welkom-in-het-parlement-zonder-mening~a8370ad2/,,trouwschmidt,0,1
Tue May 28 06:35:33 +0000 2019,nl,SchagenCentraal,Schagen,GEMEENTENIEUWS:  Uitslag Europese verkiezingen gemeente Schagen https://t.co/cB35gN2h14 https://t.co/MGu385aciV,http://dlvr.it/R5XxHv,,,0,0
Tue May 28 06:35:33 +0000 2019,nl,NrdkopCentraal,,GEMEENTENIEUWS:  Uitslag Europese verkiezingen gemeente Schagen https://t.co/C86bvA9871 https://t.co/ghTdA5blCY,http://dlvr.it/R5XxHq,,,0,0
Tue May 28 06:33:41 +0000 2019,nl,GieGoris,,"Europa polariseert: extreemrechts groeit, maar pro-Europese partijen winnen verkiezingen - MO* https://t.co/rIf9mQkf35 via @mondiaalnieuws",https://www.mo.be/analyse/europa-polariseert-extreemrechts-wint-pro-europese-partijen-winnen-meer,,mondiaalnieuws,2,7
Tue May 28 06:30:43 +0000 2019,nl,DoutjeLettinga,"Amsterdam, the Netherlands","""Groenen, liberalen en eurosceptici, die er nooit echt tussen kwamen, krijgen ruimte. ..Sommigen vinden dit eng. Anderen spreken van ‘fragmentatie’. Maar je kunt ook zeggen: Europa wordt nu van iedereen."" @CarolineGruyter over #EP2019 uitslag in @nrc : https://t.co/lOIS5Sv3vd",https://twitter.com/i/web/status/1133259287973834752,,,0,0
Tue May 28 06:29:59 +0000 2019,nl,mwleijendekker,,Definitieve resultaten van Europese verkiezingen in Italië plus vergelijking met 2014 en 2018 https://t.co/q7Z85B4xXU,,,,0,0
Tue May 28 06:29:03 +0000 2019,nl,XavierAerts,Belgium,Europa is niet dood: dit zijn de belangrijkste conclusies na de Europese verkiezingen https://t.co/m0dVOsuHB8 via @nieuwsblad_be,https://www.nieuwsblad.be/cnt/dmf20190527_04432675,,Nieuwsblad_be,0,0
Tue May 28 06:27:43 +0000 2019,nl,PeterLegroe,,"""Zo snel na de verkiezingen al een Europese top. Dan moet het wel over de postjes gaan""
@vrtnws #deochtend @radio1be doet zijn best om de anti-politiek tegen te gaan 😐",https://twitter.com/i/web/status/1133258530667016192,deochtend,vrtnws,1,6
Tue May 28 06:21:14 +0000 2019,nl,JensFranssen,"Brussel, België",Vacatures in Europa: hoe worden de topfuncties verdeeld na de Europese verkiezingen? | VRT NWS https://t.co/sGfnEwqAzi,https://www.vrt.be/vrtnws/nl/2019/05/27/wat-na-de-europese-verkiezingen.html/,,,2,0
Tue May 28 06:18:52 +0000 2019,nl,BrunoTheBridge,EU/world,@HardManFeDead @jesseklaver @groenlinks Extreem rechts en Neo Nazis zoals vlaams belang hebben niet de Europese verkiezingen gewonnen! Waarheid is dat amper 16% van europeanen hebben voir anti-EU partijen gestemd! https://t.co/xC40t4pfpZ,https://twitter.com/i/web/status/1133256304011763712,,"HardManFeDead, jesseklaver, groenlinks",0,0
Tue May 28 06:14:30 +0000 2019,nl,CobideJong1,Nootdorp,"Weektekening “Kemphanen in de Rode Hoed”. Op 22 mei 2019 vond een debat plaats tussen Baudet en Rutte voorafgaande aan de Europese verkiezingen.
Meer: https://t.co/0v6fsQb3GM

#Baudet #Rutte #FvD #VVD #verkiezingen2019 #EUverkiezingen2019 #PAUW #tekening #cartoon #prent https://t.co/WJeHk2BhkR",https://twitter.com/i/web/status/1133255205640916993,,,0,0
Tue May 28 06:10:00 +0000 2019,nl,demorgen,Brussel,EU-leiders maken in Brussel balans verkiezingen op https://t.co/wQQfundEgt,http://bit.ly/2XhrIeh,,,0,0
Tue May 28 06:03:10 +0000 2019,nl,JacquesJvdH,"Den Haag, Nederland","Landelijk is #FvD ook de vierde partij geworden (met 10,9% van de stemmen). Is er een zinnetje uitgevallen onder de laatste alinea, ⁦@NUnl? 
‘PvdA⁩ grootste partij bij Europese verkiezingen, D66 de grootste verliezer’
 https://t.co/qphnMmgLoU",https://twitter.com/i/web/status/1133252352369201152,FvD,,0,2
Tue May 28 06:00:02 +0000 2019,nl,GemDordrecht,"Dordrecht, Nederland",Vandaag stelt het hoofdstembureau de uitslagen van de Europese verkiezing vast van de Kieskring Dordrecht. De bijeenkomst is openbaar toegankelijk om 10.00 uur in vergaderkamer 1 van het Stadskantoor Dordrecht. Ook deze officiële uitslag komt op https://t.co/MIqQfwmqxi. https://t.co/DWlliMxM9j,https://twitter.com/i/web/status/1133251564708270080,,,0,0
Tue May 28 05:55:55 +0000 2019,nl,hakhverdian,Amsterdam,Luistervoer voor in de file! @TomWGvdMeer en ik hadden een snelle nabespreking van de Europese verkiezingen. https://t.co/XFhHrLLRpO,https://twitter.com/StukRoodVlees/status/1132164174589636609,,TomWGvdMeer,5,8
Tue May 28 05:51:22 +0000 2019,nl,HardManFeDead,,@jesseklaver @groenlinks En Vlaams Belang en de rechtse partijen die de Europese verkiezingen hebben gewonnen. Daar kunnen jullie zeker niet omheen. Of wel Yasser?,https://twitter.com/i/web/status/1133249383657553920,,"jesseklaver, groenlinks",0,1
Tue May 28 05:47:21 +0000 2019,nl,helmond_nieuws,,Europese verkiezingen: zo stemde #Helmond De Europese Parlementsverkiezingen 2019 zitten erop en de stemmen zijn geteld. Zo stemde #Helmond: #PvdA grootste partij In de gemeente... https://t.co/5yDmViFVlr,https://twitter.com/i/web/status/1133248373694377985,Helmond,,0,0
Tue May 28 05:35:44 +0000 2019,nl,ivermeul5,,"@Sam68772565 @Spetters599 De uitslagen van de Europese verkiezingen bevestiging dit beeld wel, met veel PvdA stemmers in ons land. Ietsjes te goedgelovig, naïef en dom 😝",https://twitter.com/i/web/status/1133245451086569473,,"Sam68772565, Spetters599",0,1
Tue May 28 05:33:44 +0000 2019,nl,SCEPTR_online,"Antwerpen, België","Het radicaal-linkse #Syriza van premier #AlexisTsipras kreeg klappen in de Europese Parlementsverkiezingen. Het centrumrechtse #NeaDemokratia was daar de winnaar.
Meer weten? Klik op de foto 👇
https://t.co/oMws3nQABy",https://twitter.com/i/web/status/1133244947782688768,"Syriza, AlexisTsipras",,2,4
Tue May 28 05:30:26 +0000 2019,nl,arnoyuma,"Lelystad, Nederland",Europese verkiezingen: waarom Verhofstadt en de sociaaldemocraten hun vel duur zullen verkopen https://t.co/twEY9uNNtJ via @knack,https://www.knack.be/nieuws/europa/europese-verkiezingen-waarom-verhofstadt-en-de-sociaaldemocraten-hun-vel-duur-zullen-verkopen/article-analyse-1469525.html?utm_source=Newsletter-28/05/2019,,Knack,0,0
Tue May 28 05:09:33 +0000 2019,nl,RudyLST,Amsterdam,Nederland wil sociaal Europa: 6 zetels voor Pvda. https://t.co/mYg96gENnw,https://www.nu.nl/europese-verkiezingen-2019/5910099/pvda-in-helft-nederlandse-gemeenten-grootste-partij-pvv-verliest-overal.html,,,0,0
Tue May 28 05:04:13 +0000 2019,nl,idabyeda,,"@APockele @yodeling_juno niet echt, pvda is de grootste geworden bij de europese verkiezingen, de extreemrechtse partij is de 3e grootste en twee andere eurosceptische partijen zijn alle zetels kwijtgeraakt",https://twitter.com/i/web/status/1133237518961455105,,"APockele, yodeling_juno",0,0
Tue May 28 05:01:08 +0000 2019,nl,J_HOZEE,Vlissingen,@AwakeningSpiri2 @MartineGoossen4 @stefan_noppen @torfsrik Je beseft dat het om de Europese verkiezingen ging?,,,"AwakeningSpiri2, MartineGoossen4, stefan_noppen, torfsrik",0,0
Tue May 28 05:00:54 +0000 2019,nl,indebuurtleiden,"Leiden, Nederland",Europese verkiezingen: zo stemde Leiden - https://t.co/2tGtsYdPZG https://t.co/nmDuR0Jgxe,https://indebuurt.nl/leiden/gemeente/europese-verkiezingen-zo-stemde-leiden~68824/?utm_source=twitter&utm_medium=tweet,,,0,0
Tue May 28 05:00:31 +0000 2019,nl,indebuurt0492,"Helmond, Nederland",Europese verkiezingen: zo stemde Helmond - https://t.co/jenLSz8gI9 https://t.co/AviAN31GxX,https://indebuurt.nl/helmond/nieuws/europese-verkiezingen-zo-stemde-helmond~66489/?utm_source=twitter&utm_medium=tweet,,,0,0
Tue May 28 05:00:00 +0000 2019,nl,pauwnl,Amsterdam,"Terugkijken: @MarijnissenL praat bij #Pauw over het verlies van de SP tijdens de Europese Verkiezingen en het opstappen van voorzitter Ron Meyer.

https://t.co/nT5qPVGdD4 https://t.co/dGlfaIfr1U",https://twitter.com/i/web/status/1133236457542488064,Pauw,MarijnissenL,0,1
Tue May 28 04:52:26 +0000 2019,nl,TCS_BVBA,België,"#EUR #USD: De EUR/USD onder druk deze ochtend na de Europese verkiezingen met een clash tussen Frankrijk en Duitsland omtrent wie de nieuwe EU-voorzitter mag leveren, Griekenland die nieuwe verkiezingen uitschrijft en Italië die tegen een fiscale boete van 4 miljard aankijkt. https://t.co/gng8oJZb8T",https://twitter.com/i/web/status/1133234550866423810,"EUR, USD",,0,0
Tue May 28 04:41:09 +0000 2019,nl,heirbar,,Vacatures in Europa: hoe worden de topfuncties verdeeld na de Europese verkiezingen? | VRT NWS https://t.co/cHpWB0DfQ3,https://www.vrt.be/vrtnws/nl/2019/05/27/wat-na-de-europese-verkiezingen.html/,,,2,6
Tue May 28 04:36:36 +0000 2019,nl,SchoesterYaira,,@juulgre @NOS Nu haal je de Europese Parlementsverkiezingen erbij. 51% is dan een prestatie ja. Kijk je naar landelijke verkiezingen ligt de opkomst tussen de 80 en 90%. Geen appels met peren vergelijken. En concreet ben je nog steeds niet.,https://twitter.com/i/web/status/1133230566130749441,,"juulgre, NOS",0,0
Tue May 28 04:26:38 +0000 2019,nl,dvhn_nl,Groningen,Met een opkomst van ruim 50 procent bij de Europese verkiezingen hebben onverwacht veel kiezers betrokkenheid getoond bij Europa. De vraag is of dat moet worden gezien als een loftuiting aan de Europese samenwerking.  https://t.co/tgJiZg6E34,https://twitter.com/i/web/status/1133228059077873664,,,0,0
Tue May 28 04:02:15 +0000 2019,nl,reychler,belgie,"...  EUROPESE  VERKIEZINGEN  ... 
  ....  In de Europese Unie zijn  liberalen en groenen  de uitgesproken winnaars van de verkiezingen. De traditionele partijen krijgen klappen...
  Cijfers over laatste zetels lopen  nogdruppelsgewijs binnen....
   https://t.co/52IivjlqBb",https://twitter.com/i/web/status/1133221925734498304,,,0,0
Tue May 28 03:54:35 +0000 2019,nl,vrtnws,"Brussel, België",Vacatures in Europa: hoe worden de topfuncties verdeeld na de Europese verkiezingen? https://t.co/DvsFTVuAEw #vrtnws,https://vrtnws.be/p.ZPwmEvx3M?t=1559015674973,vrtnws,,4,3
Tue May 28 03:48:00 +0000 2019,nl,NVU83622759,,"@MyrtheHilkens Je kan Europese verkiezingen niet een op een vergelijken met Provinciaal.
Dan zou de PVDA in een klap de grootste zijn en de PVV / SP uit de kamer verdwijnen.
Kortom dit is WENSDENKEN 😀",https://twitter.com/i/web/status/1133218336966434821,,MyrtheHilkens,0,0
Tue May 28 03:39:20 +0000 2019,nl,nieuwsbliknl,"Amsterdam, Nederland","Lees ""Hoe gaat de macht in Brussel verdeeld worden?"" op Nieuwsblik - https://t.co/PO2pOMQUUI -  Nu de uitslag van de Europese verkiezingen bekend is, breekt in Brussel een nieuwe fase aan: het spel om de hoge posten. Lees verder...","https://nieuwsblik.nl/hoe-gaat-de-macht-in-brussel-verdeeld-worden/, https://twitter.com/i/web/status/1133216157840936960",,,0,0
Tue May 28 03:39:20 +0000 2019,nl,nieuwsbliknl,"Amsterdam, Nederland","Lees ""Hoe gaat de macht in Brussel verdeeld worden?"" op Nieuwsblik - https://t.co/PO2pOMQUUI -  Nu de uitslag van de Europese verkiezingen bekend is, breekt in Brussel een nieuwe fase aan: het spel om de hoge posten. Lees verder...","https://nieuwsblik.nl/hoe-gaat-de-macht-in-brussel-verdeeld-worden/, https://twitter.com/i/web/status/1133216157840936960",,,0,0
Tue May 28 03:24:54 +0000 2019,nl,Callmevonne,Nijmegen,@SadetKarabulut ... door het beleid van Rutte II. De opkomst van Wilders en laatstelijk Baudet is mede te danken aan het neus ophalen door de PvdA voor die groep vergeten kiezers. Zij zouden hier eens de hand in eigen boezem moeten steken. Sjaak Scheele legt uit: https://t.co/jG7nwO0tmb,https://twitter.com/i/web/status/1133212522906030081,,SadetKarabulut,0,0
Tue May 28 02:56:35 +0000 2019,nl,onlinetilburg,tilburg,PvdA grootste in Tilburg bij Europese verkiezingen - https://t.co/OK9xdEw3HU - Nieuws uit Tilburg https://t.co/KMTGRHVQEW https://t.co/qj2RpSwzrI,"http://Tilburgers.nl, https://twitter.com/i/web/status/1133205396561154048",,,0,0
Tue May 28 02:56:09 +0000 2019,nl,teo_smit,,Europa is niet dood: dit zijn de belangrijkste conclusies na de Europese verkiezingen https://t.co/VycGkSTz0G via @nieuwsblad_be,https://www.nieuwsblad.be/cnt/dmf20190527_04432675,,Nieuwsblad_be,1,0
Tue May 28 02:41:39 +0000 2019,nl,JanWBakkerNL,"Best, Nederland","Waar komt die plotselinge zege van Fransje vandaag, als duvel uit een doosje. Misschien dat De Hond ons daar meer over kan vertellen. EU is vooral voor ons landje een zware last; wij betalen de subsidies voor straatarme landen. #Pauw
https://t.co/Wrr2dmUzS4",https://twitter.com/i/web/status/1133201642067779584,,,8,13
Tue May 28 01:13:13 +0000 2019,nl,_Overflakkee,,Europese verkiezingen https://t.co/vKO9LUPu0o Donderdag 23 mei 2019 waren er verkiezingen voor het Europese parlement. Wat stemden de Stadtenaren' Een analyse van de (voorlopige)...,"http://bit.ly/2MekEhn, https://twitter.com/i/web/status/1133179384515497984",,,0,0
