created_at,lang,screen_name,location,full_text,urls,tags,mentions,retweet_count,favorite_count
Mon May 27 08:09:15 +0000 2019,nl,YarnoRitzen,QA via NL,"@erikpjverweij Ja, ben zelf ook blij met de keuze, maar ik denk dat mensen die voor Europese verkiezingen stemmen sowieso al wat meer Europa-gericht zijn.

Wat overigens ironisch is, want het zijn vaak de anti-EU mensen die zeggen dat EU ondemocratisch is.",https://twitter.com/i/web/status/1132921697349316608,,erikpjverweij,0,0
Mon May 27 08:09:06 +0000 2019,nl,WimAalbers,Nederland,Europese verkiezingen: triomf voor het gezonde verstand https://t.co/wHzbcOztUZ https://t.co/w62mYhD8i8,https://joop.bnnvara.nl/opinies/europese-verkiezingen-triomf-voor-het-gezonde-verstand,,,0,0
Mon May 27 08:09:03 +0000 2019,nl,flevoland,,Kijk op deze kaart hoe jouw gemeente heeft gestemd bij de Europese verkiezingen: Nederland kleurt voor een belangrijk deel ‘PvdA’-rood: de partij pakt in veel gemeentes de winst bij Europese Verkiezingen. Kijk op de kaart hoe jouw gemeente heeft gestemd. https://t.co/dccPkI4nMh,https://twitter.com/i/web/status/1132921645910306816,,,0,0
Mon May 27 08:08:53 +0000 2019,nl,TheoCapelnr1,,Opvallend dat het Zweedse GroenLinks (Miljöpartiet De Gröna) vet verloor in de Europese verkiezingen. Kruistocht van die moderne Pippi Langkous sloeg blijkbaar niet aan. Wat gebeurde er wel? https://t.co/conTOSeGr1,https://twitter.com/i/web/status/1132921602419625984,,,0,0
Mon May 27 08:08:33 +0000 2019,nl,IkBenGewoonPaul,Amsterdam,Europese Verkiezingen zijn geweest. Bij @rtlkoffietijd vindt het een goed idee om de uitslagen met @roosschlikker (toch de nieuwe @PeterRdeV van de NL journalistiek; die heeft OVERAL verstand van... 🤔🤷‍♂️🙄) te duiden...,https://twitter.com/i/web/status/1132921519288541184,,"rtlkoffietijd, roosschlikker",0,1
Mon May 27 08:08:29 +0000 2019,nl,cda_nieuws,,#PvdA krijgt in gemeente #Medemblik meeste stemmen https://t.co/HMPAgxR213 De #PvdA heeft in de gemeente #Medemblik de meeste stemmen gekregen tijdens de verkiezingen voor het Europese Parlementsverkiezingen....,"http://bit.ly/2MeuPCu, https://twitter.com/i/web/status/1132921503601893376","PvdA, Medemblik, PvdA, Medemblik",,0,0
Mon May 27 08:08:27 +0000 2019,nl,cda_nieuws,,#ChristenUnie/#SGP veruit de grootste https://t.co/v5Ym9BmpFO #ChristenUnie/#SGP kreeg in Zwartewaterland veruit de meeste stemmen tijdens de Europese Verkiezingen. Maar liefst 45 procent...,"http://bit.ly/2MpWMHN, https://twitter.com/i/web/status/1132921495930454017","ChristenUnie, SGP, ChristenUnie, SGP",,0,0
Mon May 27 08:08:27 +0000 2019,nl,cda_nieuws,,"#PvdA krijgt meeste stemmen bij Europese verkiezingen, hoe zit dat in jouw gemeente' https://t.co/uM10Q1NIcq De uitslagen van de Europese verkiezingen zijn nagenoeg bekend. De #PvdA heeft in Nederland voor de meeste stemmen gezorgd....","http://bit.ly/2WpBCNn, https://twitter.com/i/web/status/1132921494248542208",PvdA,,0,0
Mon May 27 08:08:26 +0000 2019,nl,cda_nieuws,,Voorlopige uitslag Europese verkiezingen #Bodegraven-#Reeuwijk https://t.co/TEnG75SlQn De voorlopige uitslag van de verkiezingen voor het Europees Parlement is bekend. In totaal zijn op 23 mei 12.794 stemmen...,"http://bit.ly/2WpBBch, https://twitter.com/i/web/status/1132921490930847744","Bodegraven, Reeuwijk",,0,0
Mon May 27 08:08:24 +0000 2019,nl,cda_nieuws,,Christelijke partijen de grootste in #Katwijk https://t.co/WF9ax1xEZo #ChristenUnie-#SGP en #CDA zijn de grootste partijen geworden met de Europese verkiezingen. De twee partijen haalde respectievelijk...,"http://bit.ly/2MccWnW, https://twitter.com/i/web/status/1132921483297267712","Katwijk, ChristenUnie, SGP, CDA",,0,0
Mon May 27 08:08:24 +0000 2019,nl,cda_nieuws,,"#PvdA krijgt meeste stemmen bij Europese verkiezingen, hoe zit dat in jouw gemeente' https://t.co/uUa2FncR0q De uitslagen van de Europese verkiezingen zijn nagenoeg bekend. De #PvdA heeft in Nederland voor de meeste stemmen gezorgd....","http://bit.ly/2WpBz49, https://twitter.com/i/web/status/1132921481711824896",PvdA,,0,0
Mon May 27 08:07:53 +0000 2019,nl,Indebuurt0348,"Woerden, Nederland",Verkiezingsuitslag: zo stemde Woerden voor het Europees Parlement - https://t.co/kYBbvTs8Mb https://t.co/bEtomisl2a,https://indebuurt.nl/woerden/nieuws/verkiezingsuitslag-woerden-europese-verkiezingen-2019~76158/?utm_source=twitter&utm_medium=tweet,,,0,0
Mon May 27 08:07:41 +0000 2019,nl,schagerweekblad,Schagen,"PvdA grootste in Schagen bij Europese verkiezingen SCHAGEN De PvdA is bij de verkiezingen voor het Europees Parlement van afgelopen donderdag de grootste partij geworden in de gemeente Schagen. De sociaaldemocraten kregen 23,1 ... https://t.co/khVA5ZUVjP via @schagerweekblad https://t.co/K8RAIo8Zeh",https://twitter.com/i/web/status/1132921301146984448,,,0,0
Mon May 27 08:07:08 +0000 2019,nl,nieuwsbliknl,"Amsterdam, Nederland","Lees ""De Britse politiek is totaal gepolariseerd"" op Nieuwsblik - https://t.co/hf28BD5dV7 - De Britse kiezers hebben de Europese verkiezingen gebruikt om het EU-referendum nog eens dunnetjes over te doen. Partijen met een...","https://nieuwsblik.nl/de-britse-politiek-is-totaal-gepolariseerd/, https://twitter.com/i/web/status/1132921162323906561",,,0,0
Mon May 27 08:05:20 +0000 2019,nl,DeKoerier,Heerhugowaard,PvdA grootste in Heerhugowaard en Langedijk bij Europese verkiezingen HEERHUGOWAARD De PvdA is bij de verkiezingen voor het Europees Parlement van afgelopen donderdag de grootste partij geworden in de gemeente Heerhugowaard. De sociaalde... https://t.co/2anIKlyBIU via @DeKoerier https://t.co/ZGz1218lpv,https://twitter.com/i/web/status/1132920709569761282,,,0,0
Mon May 27 08:04:28 +0000 2019,nl,radio1be,,Ook bij de Europese verkiezingen zetten dezelfde tendensen zich door die we ook in eigen land zien: winst voor uiterst rechts. @GeertBourgeois reageert in #deochtend. Herbeluister: https://t.co/Mp3joO85U5 https://t.co/9SB6Z8TRop,https://twitter.com/i/web/status/1132920490736197634,,,0,1
Mon May 27 08:04:13 +0000 2019,nl,SylviavanLonden,Ulft,"PvdA in helft Nederlandse gemeenten grootste partij, PVV verliest overal https://t.co/UdKeW4ELkA (via @NUnl)",https://www.nu.nl/europese-verkiezingen-2019/5910099/pvda-in-helft-nederlandse-gemeenten-grootste-partij-pvv-verliest-overal.html,,NUnl,1,1
Mon May 27 08:04:02 +0000 2019,nl,ZE_ZEBRA_ZA,Hasselt,@deluipaard Mja bij de Europese verkiezingen heeft extreem-rechts in Oostenrijk toch niet veel pluimen gelaten. Zelfs na het hele schandaal.,,,deluipaard,0,2
Mon May 27 08:03:56 +0000 2019,nl,Malouiners,in de Nederlanden,GEENPEIL WINT EUROPESE VERKIEZINGEN https://t.co/rzRSjtTckH,https://www.geenstijl.nl/5147855/okee-en-timmerfrans-natuurlijk/,,,1,1
Mon May 27 08:03:48 +0000 2019,nl,GBHeusden,Gemeente Heusden,"Voor de uitslag Europese Verkiezingen in onze gemeente Heusden:
https://t.co/Pip78HiGsf",https://www.heusden.nl/Home/Homepage/Nieuws/Verkiezingen,,,0,0
Mon May 27 08:03:48 +0000 2019,nl,GBHeusden,Gemeente Heusden,"Voor de uitslag Europese Verkiezingen in onze gemeente Heusden:
https://t.co/Pip78HiGsf",https://www.heusden.nl/Home/Homepage/Nieuws/Verkiezingen,,,0,0
Mon May 27 08:03:46 +0000 2019,nl,DTermometer,,De opvallendste politieke verschuivingen in Europese lidstaten https://t.co/8r2TOCV9aU via @NUnl,https://www.nu.nl/europese-verkiezingen-2019/5909838/de-opvallendste-politieke-verschuivingen-in-europese-lidstaten.html,,NUnl,0,0
Mon May 27 08:03:35 +0000 2019,nl,Leesbaar,Amsterdam,"GeenStijl: GEENPEIL WINT EUROPESE VERKIEZINGEN. 
#mooi!!!!!iii!11!!! https://t.co/97aWhYW6ST",https://www.geenstijl.nl/5147855/okee-en-timmerfrans-natuurlijk/,mooi,,0,0
Mon May 27 08:03:20 +0000 2019,nl,NBDeZaankanter,Zaandam,"PvdA krijgt in Zaanstad en Wormerland de meeste stemmen ZAANSTAD Met 9419 stemmen is de PvdA in Zaanstad als grootste partij uit de Europese Verkiezingen gekomen. In totaal kregen de sociaaldemocraten 21,8 procent van de stemmen. In... https://t.co/stXnymfBEw via @NBDeZaankanter https://t.co/Idl5jQxSCz",https://twitter.com/i/web/status/1132920207645843456,,,0,0
Mon May 27 08:03:09 +0000 2019,nl,RTLZ,Hilversum,Kijk terug: Extra uitzending met daarin alles wat je moet weten over de Europese verkiezingsuitslag https://t.co/maxEkWRaeK https://t.co/3HKLvkhuSe,https://twitter.com/i/web/status/1132920158916419584,,,1,2
Mon May 27 08:03:09 +0000 2019,nl,RTLZ,Hilversum,Kijk terug: Extra uitzending met daarin alles wat je moet weten over de Europese verkiezingsuitslag https://t.co/maxEkWRaeK https://t.co/3HKLvkhuSe,https://twitter.com/i/web/status/1132920158916419584,,,1,2
Mon May 27 08:02:58 +0000 2019,nl,indebuurt030,Utrecht,Europese verkiezingen: zo stemde Utrecht - https://t.co/m66GpmxYNO https://t.co/F3smiPgaTl,https://indebuurt.nl/utrecht/nieuws/europese-verkiezingen-zo-stemde-utrecht~101809/?utm_source=twitter&utm_medium=tweet,,,0,0
Mon May 27 08:02:39 +0000 2019,nl,RoelKingma,Broek in Waterland/Lemmer.,Hoe stemde Friesland voor de Europese verkiezingen? Bekijk hier de uitslagen per gemeente https://t.co/QBrGzXLXv7,https://www.lc.nl/friesland/Hoe-stemde-Friesland-voor-de-Europese-verkiezingen-Bekijk-hier-de-uitslagen-per-gemeente-24493994.html?utm_medium=article_sharing&utm_source=twitter,,,0,0
Mon May 27 08:02:10 +0000 2019,nl,BartelsRolf,"Vreewijk, Rotterdam","Geen timmermanszoon-effect bij EU-verkiezingen..... 😇

Christelijke partijen lijden verlies. 

https://t.co/4Ht9PdKJQl",https://www.rtlnieuws.nl/nieuws/artikel/4725616/christendemocraten-uitslag-europese-verkiezingen-pvda,,,2,0
Mon May 27 08:02:02 +0000 2019,nl,indebuurt073,"'s-Hertogenbosch, Nederland",Zo stemde Den Bosch voor de Europese verkiezingen - https://t.co/9AKwEXzgMf https://t.co/p1FJUXRVsn,https://indebuurt.nl/denbosch/nieuws/zo-stemde-den-bosch-europese-verkiezingen~78564/?utm_source=twitter&utm_medium=tweet,,,0,0
Mon May 27 08:00:46 +0000 2019,nl,VVDStedeBroec,Stede Broec,De VVD is met de Europese parlementsverkiezingen de tweede partij van Stede Broec geworden. Met 1.064 stemmen heeft de VVD meer stemmen behaald dan in 2014. https://t.co/7HibgCz4am,https://twitter.com/i/web/status/1132919559315439616,,,1,0
Mon May 27 08:00:38 +0000 2019,nl,gemharderwijk,"Harderwijk, Gelderland",Wij doen vandaag mee met het centraal tellen voor de Europese verkiezingen. Donderdag is geteld hoeveel stemmen elke partij heeft gehaald. Vandaag gebeurt dat per kandidaat. Alle tellers veel succes! 👍 #harderwijk #EuropeseVerkiezingen https://t.co/hybMGc4j4A,https://twitter.com/i/web/status/1132919525366784005,,,0,3
Mon May 27 08:00:35 +0000 2019,nl,GBHeusden,Gemeente Heusden,"PvdA krijgt meeste stemmen bij Europese verkiezingen, hoe zit dat in jouw gemeente? https://t.co/7PWfOStxrt",https://www.bd.nl/dossier-europese-verkiezingen/pvda-krijgt-meeste-stemmen-bij-europese-verkiezingen-hoe-zit-dat-in-jouw-gemeente~aaeab129/?utm_source=twitter&utm_medium=social&utm_campaign=socialsharing_web,,,0,0
Mon May 27 08:00:03 +0000 2019,nl,GemeenteUT,Nederland,GroenLinks grote winnaar in Utrecht bij Europese verkiezingen https://t.co/pmJxKJodM4 | https://t.co/01xh3LPrAA #Utrecht #DUIC https://t.co/WnrsrWccFp,"http://dlvr.it/R5TvrG, http://bit.ly/BestNieuws, https://twitter.com/i/web/status/1132919379019018240",,,0,0
Mon May 27 07:59:27 +0000 2019,nl,gouda_nieuws,,Voorlopige uitslag Europese verkiezingen #Bodegraven-#Reeuwijk De voorlopige uitslag van de verkiezingen voor het Europees Parlement is bekend. In totaal zijn op 23 mei 12.794 stemmen... https://t.co/IMOIwLXwfL,https://twitter.com/i/web/status/1132919227143348226,"Bodegraven, Reeuwijk",,0,0
Mon May 27 07:59:01 +0000 2019,nl,KleineBu,Hengelo Centrum,Hoe stemde Twente? Bekijk hier de uitslagen in jouw gemeente https://t.co/A5ZfoyO5PR CDA in Twente veel stemmen binnen gehaald. Gefeliciteerd!! @CDAHengelo @CDAOverijssel @cdavandaag,"https://www.tubantia.nl/dossier-europese-verkiezingen/hoe-stemde-twente-bekijk-hier-de-uitslagen-in-jouw-gemeente~adfd3dff/?utm_source=twitter&utm_medium=social&utm_campaign=socialsharing_web, https://twitter.com/i/web/status/1132919121274912768",,,0,1
Mon May 27 07:58:24 +0000 2019,nl,SpraakmakersOp1,"Hilversum, Nederland",We praten zo verder over uitslag van de Europese verkiezingen met @keesboonman @TijsvandenBrink @JonathanHolslag &amp; @margrietbrandsm https://t.co/Y3ZL59K7WS,https://twitter.com/i/web/status/1132918963841720321,,"keesboonman, TijsvandenBrink, JonathanHolslag",3,8
Mon May 27 07:57:16 +0000 2019,nl,uddelinfo,"Uddel, Apeldoorn","Uitslag Europese verkiezingen Uddel
 https://t.co/Bp6GtTHOPM",https://uddel.info/nieuws/uitslag-europese-verkiezingen-uddel/,,,1,0
Mon May 27 07:57:08 +0000 2019,nl,omroepbo,"Noordwijk, Nederland",Uitslag Europese verkiezingen Bollenstreek https://t.co/zmdQudioVD via @@omroepbo,https://www.bollenstreekomroep.nl/2019/05/uitslag-europese-verkiezingen-bollenstreek/,,omroepbo,0,0
Mon May 27 07:57:07 +0000 2019,nl,parool,Amsterdam,Burgemeester Erik Boog van Diemen is boos op de Roemeense autoriteiten https://t.co/tNbN4UXKkL,https://www.parool.nl/nederland/alles-over-de-uitslagen-van-de-europese-verkiezingen~ba7e5734/,,,0,0
Mon May 27 07:56:51 +0000 2019,nl,ErikAlbronda,,@RTV_Rijnmond Sukkels... Jullie vergelijken Provinciale met Europese verkiezingen? Wat een fake nieuws weer... #roeptoeteren,,roeptoeteren,RTV_Rijnmond,0,0
Mon May 27 07:56:38 +0000 2019,nl,Castricummer,,PvdA winnaar Europese Verkiezingen - https://t.co/ySKUzHeIlC https://t.co/ZZlRCwODr8,https://www.castricummer.nl/pvda-ook-in-castricum-de-grootste/,,,0,0
Mon May 27 07:55:16 +0000 2019,nl,dronten_nieuws,,Bij Europese verkiezingen nog steeds kinderziektes bij stembureau in Het Perron De voorzitters van de diverse stembureaus in de gemeente #Dronten hebben hoegenaamd geen op- of aanmerkingen geplaatst... https://t.co/MLQzrx0Ixh,https://twitter.com/i/web/status/1132918176839348224,,,0,0
Mon May 27 07:54:53 +0000 2019,nl,Groen_Heeze,"Heeze-Leende, Noord-Brabant",Uitslag @Gem_HeezeLeende in de Europese verkiezingen. Winst voor GroenLinks. https://t.co/7RTkR5lctb https://t.co/CVfZrCpu38,https://www.ed.nl/brabant/pvda-en-cda-grootste-partijen-in-oost-brabant-bekijk-hier-de-uitslag-van-jouw-gemeente~afefebbd/,,Gem_HeezeLeende,0,0
Mon May 27 07:54:38 +0000 2019,nl,CTRHollandsKr,Anna Paulowna,PvdA grootste in Hollands Kroon bij Europese verkiezingen HOLLANDS KROON De PvdA is bij de verkiezingen voor het Europees Parlement van afgelopen donderdag de grootste partij geworden in de gemeente Hollands Kroon. De sociaaldemocrat... https://t.co/OVbZAz6Moy via @CTRHollandsKr https://t.co/0qWBd0DSmD,https://twitter.com/i/web/status/1132918015715098624,,,0,0
Mon May 27 07:54:17 +0000 2019,nl,WieringerCournt,"Anna Paulowna, Nederland",PvdA grootste in Hollands Kroon bij Europese verkiezingen HOLLANDS KROON De PvdA is bij de verkiezingen voor het Europees Parlement van afgelopen donderdag de grootste partij geworden in de gemeente Hollands Kroon. De sociaaldemocr... https://t.co/DlClhjpUna via @WieringerCournt https://t.co/bssKzynilN,https://twitter.com/i/web/status/1132917928725286912,,,0,1
Mon May 27 07:54:01 +0000 2019,nl,amsterdam_bill,,"Bekijk hier alle uitslagen https://t.co/4r66JUHAVf.
Geen stijl had die 6 zetels voor de PvdA vanaf het begin. Als die 700 vrijwilligers goed geteld hebben, hadden ze natuurlijk vanaf het begin heel gewoon de uitslag. Niks ""exit"". Mooi bedacht van Geen Stijl!","https://www.ad.nl/dossier-europese-verkiezingen/bekijk-hier-alle-uitslagen~a731492e/?utm_source=twitter&utm_medium=social&utm_campaign=socialsharing_web, https://twitter.com/i/web/status/1132917862585294848",,,0,0
Mon May 27 07:53:33 +0000 2019,nl,erikvogelaar,Amsterdam,@parool Het zijn wel Europese verkiezingen. Maar zegt toch wel wat. PVV en SP naar nul. Euro sceptische partijen verliezen in Nederland.,,,parool,0,1
Mon May 27 07:53:22 +0000 2019,nl,Gem_Doesburg,Doesburg,"Afgelopen donderdag ging Doesburg naar de stembus voor de verkiezingen van het Europese parlement.
Zie hier de voorlopige uitslag in interactieve vorm.
 https://t.co/e9trZs1RiJ",https://twitter.com/i/web/status/1132917696897736705,,,2,0
Mon May 27 07:53:16 +0000 2019,nl,gemeentedrv,Mijdrecht,"@Gunnergirl82 @petershotnews Goedemorgen, de uitslagen van de Europese Verkiezingen voor onze gemeente staan op de website https://t.co/9uxyJosGvg. Fijne dag toegewenst! Groet, Andra",https://twitter.com/i/web/status/1132917671396347904,,"Gunnergirl82, petershotnews",0,1
Mon May 27 07:52:33 +0000 2019,nl,VVDVoorschoten,"Voorschoten, Zuid-Holland","In Voorschoten ook forse winst voor de PvdA, maar de VVD is de grootste geworden bij de Europese verkiezingen!",,,,2,5
Mon May 27 07:51:27 +0000 2019,nl,GiovanniRoi,"Milan,Italy","Italië, Europese verkiezingen 2019, alle resultaten: Lega eerste partij, de Pd overschrijdt M5's. Dit laat zien hoeveel ik aangaf dat Di Maio's arrogantie en gebrek aan respect hem tot een ramp bracht.",https://twitter.com/i/web/status/1132917217849425920,,,0,0
Mon May 27 07:51:27 +0000 2019,nl,_klomp,,"Positivisme over Europa, fatsoen en natuurlijk Frans Timmermans: de volhardende aanhouder wint! ⁦@PvdA_Apeldoorn⁩ gelukgewenst! https://t.co/yRC0P4GazJ",https://twitter.com/i/web/status/1132917216750571520,,PvdA_Apeldoorn,0,0
Mon May 27 07:51:25 +0000 2019,nl,MARXleeftNU,Malieveld,De Europese verkiezingen beginnen te leven! Mooi zo'n hoge(re ) opkomst.,,,,0,0
Mon May 27 07:51:17 +0000 2019,nl,HeldWeekblad,Den Helder,PvdA grootste in Den Helder bij Europese verkiezingen DEN HELDER De PvdA is bij de verkiezingen voor het Europees Parlement van afgelopen donderdag de grootste partij geworden in de gemeente Den Helder. De sociaaldemocraten kregen 19.... https://t.co/PQtnN6Pm9Z via @HeldWeekblad https://t.co/P9keAAmNOu,https://twitter.com/i/web/status/1132917173750501376,,,0,0
Mon May 27 07:50:57 +0000 2019,nl,WestfriesWB,Hoorn,PvdA de grootste in Hoorn bij Europese verkiezingen: VVD grootste in Opmeer HOORN De PvdA is in Hoorn de winnaar geworden bij de verkiezingen voor het Europees Parlement. In totaal werd er in Hoorn 4850 keer gestemd op de PvdA en dat i... https://t.co/Jyh3PYkxzT via @WestfriesWB https://t.co/AkON2EGKmb,https://twitter.com/i/web/status/1132917090409701377,,,0,0
Mon May 27 07:50:57 +0000 2019,nl,gero_matulessy,"Apeldoorn, The Netherlands","In Apeldoorn is de PvdA met 18,4% de grootste geworden bij de verkiezingen voor het Europees Parlement. Dat betekent een flinke stijging ten opzichte van 5 jaar geleden. De PVV eindigt als tiende partij met 3,1% van de stemmen (was 10,5%).

https://t.co/5YjSK4jFTz",https://twitter.com/i/web/status/1132917088832688128,,,0,6
Mon May 27 07:50:51 +0000 2019,nl,parool,Amsterdam,In drie gemeenten is het partijen gelukt om een absolute meerderheid te halen. Nergens was de overwinning zo groot als op Urk https://t.co/tNbN4UXKkL,https://twitter.com/i/web/status/1132917064396619776,,,0,0
Mon May 27 07:49:22 +0000 2019,nl,mees_porschen,"Teylingen, Nederland",@Jongderik Een iets te makkelijke constatering als het aan mij ligt. Europese verkiezingen zijn sowieso niet populair.,,,Jongderik,0,1
Mon May 27 07:48:26 +0000 2019,nl,_Deventer,,Kijk op deze kaart hoe jouw gemeente heeft gestemd bij de Europese verkiezingen Nederland kleurt voor een belangrijk deel &amp;acute;PvdA&amp;acute;-rood: de partij pakt in veel gemeentes de winst bij Europese... https://t.co/WyPUin0lzq,https://twitter.com/i/web/status/1132916455761166336,,,0,0
Mon May 27 07:48:17 +0000 2019,nl,_winsum,,"Stevige klappen voor de SP en #D66, #PvdA verdubbeld https://t.co/VX0KGoYWbv De SP en #D66 hebben fikse klappen gekregen in de gemeente Het Hogeland bij de verkiezingen voor het Europese Parlement. De SP behaalde...","http://bit.ly/2VNxAtX, https://twitter.com/i/web/status/1132916418389925888","D66, PvdA, D66",,0,0
Mon May 27 07:47:49 +0000 2019,nl,ivostumpe,Amsterdam,"""Het grootste deel van de Amsterdamse stemmen van afgelopen donderdag ging naar GroenLinks..."" nou @AT5 het was een leuke uitslag, maar niet zo leuk. 😂

https://t.co/4LdAfPH5WC",https://twitter.com/i/web/status/1132916302304153600,,AT5,0,0
Mon May 27 07:47:40 +0000 2019,nl,AEBPITOU,,"Hoge(re) opkomst voor de Europese verkiezingen is een opsteker en bewijs dat Europa terugkomt, zij het in verdeelde slagorde! Rechts-populistische partijen winnen ook, maar voor het Europees Parlement is het minder belangrijk, gezien de grote versplintering van hun fracties!#sic!",https://twitter.com/i/web/status/1132916263045521413,,,0,1
Mon May 27 07:47:05 +0000 2019,nl,EWdeVlieger,,‘Alles over de Europese verkiezingen’ luidt de kop. Maar de tweet zegt wat anders. 😂😂😂 https://t.co/Esax2hlxzz,https://twitter.com/parool/status/1132911728541483009?s=21,,,7,28
Mon May 27 07:46:31 +0000 2019,nl,r_spruit,,"Goedemorgen! De Europese verkiezingen heb ik gevolgd via de media. Hoorde zojuist dat je met een dubbel paspoort twee keer kan stemmen, maar je mag maar 1 stem uitbrengen. Bij controle kun je boete van 4 duizend euro krijgen. Tja, wie controleert dit? 🤔",https://twitter.com/i/web/status/1132915973437251584,,,0,1
Mon May 27 07:45:52 +0000 2019,nl,WestfriesWB,Hoorn,"PvdA krijgt in gemeente Medemblik meeste stemmen MEDEMBLIK De PvdA heeft in de gemeente Medemblik de meeste stemmen gekregen tijdens de verkiezingen voor het Europese Parlementsverkiezingen. De partij kreeg 18,2 procent van de... https://t.co/1nDIDWsYX0 via @WestfriesWB https://t.co/t46EBoEvJJ",https://twitter.com/i/web/status/1132915810891194368,,,0,0
Mon May 27 07:45:10 +0000 2019,nl,keestelpro,"Eindhoven, Nederland",@parool Met een opkomst van 42% hebben de Europese Verkiezingen met 13.000.000 kiesgerechtigden 7.540.000 stemmers misgelopen. Dat zijn over het algemeen de mensen die niets met het ondemocratische EU parlement hebben. En terecht! #Remember2005 #NeverForget #EUGrondwet,https://twitter.com/i/web/status/1132915632809422848,,parool,1,5
Mon May 27 07:45:02 +0000 2019,nl,DeDrontenaar,Dronten,Bij Europese verkiezingen nog steeds kinderziektes bij stembureau in Het Perron. https://t.co/LlHlSuidS1,http://dedrontenaar.nl/algemeen/bij-europese-verkiezingen-nog-steeds-kinderziektes-bij-stembureau-in-het-perron,,,0,0
Mon May 27 07:44:24 +0000 2019,nl,vermanen_ebooks,,"Als je interesse hebt in feitloze bullshit tijdens de Europese Verkiezingen, doneer dan aan dit project.",,,,0,0
Mon May 27 07:44:19 +0000 2019,nl,_urk_nopolder,,"Europese verkiezingen: CU/#SGP veruit de grootste https://t.co/MSf3pudiA4 De gecombineerde lijst van ChristenUnie en #SGP is bij de Europese Verkiezingen op #Urk veruit de grootste geworden. Door 70,8...","http://bit.ly/2VS6X79, https://twitter.com/i/web/status/1132915420351094787",SGP,,0,0
Mon May 27 07:43:27 +0000 2019,nl,RietbergenNiels,,"Italië, VK en Oost-Europa: nóg EU-kritischer. Duitsland: groener en EU-kritischer. Wallonië: linkser. Vlaanderen: rechtser. Verkiezingen EU-parlement leren ons wat we al lang weten: eenheid was er niet, is er niet en komt er niet. Europese continent is mooi door verscheidenheid.",https://twitter.com/i/web/status/1132915200972251136,,,6,18
Mon May 27 07:42:51 +0000 2019,nl,Duinstreek,Bergen (NH),"PvdA grootste in Bergen bij Europese verkiezingen BERGEN De PvdA is bij de verkiezingen voor het Europees Parlement van afgelopen donderdag de grootste partij geworden in de gemeente Bergen. De sociaaldemocraten kregen 21,8... https://t.co/1sh41HtmJ7 via @Duinstreek https://t.co/AwUAu2Ej0o",https://twitter.com/i/web/status/1132915051977945088,,,0,1
Mon May 27 07:42:46 +0000 2019,nl,ebel_k,amsterdam,"En dus nee, het is niet zo dat 'PvdA de grootste in veel gemeentes' is... Een kleine minderheid van de kiezers heeft voor de Europese verkiezingen - dit keer - PvdA gestemd. Wanneer leren die journalisten het nou eens?",https://twitter.com/i/web/status/1132915028900896768,,,0,0
Mon May 27 07:42:43 +0000 2019,nl,kockgerard,,https://t.co/RFMEBEtWQm geloven vertrouwen die oplichters zakkenvullers eu euro totaal niet. stelen brexsitgeld onder leiding van f timmermans voorhun pensioengat mee te dichten die https://t.co/NYn5ZtajQJ eu geld van alle u burgers niks van eu dieven bende oplichters,"http://a.msn.com/01/nl-nl/AABYn6l?ocid=stwij, https://twitter.com/i/web/status/1132915017626607617",,,0,0
Mon May 27 07:42:39 +0000 2019,nl,mwilmans,Amsterdam,"Wow. Een kwart van de stemmen (24,5%) gaat in #Landsmeer naar de #PvdA. Geweldig. Kiezers nogmaals bedankt. https://t.co/xVesEeTJJJ",https://nos.nl/europese-verkiezingen/uitslagen-landsmeer,"Landsmeer, PvdA",,0,4
Mon May 27 07:42:38 +0000 2019,nl,Sjhelfrich,nederland/Friesland,Zo stemde harlingen https://t.co/QXvnDG97mS,https://nos.nl/europese-verkiezingen/uitslagen-harlingen#menu,,,0,0
Mon May 27 07:42:03 +0000 2019,nl,asidi123,Amsterdam,"# wederom geert gefeliciteerd met de afgang 😂

https://t.co/z77XUE7q6O",https://www.nu.nl/europese-verkiezingen-2019/5910099/pvda-in-helft-nederlandse-gemeenten-grootste-partij-pvv-verliest-overal.html,,,0,0
Mon May 27 07:41:49 +0000 2019,nl,Opsterland,Opsterland,"Goedemorgen, we zijn weer los! Vandaag worden centraal op één locatie in De Buorskip in Beetsterzwaag de stemmen geteld van de Europese verkiezingen. Zo'n 40 vrijwilligers tellen de stemmen op kandidaatsniveau. Later vandaag volgt de definitieve uitslag #Opsterlandstemt https://t.co/udOoAS1MT8",https://twitter.com/i/web/status/1132914791750742016,,,0,1
Mon May 27 07:41:09 +0000 2019,nl,rufijbaeke,kaprijke,"MEEST voorkeurstemmen Europese verkiezingen :   
BOURGEOIS Geert (N-VA) 343.290  * Proficiat @GeertBourgeois !",,,GeertBourgeois,1,3
Mon May 27 07:40:54 +0000 2019,nl,Jurjen_Veenstra,Niezijl,@BosheksRena @SadetKarabulut Dat is toch precies waar SP voor staat? Maar de meeste van je punten zijn niet direct europees. Deze verkiezingen heeft de SP ingezet om de europese decadentie aan te kaak te stellen. En de kiezer heeft andere prioriteiten. Dat mag gewoon.,https://twitter.com/i/web/status/1132914560455909376,,"BosheksRena, SadetKarabulut",1,2
