created_at,lang,screen_name,location,full_text,urls,tags,mentions,retweet_count,favorite_count
Fri May 31 15:59:00 +0000 2019,nl,Ysselar,Eigen volk eerst,"#AlternativefürDeutschland #AfD grootste partij bij #Europese verkiezingen in #Saksen en #Brandenburg.
#Oostduitsers pakken de regie in eigen land weer terug ! https://t.co/j6DxKSYbPG",https://twitter.com/i/web/status/1134489464775106560,"AlternativefürDeutschland, AfD, Europese, Saksen, Brandenburg",,0,0
Fri May 31 15:29:32 +0000 2019,nl,PingaPolitiek,,"De nieuwste aflevering van Jensen is online! In deze aflevering de klimaatwet en de overwinning van Vlaams Belang in België bij de Europese Verkiezingen. 
#Jensen #Geert #Jensen #Wilders #VlaamsBelang #FvD #Baudet #VVD #klimaat #klimaatwet #klimaatakkoord
https://t.co/eUfVAjmhwm",https://twitter.com/i/web/status/1134482049279115264,,,2,0
Fri May 31 15:19:37 +0000 2019,nl,Bart95187733,,PTelegraaf. Daarin zegt Otten dat vorige week bij de Europese verkiezingen een half miljoen mensen minder op Forum hebben gestemd dan in maart bij de Provinciale Statenverkiezingen. En dat de schuld is van Baudet. Otten blijft maar bezig https://t.co/i3V9YH5jI0  @Frontbencher.nl,https://twitter.com/i/web/status/1134479552934232067,,,0,0
Fri May 31 15:16:40 +0000 2019,nl,JanVLEVA,,"Niet meer onbelangrijk of best belangrijk, maar van direct belang, die Europese verkiezingen! https://t.co/zmkONTW7Zp",https://twitter.com/carstenbrzeski/status/1134323456575545344,,,0,1
Fri May 31 15:12:25 +0000 2019,nl,dr_pewpew,,"@PatrickBred1 @NOS Zou niet weten waar links bang voor moet zijn. Wilders heeft geen zetels in het Europese parlement,  PVV is bijna weggevaagd in de eerste kamer en bij de volgende verkiezingen verwacht ik dat de PVV de Partij Van de Verleden tijd is!",https://twitter.com/i/web/status/1134477740961402880,,"PatrickBred1, NOS",0,3
Fri May 31 14:49:27 +0000 2019,nl,porthossie,"Amsterdam, Noord-Holland","Ik ben Nederlander, democraat en heb gestemt met de Europese verkiezingen. ik eis dat de stem van onze Europese medeburgers in Catalonië wordt gerespecteerd. Het is daarom onacceptabel dat de gekozen MEP's Puigdemont en Comín de toegang tot het EU parlement worden geweigerd.",https://twitter.com/i/web/status/1134471961210425345,,,13,18
Fri May 31 14:25:46 +0000 2019,nl,_MikeMuller,,"GroenLinks Amsterdam wilde juridische stappen om groei Schiphol tegen te houden (plan kwam op dag van Europese verkiezingen naar buiten). 

Wethouder Kock zegt nu: Amsterdam zal geen gebruik maken van eventuele juridische mogelijkheden richting Schiphol. #raad020 https://t.co/XVVKBPOyQK",https://twitter.com/i/web/status/1134466000253071360,,,4,12
Fri May 31 14:01:26 +0000 2019,nl,_huizenmarkt,,"Het schrijnende tekort aan sociale huurwoningen, doe daar als Kamerlid eens iets aan Het was een zware week voor de liefhebbers van correct gebruik van percentages. Bij de analyses van de Europese verkiezingen... https://t.co/7sYipWC0PD",https://twitter.com/i/web/status/1134459877458403334,,,0,0
Fri May 31 14:00:03 +0000 2019,nl,NieuwsGrazer,Nederland,Europese verkiezingen: de politieke gevolgen https://t.co/0y9ooBxbXC,http://dlvr.it/R5mvqg,,,0,0
Fri May 31 13:45:29 +0000 2019,nl,erikrijpstra,Nijmegen,"@JoasiaKowalik Och, gaan we zo beginnen? Ik vind de manier hoe Wilders tweet echt buiten alle proporties. Daar gaat het mij om.

Mag ik weten welke op welke partij je hebt gestemd tijdens de Provinciale Statenverkiezingen en die van de Europese verkiezingen?",https://twitter.com/i/web/status/1134455862452527105,,JoasiaKowalik,0,0
Fri May 31 13:42:03 +0000 2019,nl,StichtingJAS,Anna Paulowna,Grootste partij bij Europese verkiezingen: groep niet-stemmers https://t.co/H5e17VTQ8H,http://dlvr.it/R5msFL,,,0,0
Fri May 31 13:41:00 +0000 2019,nl,johnkistermann,"Maastricht, Nederland",@LodewijkA JAAAAA zeker top en ik heb hier 11 dagen geleden nog aandacht voor gevraagd in kader van Europese Verkiezingen. Wat kunnen wij doen? en nu voor meer welzijn ipv welvaart in Nederland  zie https://t.co/bWODYnRHWd,https://twitter.com/i/web/status/1134454735556239360,,LodewijkA,0,0
Fri May 31 13:35:35 +0000 2019,nl,PiratenpartijNL,Netherlands,Zes vragen en antwoorden over de Europese Verkiezingen - 1Limburg - Nieuws en Sport uit Limburg https://t.co/Y4wbGAnZTg https://t.co/YA7nXjjsJ9,https://twitter.com/i/web/status/1134453369756459008,,,0,0
Fri May 31 13:24:07 +0000 2019,nl,Iwein281252,Camelot,De blokkering van Wilders op Twitter impliceert natuurlijk ook dat deze een verbod op deelname aan de Europese verkiezingen had moeten krijgen. Met z’n vrijheid van meningsuiting.,https://twitter.com/i/web/status/1134450486764023809,,,0,0
Fri May 31 13:23:14 +0000 2019,nl,RaoulBoucke,Brussels-Rotterdam,Zo meteen vanaf 17.30 ben ik in @BNRfridaymove over oa de afgelopen Europese verkiezingen. Luister je mee? https://t.co/h3LCZJF9QR,https://twitter.com/BNR/status/1134437978024161285,,BNRfridaymove,1,5
Fri May 31 12:57:03 +0000 2019,nl,YpeVisser,,De Maltese bevolking heeft zich massaal afgekeerd van de lokale PN onderdeel van EVP. De PN  (Christendemocraten) zijn op Malta bij de Europese verkiezingen de grote verliezer! De derde verkiezingsnederlaag op rij! Reden voor CDA-er @PieterOmtzigt om nog een trap na te geven?,https://twitter.com/i/web/status/1134443674195156992,,,0,0
Fri May 31 12:47:04 +0000 2019,nl,WoltjesBia,"Groningen, Nederland",Europese verkiezingen zitten erop: ‘De Europese Commissie wil toetredingsonderhandelingen beginnen met Noord-Macedonië en Albanië’ https://t.co/OPKN87mG3K,https://twitter.com/i/web/status/1134441163639930880,,,0,0
Fri May 31 12:28:55 +0000 2019,nl,arnoyuma,"Lelystad, Nederland",Europese verkiezingen zitten erop: ‘De Europese Commissie wil toetredingsonderhandelingen beginnen met Noord-Macedonië en Albanië’ https://t.co/KXiLalPnag,https://twitter.com/i/web/status/1134436593866039299,,,0,0
Fri May 31 12:26:33 +0000 2019,nl,friedl_mark,,"Bilderberg 2019 heeft als onderwerp Brexit. NL delegatie pro EU met Rutte, Kaag, Buitenweg. Europese verkiezingen duidelijk anti EU. Wat voor plannen zouden ze in Montreux maken... #Bilderberg2019",https://twitter.com/i/web/status/1134435996781699073,,,1,0
Fri May 31 12:15:00 +0000 2019,nl,DoorbraakBe,Vlaanderen,Wouter Roorda: ‘PvdA van Frans Timmermans grootste bij Europese verkiezingen https://t.co/621REPTXKJ https://t.co/S3sGbHM4MA,https://doorbraak.be/pvda-van-frans-timmermans-grootste-bij-europese-verkiezingen/,,,1,0
Fri May 31 12:00:35 +0000 2019,nl,Boerenbusiness,The Netherlands,"Europa heeft vorige week gestemd. En, zoals zo vaak, kan deze stembusgang flink wat gevolgen hebben. https://t.co/q5MTxpnjeR",https://www.boerenbusiness.nl/financieel/artikel/10882670/europese-verkiezingen-de-politieke-gevolgen,,,0,0
Fri May 31 11:59:40 +0000 2019,nl,RoelMaalderink,"Amsterdam, Nederland","Media hebben volop aandacht besteed aan de ontevreden burger. Maar bij de Europese verkiezingen won de gematigde stem. Op zoek dus naar die redelijke, genuanceerde Nederlander. https://t.co/yOi1ra70gM",https://twitter.com/i/web/status/1134429234561245186,,,32,210
Fri May 31 11:26:04 +0000 2019,nl,JohanHDrent,Hoogezand,"@FleurAgemaPVV @geertwilderspvv Welke waarheid zal altijd de vraag blijven. Gelukkig begin Nederland de PVV door te krijgen als we de Europese verkiezingen bekijken,",https://twitter.com/i/web/status/1134420777770672128,,"FleurAgemaPVV, geertwilderspvv",0,0
Fri May 31 11:06:15 +0000 2019,nl,GBDunnie,Winterswijk-Ratum,"@Percolator_HNJ @Schiermonnik00g @Twitter @D66 Niet allen Twitter heeft genoeg van het gebral van Wilders, heel Nederland heeft er genoeg van, gezien de resultaten van de Europese verkiezingen.",https://twitter.com/i/web/status/1134415790013329409,,"Percolator_HNJ, Schiermonnik00g, Twitter, D66",0,0
Fri May 31 10:46:25 +0000 2019,nl,sargasso,Nederland,"Plagiaat of niet? @Sargasso in 2005 https://t.co/rxe5MAy7Xn
Versus @DeGroene deze week
https://t.co/1GTyCFHfHf https://t.co/UwFq1AXRNK","https://sargasso.nl/vrijdagtekening-poll-sort-of/, https://www.groene.nl/cartoonisten/gorilla/cartoons/europese-verkiezingen-06ec1cc6-49d4-4b99-b14e-c030a2ce0b19",,"sargasso, DeGroene",2,1
Fri May 31 10:09:19 +0000 2019,nl,_Venray,,"Burgemeester Willem Gradisen https://t.co/6GA107HXnb : wij zijn er voor u Buurtverbinders Petra en Loes brengen op 23 mei 2019, de dag van de Europese verkiezingen, een bezoek...","http://bit.ly/2HMMAV2, https://twitter.com/i/web/status/1134401462073724929",,,0,0
Fri May 31 09:44:07 +0000 2019,nl,ApeldoornNL,"Apeldoorn, Beekbergen, Loenen ",Indicatie opkomstpercentage Europese verkiezingen om 12.30 uur https://t.co/b97NFzBrSB,http://bit.ly/2MkmaOM,,,0,0
Fri May 31 09:44:06 +0000 2019,nl,ApeldoornNL,"Apeldoorn, Beekbergen, Loenen ",Definitieve uitslag Europese verkiezingen in Apeldoorn https://t.co/lKjnEeiXu2,http://bit.ly/2Mkm8GE,,,0,0
Fri May 31 09:43:34 +0000 2019,nl,WeertNL,"Weert, Stramproy",Voorlopige uitslag Europese verkiezingen in Weert https://t.co/MSdMWKt99x,http://bit.ly/2MjgMM3,,,0,0
Fri May 31 09:38:46 +0000 2019,nl,omroepbo,"Noordwijk, Nederland",Theo Alkemade krijgt te kort stemmen bij Europese Verkiezingen https://t.co/Nd2MpMNw12 via @@omroepbo,https://www.bollenstreekomroep.nl/2019/05/theo-alkemade-krijgt-te-kort-stemmen-bij-europese-verkiezingen/,,omroepbo,0,0
Fri May 31 09:38:21 +0000 2019,nl,DoorbraakBe,Vlaanderen,PvdA van Frans Timmermans grootste bij Europese verkiezingen - https://t.co/RzfCzcBc8I https://t.co/q56jyrQxjw,"http://Doorbraak.be, https://doorbraak.be/pvda-van-frans-timmermans-grootste-bij-europese-verkiezingen/?utm_term=Autofeed&utm_medium=Social&utm_source=Twitter#Echobox=1559294269",,,0,0
Fri May 31 09:30:07 +0000 2019,nl,nicky_aurora,"Hilversum, Nederland",@elineannepeters @StemopeenVrouw Helemaal mee eens! Ik heb gelijk gedoneerd. Het was geweldig om te zien wat er bij de Europese verkiezingen is bereikt 👍,https://twitter.com/i/web/status/1134391596210970624,,"elineannepeters, StemopeenVrouw",0,2
Fri May 31 09:23:20 +0000 2019,nl,freekewals,Den Haag,"Na het weekend nemen we weer een nieuwe Café Europa op. Heb je vragen aan @MathieuLLSegers @AnkeTruijen en @stefandevries over de uitslag van de Europese verkiezingen, de stoelendans om topposities of Le Pen/Macron? Stel ze hier, dan nemen we het mee! #CafeEuropa #HaagschCollege https://t.co/QidfU9X42h",https://twitter.com/i/web/status/1134389888550416384,,"MathieuLLSegers, AnkeTruijen",9,5
Fri May 31 09:13:22 +0000 2019,nl,Else4Weekblad,Elsevier is een geregistreerd merk van Elsevier B.V. en wordt gebruikt onder licentie.,". @AfshinEllian1 blikt nog eens terug op de nederlagen van SP en PVV tijdens de Europese verkiezingen, en heeft een tip voor Thierry Baudet van Forum voor Democratie: laat romantische bespiegelingen achterwege en bouw voort aan het Eppink-effect. https://t.co/76afUybsqX",https://twitter.com/i/web/status/1134387383007436800,,AfshinEllian1,4,14
Fri May 31 09:09:06 +0000 2019,nl,kristofsimoens,Vlaamse Ardennen,#FrankrijkWatcher Na het debacle van rechts #LR bij de Europese Verkiezingen wordt almaar nadrukkelijker gekeken naar #Sarkozy om zwalpende Les Républicains weer op de rails te krijgen. https://t.co/sXqmOXcIlB,https://twitter.com/i/web/status/1134386309211070465,"FrankrijkWatcher, LR",,0,0
Fri May 31 09:05:54 +0000 2019,nl,WouterBlomme,Oostende,"Hopelijk lezen onze 39 Vlaamse, federale en Europese parlementsleden het opiniestuk van @devoscarl vandaag in @kweeet!
""West-Vlaanderen verliest deze verkiezingen"" https://t.co/UkNhi1bIj9
@UNIZOwvl engageert zich alvast om mee te helpen aan de oplossing: https://t.co/BDFKYbLO0o",https://twitter.com/i/web/status/1134385505175556096,,devoscarl,1,3
Fri May 31 08:54:57 +0000 2019,nl,jangajentaan,Rotterdam,"@JohnZuyderduyn Hij deed het na de Provinciale Verkiezingen en voor de Europese Verkiezingen. Qua resultaten heeft hij gelijk gekregen. Veel voormalige VVD en CDA stemmers hebben FvD gestemd bij de Provinciale Verkiezingen, maar willen niet in radicaalrechts of ultraconservatief vaarwater komen.",https://twitter.com/i/web/status/1134382747865276416,,JohnZuyderduyn,1,2
Fri May 31 08:49:42 +0000 2019,nl,stefan_noppen,,@zazza_sicilia @epironet Waarom zijn er Europese verkiezingen?,,,"zazza_sicilia, epironet",0,1
Fri May 31 08:48:23 +0000 2019,nl,bjverschoor,Leiden,"Weer een mooie Betrouwbare Bronnen. Deze week zonder gast, maar met een diepgravende analyse van @PGKroeger en @JaapJansen over de uitslag van de Europese verkiezingen en acht wetten bij gedoe rond een Kamerlid
https://t.co/0mDx8D4xXz",https://twitter.com/i/web/status/1134381096328663040,,PGKroeger,2,2
Fri May 31 08:44:19 +0000 2019,nl,Vogelfluit,Een altijd veranderend NL,@KleinpasteThijs @ZihniOzdil Ozdil verkondigde dat vlak voor de Europese verkiezingen. Hij wist dondersgoed dat dat een timing is die schadelijk was voor Groenlinks.,https://twitter.com/i/web/status/1134380073199513601,,"KleinpasteThijs, ZihniOzdil",0,2
Fri May 31 08:33:55 +0000 2019,nl,wjvanderzanden,Oosterhout,@chrisklomp Jammer voor hem dat het na de Europese verkiezingen gebeurd.,,,chrisklomp,0,1
Fri May 31 08:31:49 +0000 2019,nl,HaagseVJ,,@chrisklomp Dit gaat Wilders veel sympathie en dus stemmen opleveren. Deze had hij voor de Europese verkiezingen moeten hebben.  Zonde.,,,chrisklomp,0,0
Fri May 31 08:06:49 +0000 2019,nl,NpcVersteeg,,"Is dit dat zelfde onnozele stuk vreten, dat enige tijd geleden nog STELLIG beweerde dat de Europese Verkiezingen....... HELEMAAL niet belangrijk waren!..... het is maar goed dat dit domme Volk......collectief aan AMNESIA lijdt!..... én dáárom deze RAT verdient! https://t.co/7fsOZwiIls",https://twitter.com/i/web/status/1134370634824392704,,,0,0
Fri May 31 07:45:00 +0000 2019,nl,wmeijer4,overijssel,Uitslag Europese verkiezingen stinkt als een beerput (video) | Niburu: https://t.co/xnAb7sMtdJ,http://niburu.co/index.php?option=com_content&view=article&id=14063:uitslag-europese-verkiezingen-stinkt-als-een-beerput&catid=9:binnenland&Itemid=22#.XPDaoRYPYMw.twitter,,,1,1
Fri May 31 06:57:32 +0000 2019,nl,Vogelfluit,Een altijd veranderend NL,"@lquispel @MyrtheHilkens @MKSanderse En dit is dus het hele punt: de timing van Ozdil om dit vlak voor de Europese verkiezingen te doen, was schadelijk voor Groenlinks.",https://twitter.com/i/web/status/1134353197454233606,,"lquispel, MyrtheHilkens, MKSanderse",0,1
Fri May 31 06:51:12 +0000 2019,nl,InwonersApldrn,"Apeldoorn Area, the Netherland","@HansdeBoer18 @Guldenhof_Hans Hoe de mensen meesten daar over denken is helder.

https://t.co/Q8Yc2njWad",https://fd.nl/economie-politiek/1302271/pvda-verrassende-winnaar-bij-europese-verkiezingen,,"HansdeBoer18, Guldenhof_Hans",0,0
Fri May 31 06:48:36 +0000 2019,nl,RogiestPhilippe,"Barcelona, España","Belgen in EU-landen misnoegd: ""Wisten niet dat we ons moesten registreren voor Europese verkiezingen"" https://t.co/ZkOqaHURDS",https://vrtnws.be/p.kwLY3QLmO,,,2,4
Fri May 31 06:12:54 +0000 2019,nl,bloemkolk,,"Otten legt verband tussen @thierrybaudet 's hoogdravend lulverhaal over de positie van de vrouw en het recente verlies van drie zetels bij de Europese verkiezingen. Dat wordt weer gillen, deuren smijten en de vleugel aan splinters slaan bij Forum. https://t.co/gTwW13Hxjz",https://twitter.com/i/web/status/1134341965749915648,,thierrybaudet,2,9
Fri May 31 06:01:16 +0000 2019,nl,NeulisW,Catalunya,Ik ben NL-er en heb gestemd met de EU verkiezingen. De stem van de Europese medeburgers in Catalonië moet worden gerespecteerd. Het is onacceptabel dat de democratisch gekozen MEP's Puigdemont en Comín de toegang tot het EU parlement worden geweigerd. @MinPres   @TimmermansEU https://t.co/IMbQH7RlWk,https://twitter.com/i/web/status/1134339039719542784,,,2,4
Fri May 31 05:26:37 +0000 2019,nl,JaapJansen,Amsterdam,Betrouwbare Bronnen afl. 39 is online! 👉 Europese formatie: @sanchezcastejon en @EmmanuelMacron hebben sleutel in handen 🇪🇺 Diepgravende analyse @PGKroeger van uitslag verkiezingen 🇳🇱 Affaire @ZihniOzdil: Acht wetten bij ‘gedoe’ met een Kamerlid 🎧 https://t.co/KawTXLrpfl https://t.co/VFE5I1bgVi,https://twitter.com/i/web/status/1134330318754930688,,"sanchezcastejon, EmmanuelMacron",10,17
Fri May 31 05:20:06 +0000 2019,nl,martin12676994,"Delfzijl, Nederland",Misselijkmakend is dit de Nederlanders kunnen betalen . Wij zijn dom en naïf en betalen de prijs.Europese verkiezingen zitten erop: ‘De Europese Commissie wil toetredingsonderhandelingen beginnen met Noord-Macedonië en Albanië’ https://t.co/lGUdPfbNC9,https://twitter.com/i/web/status/1134328679243419648,,,0,0
Fri May 31 05:15:18 +0000 2019,nl,daandiederiks,Amsterdam,Was u vorige week ook zo verbijsterd over de winst van de PvdA bij de Europese verkiezingen? Misschien is dit het moment voor de serieuze journalistiek om zich eens ernstig achter de oren te krabben. https://t.co/R2GbuebtAi,https://twitter.com/i/web/status/1134327469446705153,,,0,0
Fri May 31 03:41:06 +0000 2019,nl,Hera22112013,,De uitslagen van de Europese verkiezingen op een rij https://t.co/NeRN5v9YXZ via @Else4Weekblad,http://tinyurl.com/y5yuy2fj,,Else4Weekblad,0,0
Thu May 30 23:49:47 +0000 2019,nl,AndreHvanDijk,,@CHANTAL53970335 @PolitieUtrecht @Sashaexposed Straks vertel je me nog dat de Paus moslim is? Veel plezier nog met trollen ter meerdere eer en glorie van je leider Geert en nog gefeliciteerd met de resultaten van de Europese verkiezingen.,https://twitter.com/i/web/status/1134245552923828233,,"CHANTAL53970335, PolitieUtrecht",0,0
Thu May 30 22:59:03 +0000 2019,nl,BrobbelC,rotterdam,@GeertvanBoxtel In 1 dag zowel bij de FNV zijn als het protest van de Joodse gemeenschap en daar ook uitdrukkelijk van getuigen terwijl FVD anders stemt in de kamer is de gospe van faschisten. Ze hebben stemmen verloren bij Europese verkiezingen dus proberen ze het volk te naaien.,https://twitter.com/i/web/status/1134232786083225604,,GeertvanBoxtel,0,0
Thu May 30 22:39:33 +0000 2019,nl,PiratenpartijNL,Netherlands,Voorlopige uitslag verkiezingen Europese Parlement in Bodegraven-Reeuwijk - RTV Bodegraven https://t.co/XTvTiDhH1Z,http://dlvr.it/R5ksC6,,,0,0
Thu May 30 21:43:15 +0000 2019,nl,Woordvoerdercdk,"Zwolle, Overijssel",Zeer verdiend! Geweldig hoe @rtvoost de verkiezingen onder de aandacht bracht en daar nu terecht de credits voor krijgt! Kijk ook terug op een mooie samenwerking. https://t.co/utGg47cieb #psov @ProvOverijssel @provinciepers,https://twitter.com/i/web/status/1134213707578380289,,rtvoost,3,13
Thu May 30 21:39:30 +0000 2019,nl,EdicEindhoven,Eindhoven,"Europa is binnenlandse politiek geworden
De Europese verkiezingen doen er toe, op Europees niveau én in de lidstaten. Er mag dan geen Europees volk zijn, het is wél komen stemmen
https://t.co/7ZbJfKseqg via @decorrespondent",https://twitter.com/i/web/status/1134212765579714560,,,0,0
Thu May 30 21:31:57 +0000 2019,nl,Ben_Antonius,Republic of Catalonia,"@HoogenHans @Hej_Pej Ik ben Nederlander, democraat en heb gestemd met de Europese verkiezingen. ik eis dat de stem van onze Europese medeburgers in Catalonië wordt gerespecteerd. Het is daarom onacceptabel dat de gekozen MEP's Puigdemont en Comín de toegang tot het EU parlement worden geweigerd.",https://twitter.com/i/web/status/1134210864184266761,,"HoogenHans, Hej_Pej",54,95
Thu May 30 21:31:28 +0000 2019,nl,dutchDemocrat,Barcelona,"@QuantumAspect @HoogenHans @Hej_Pej Ik ben Nederlander, democraat en heb gestemd met de Europese verkiezingen. ik eis dat de stem van onze Europese medeburgers in Catalonië wordt gerespecteerd. Het is daarom onacceptabel dat de gekozen MEP's Puigdemont en Comín de toegang tot het EU parlement worden geweigerd.",https://twitter.com/i/web/status/1134210741601484800,,"QuantumAspect, HoogenHans, Hej_Pej",135,214
Thu May 30 21:24:50 +0000 2019,nl,QuantumAspect,The Netherlands,"@HoogenHans @Hej_Pej Ik ben Nederlander, democraat en heb gestemd met de Europese  verkiezingen. ik eis dat de stem van onze Europese medeburgers in  Catalonië wordt gerespecteerd. Het is daarom onacceptabel dat de gekozen MEP's Puigdemont en Comín de toegang tot het EU parlement worden  geweigerd.",https://twitter.com/i/web/status/1134209076068585482,,"HoogenHans, Hej_Pej",89,157
Thu May 30 21:18:33 +0000 2019,nl,jschreuder,"Utrecht, Nederland",Eerste peiling na Europese verkiezingen heeft LibDems nationaal als grootste partij in VK 🤩 https://t.co/nmrDmk0L72,https://twitter.com/JamesMelville/status/1134170731221258245,,,0,7
Thu May 30 20:59:42 +0000 2019,nl,PaasKuikentje,"Slovakia, Bratislava",Hoppa #MH17 elke stem op de PvdA van de Europese verkiezingen waren dus stemmen tegen MH17... Niemand is voor de waarheid. Schandelijk. https://t.co/8sQTeFoLcv,https://twitter.com/i/web/status/1134202751007768576,MH17,,4,3
Thu May 30 20:45:40 +0000 2019,nl,Nounoutjatjapoe,,@Mirjam152 @rkemp59 Met de pvv het zelfde  voor de verkiezingen word er totaal geen zendtijd aan de pvv besteet na het verlies in het europese parlement is het de hele dag op de nos en de dagen er na ook  lekker trappen op de pvv die slinkse pvda kliek bij de nos !,https://twitter.com/i/web/status/1134199216123908107,,"Mirjam152, rkemp59",1,2
Thu May 30 20:41:02 +0000 2019,nl,HoogenHans,República Catalana,"@Hej_Pej Ik ben Nederlander, democraat en heb gestemd met de Europese verkiezingen. ik eis dat de stem van onze Europese medeburgers in Catalonië wordt gerespecteerd. Het is daarom onacceptabel dat de gekozen MEP's Puigdemont en Comín de toegang tot het EU parlement worden geweigerd.",https://twitter.com/i/web/status/1134198053261500417,,Hej_Pej,168,275
Thu May 30 20:29:07 +0000 2019,nl,Hej_Pej,"Groningen, Nederland","Ik ben Nederlander, democraat en heb gestemt met de Europese verkiezingen. ik eis dat de stem van onze Europese medeburgers in Catalonië wordt gerespecteerd. Het is daarom onacceptabel dat de gekozen MEP's Puigdemont en Comín de toegang tot het EU parlement worden geweigerd. https://t.co/K1gYL8Pfct",https://twitter.com/i/web/status/1134195054388613120,,,1443,2583
Thu May 30 20:18:39 +0000 2019,nl,jann1959,Zeewolde,Dit artikel verscheen al in februari 2019 in ⁦@volkskrant⁩ en vandaag opnieuw onderdeel van de digitale special over populisme in Europa. In retrospectief verklaart het de verrassende Nederlandse uitslag van de Europese verkiezingen van vorige week.  https://t.co/P5ZuC6a4zJ,https://twitter.com/i/web/status/1134192417815633920,,volkskrant,1,0
Thu May 30 20:15:20 +0000 2019,nl,AartvanAcquoij,"Dorp Warnsveld, Zutphen",Roemenië gaat kijken hoe nieuwe chaos bij verkiezingen hier te voorkomen   https://t.co/K6irkqfjqI,https://nos.nl/l/2286987,,,0,0
Thu May 30 20:10:51 +0000 2019,nl,robertpbas,Rotterdam (NL) en Sibiu (RO),Roemenië gaat kijken hoe nieuwe chaos bij verkiezingen hier te voorkomen. https://t.co/IwNJZom7EO,https://nos.nl/l/2286987,,,0,0
Thu May 30 19:58:56 +0000 2019,nl,VerhulstMonique,República de Catalunya,"Ik ben Nederlandse, democraat en heb gestemt met de Europese verkiezingen. Ik eis dat de stem van onze Europese medeburgers in Catalonië wordt gerespecteerd. Het is daarom onacceptabel dat de gekozen MEP's Puigdemont en Comín de toegang tot het EU parlement worden geweigerd. https://t.co/qlLMWwEI99",https://twitter.com/i/web/status/1134187458155941889,,,0,6
Thu May 30 19:46:54 +0000 2019,nl,telegraaf,Amsterdam,De 32-jarige Di Maio riep zelf op tot de stemming nadat de eurosceptische Vijfsterrenbeweging slechts 17 procent van de stemmen had gekregen bij de Europese verkiezingen https://t.co/dxoj9mVoDK,https://twitter.com/i/web/status/1134184429516206082,,,1,2
Thu May 30 19:24:52 +0000 2019,nl,cmsnse1,The Netherlands,"@thierrybaudet Prachtige interessante analyse van Laura Ingraham van FOX News USA over de Europese Verkiezingen.
https://t.co/AikwIeUXZW",https://www.youtube.com/watch?v=9sV3hHy4BCg,,thierrybaudet,0,1
Thu May 30 19:24:16 +0000 2019,nl,cmsnse1,The Netherlands,"Prachtige interessante analyse van Laura Ingraham van FOX News USA over de Europese Verkiezingen.
https://t.co/AikwIeUXZW",https://www.youtube.com/watch?v=9sV3hHy4BCg,,,0,0
Thu May 30 19:17:27 +0000 2019,nl,andreavreede,"Rome, Italy","Na het magere resultaat bij de Europese verkiezingen kondigt Forza Italia in het najaar een congres aan. #Berlusconi laat weten leider te blijven. Of er dan nog een partij is om leiding aan te geven, valt te bezien https://t.co/A4miMv8n7B",https://twitter.com/i/web/status/1134177019032420354,,,0,2
Thu May 30 19:12:59 +0000 2019,nl,andreavreede,"Rome, Italy",Via een interne raadpleging online hebben 80% van de ingeschreven activisten van de #Vijfsterrenbeweging hun vertrouwen in politiek leider Luigi Di Maio herbevestigd. Dit na het grote verlies bij de Europese verkiezingen. Ruim 55.000 stemmen zijn uitgebracht,https://twitter.com/i/web/status/1134175892303994885,Vijfsterrenbeweging,,1,1
Thu May 30 19:05:58 +0000 2019,nl,jhsgrs,,"@FranckenTheo Erdogan was zo beleefd om te wachten tot na de europese verkiezingen van 26 mei. Hij verwacht wel eerstdaags opnieuw een cheque van 6 miljard.

PS, deze mensen komen onze pensioenen betalen en de facturen van migratie, transfers en schulden op te lossen, dixit Calvo &amp; Michel.",https://twitter.com/i/web/status/1134174125927407617,,FranckenTheo,0,0
Thu May 30 19:03:08 +0000 2019,nl,synergycons,,Roemenië gaat kijken hoe nieuwe chaos bij verkiezingen hier te voorkomen   /via @NOS wat een leugens in heel europa zijn roemenen bewust tegengewerkt vanweg de wet corruptie goed te keuren https://t.co/W6s5khiJFJ,https://twitter.com/i/web/status/1134173414544093184,,NOS,0,0
