created_at,lang,screen_name,location,full_text,urls,tags,mentions,retweet_count,favorite_count
Mon May 27 11:44:01 +0000 2019,nl,SCPopa,"Baarn, Netherlands","Dus: doei Dragnea! Anti-corruptiepartijen winnen Europese verkiezingen, referendum tégen corruptie groot succes, oppositie krijgt meerderheid van de stemmen, en opperbaron Dragnea gaat 3,5 jaar de gevangenis in... Gaat de Roemeense regering van PSD en Alde deze week overleven?",https://twitter.com/i/web/status/1132975741904347138,,,0,1
Mon May 27 11:42:19 +0000 2019,nl,W_Struijvenberg,"Rotterdam, The Netherlands",@KIESLIES @groenlinksrdam @wiesvdsluis @pvdarotterdam Nee hoor. Je vergeet de lokale partijen die niet meededen aan de Europese verkiezingen. Dus hoezo zijn jullie de 2e partij van Rotterdam?,https://twitter.com/i/web/status/1132975316652175360,,"KIESLIES, groenlinksrdam, wiesvdsluis, pvdarotterdam",0,1
Mon May 27 11:42:10 +0000 2019,nl,Leminaa,Nederland,Europese verkiezingen: PvdA ook in Den Helder de grootste https://t.co/mcjBBcMHdI via @DHelderActueel,https://denhelderactueel.nl/2019/05/europese-verkiezingen-pvda-ook-in-den-helder-de-grootste/,,DHelderActueel,0,0
Mon May 27 11:42:01 +0000 2019,nl,Marssieboy,Netherlands,@RobertoSkeletti Niet uit mijn hoofd. https://t.co/Kb7zz7RA6V,https://www.google.nl/search?source=hp&ei=x8zrXLu1HtDzkwWL6YXQCQ&q=uitslag+europese+verkiezingen+2019&oq=Uits&gs_l=mobile-gws-wiz-hp.1.0.0i131l4j0l3j0i3.1824.3451..4887...0.0..0.131.437.4j1......0....1.......0..46i131i275j46i131.FXSRQywP2Kg,,RobertoSkeletti,1,0
Mon May 27 11:40:43 +0000 2019,nl,gem_go,Middelharnis,"Heb jij de voorlopige uitslag van de Europese verkiezingen al gezien?  

Hierbij het overzicht van de voorlopige uitslag op Goeree-Overflakkee. Kijk voor meer informatie op:https://t.co/TRoi2Nf6h7 https://t.co/P0nISwk7dJ",https://twitter.com/i/web/status/1132974912149348357,,,2,3
Mon May 27 11:40:02 +0000 2019,nl,DeStellingwerf,Wolvega,[PLUS] PvdA grote winnaar in Weststellingwerf: Wolvega – Bij de Europese verkiezingen  ... https://t.co/UVaS0fKxMr,http://enz.nl/5vftc,,,0,0
Mon May 27 11:37:12 +0000 2019,nl,dongenhomespot,Dongen,"Dongen volgt #politiek Nederlandse  trend 
Dongen, 27 mei 2019. De uitslag in Dongen van de vorige week gehouden verkiezingen voor het Europese Parlement wijkt niet of nauwelijks af van de landelijke trend die een ware ruk naar matig  links maakte.  https://t.co/DaCpmPYWix https://t.co/qRKQKHAeUO",https://twitter.com/i/web/status/1132974025830010880,politiek,,0,0
Mon May 27 11:35:33 +0000 2019,nl,OrionWebbox3,Delft,"Bij de Europese verkiezingen #EP2019 gaf onze Soundbox, een aangepaste Webbox3, audio-ondersteuning. Zo konden #blinden en #lsechtzienden zelfstandig stemmen, o.a. in @GemeenteUtrecht. @vincent_bijlo vondt dit ""goed te doen"", zegt hij in @audiohorizon.
https://t.co/6vh6hNxOLN https://t.co/dZt5QBouNY",https://twitter.com/i/web/status/1132973610526756864,EP2019,,0,0
Mon May 27 11:34:49 +0000 2019,nl,Steven_vdv,"Ghent, Belgium","Kan het zijn dat politico de enige site is die zonder paywall een ietwat deftige analyse van de Europese verkiezingen brengt?
Armoe troef bij Vlaamse krantensites.",https://twitter.com/i/web/status/1132973426619105280,,,0,0
Mon May 27 11:34:27 +0000 2019,nl,groothellevoet,,Uitslag Europese Verkiezingen in Hellevoetsluis - https://t.co/SHLoAnV0Co https://t.co/j6nNt5bfAH,http://www.groothellevoet.nl/lees/97022/titel-na-activeren,,,0,0
Mon May 27 11:34:27 +0000 2019,nl,groothellevoet,,Uitslag Europese Verkiezingen in Hellevoetsluis - https://t.co/SHLoAnV0Co https://t.co/j6nNt5bfAH,http://www.groothellevoet.nl/lees/97022/titel-na-activeren,,,0,0
Mon May 27 11:31:10 +0000 2019,nl,GerritRentier,"Middelburg, Zeeland,  NL, EU",Omroep Zeeland geeft per Zeeuwse gemeente de uitslag van de #EuropeanElectionResults weer voor #Zeeland; https://t.co/lSa3sQU4j1 Gemeente Middelburg volgt landelijke trend dat in grotere steden GroenLinks groeiende is #democratie #klimaat #economie #EP2019 https://t.co/vpK6yuUAzb,https://twitter.com/i/web/status/1132972508083302401,"EuropeanElectionResults, Zeeland",,1,1
Mon May 27 11:29:56 +0000 2019,nl,ochtendshowtogo,,"De Ochtend Show to go: maandag 27 mei
🗣️ @m_wijffelsAD over het afscheid van Arjen Robben
🗣️ @annefleurdd over de Europese Verkiezingen
🎤Hila Noorzai &amp; @ManuelVenderbos 
https://t.co/Sdni9emr1w",https://twitter.com/i/web/status/1132972198136811520,,"m_wijffelsAD, annefleurdd",1,0
Mon May 27 11:29:16 +0000 2019,nl,NieuwsNu123,,"PVV en SP likken wonden na mislopen Europese zetels.

https://t.co/u09Hcqtr7R

De Europese verkiezingen zijn voor de SP en PVV desastreus verlopen. Beide partijen krijgen geen zetels in het Europees Parlement.
Daar waar in Italië, Frankrijk en België de rechts-populistisch... https://t.co/Eun0nor00u","http://twitter.nu123.nl/pvv-en-sp-likken-wonden-na-mislopen-europese-zetels/, https://twitter.com/i/web/status/1132972031513964544",,,0,0
Mon May 27 11:29:13 +0000 2019,nl,Zuid81,"Amsterdam, Netherlands",Hoppa! Extra zetel ten koste van #groenlinks is altijd fijn. https://t.co/3mAMXTNbok via @NUnl,https://www.nu.nl/europese-verkiezingen-2019/5910381/extra-zetel-na-brexit-gaat-niet-naar-groenlinks-maar-naar-forum.html,groenlinks,NUnl,0,0
Mon May 27 11:29:02 +0000 2019,nl,LOZNieuws,"Loon op Zand, Noord-Brabant",Uitslagen Europese verkiezingen Loon op Zand https://t.co/mWf9wcUU1Y,https://loon-op-zand.nieuws.nl/nieuws/56118/uitslagen-europese-verkiezingen-loon-op-zand/,,,0,0
Mon May 27 11:28:53 +0000 2019,nl,EP_Belgium,Brussels,#EUverkiezingen2019 : Update zetelverdeling nieuw Europees Parlement 2019-2024 ➡️ https://t.co/Pq9kclAWvV https://t.co/DNRlAJtUPU,http://bit.ly/2QtiWXR,EUverkiezingen2019,,0,0
Mon May 27 11:28:27 +0000 2019,nl,Tilburgers,Tilburg,PvdA grootste in #Tilburg bij Europese verkiezingen https://t.co/3eKpP2XHeL https://t.co/sVrH2m6QEY,https://www.tilburgers.nl/pvda-grootste-in-tilburg-bij-europese-verkiezingen/,Tilburg,,0,0
Mon May 27 11:27:38 +0000 2019,nl,oogopmorgen,Hilversum,@jmorika Dag! Gisteravond was er geen uitzending vanwege de Europese verkiezingen... Vanavond zijn we er weer!,,,jmorika,0,1
Mon May 27 11:26:41 +0000 2019,nl,PaulHaseloop,"The Hague, The Netherlands",'Verkiezingen laten zien dat Europese democratie springlevend is' https://t.co/I6a2etWes9 via @NOS,https://nos.nl/l/t/2286462,,NOS,0,0
Mon May 27 11:24:58 +0000 2019,nl,madicleerdin,"Zuurdijk, De Marne","Bekijk hier de uitslag van de Europese verkiezingen per gemeente - #rtvnoord
⁦@HetHogeland⁩ #PvdA de grootste! ❤️⁦@PvdA⁩ 👏
⁦@PvdAhetHogeland⁩ 🙌 https://t.co/Ao2WoP8AcJ",https://twitter.com/i/web/status/1132970949874266112,"rtvnoord, PvdA",HetHogeland,0,1
Mon May 27 11:24:21 +0000 2019,nl,enroctoob,Rotterdam ,"PvdA in helft Nederlandse gemeenten grootste partij, PVV verliest overal
 https://t.co/TtdFqEOJNY",https://www.nu.nl/europese-verkiezingen-2019/5910099/pvda-in-helft-nederlandse-gemeenten-grootste-partij-pvv-verliest-overal.html,,,0,0
Mon May 27 11:23:57 +0000 2019,nl,renedebat,"Zeeland, Nederland","Victorie in #Frankrijk ! Rassemblement National (RN), de partij van de #eurosceptische en #nationalistische Marine #LePen, wint de #Europese verkiezingen van de beweging van de uitgesproken pro-Europese president Emmanuel #Macron in Frankrijk. ..... 1/2 https://t.co/ilqqG6QvnS",https://twitter.com/i/web/status/1132970694931824640,"Frankrijk, eurosceptische, nationalistische",,0,0
Mon May 27 11:23:01 +0000 2019,nl,WaalwijkNL,"Waalwijk, 's Grevelduin-Capell",Uitslagen Europese verkiezingen Waalwijk https://t.co/PQNMjgoBYu,http://bit.ly/2I2oFjB,,,0,0
Mon May 27 11:22:25 +0000 2019,nl,MarjeLLaMokum,AJAX❌❌❌MOKUM🇳🇱🇮🇱AMSTERDAM✡,"@edwin_koning @Kiesraad @NOS @VVD @D66 @fvdemocratie Volgens mij ben ik wel goed ingelezen en vraag mij dan ook oprecht af waarom de Europese verkiezingen anders zijn dan de binnenlandse verkiezingen. Zelfs de kiesraad verwijst naar een artikel waarin verwezen wordt naar EC regels, echter dit zou dan in de EU grondwet moeten staan!",https://twitter.com/i/web/status/1132970308250558465,,"edwin_koning, Kiesraad, NOS, VVD, D66, fvdemocratie",0,0
Mon May 27 11:22:18 +0000 2019,nl,CDAElburg,Gemeente Elburg,"Uitslag EUVerkiezingen in Elburg: @CDAElburg leed verlies, maar blijft op de tweede plaats. 13,3 procent van de stemmen (2014, 15,7) Kiezers bedankt 👍🏻🍀 @gem_Elburg https://t.co/Rv8Lk7Kw9L",https://twitter.com/i/web/status/1132970279859294211,,CDAElburg,1,1
Mon May 27 11:22:11 +0000 2019,nl,cmo_nijmegen,"Nijmegen, Nederland","De #verkiezingen voor het Europe Parlement zijn achter de rug. De politieke (aard)verschuivingen zijn zichtbaar. Nu begint de race om het voorzitterschap van de Europese Commissie. Wordt het #Timmermans, of toch #Weber...?",https://twitter.com/i/web/status/1132970250637631488,verkiezingen,,0,0
Mon May 27 11:22:03 +0000 2019,nl,renedebat,"Zeeland, Nederland","Victorie in #Frankrijk ! Rassemblement National (RN), de partij van de #eurosceptische en #nationalistische Marine #LePen, wint de #Europese verkiezingen van de beweging van de uitgesproken pro-Europese president Emmanuel #Macron in Frankrijk. ..... 1/2 https://t.co/fzAl7ew1Ow",https://twitter.com/i/web/status/1132970213950070784,"Frankrijk, eurosceptische, nationalistische",,0,0
Mon May 27 11:21:08 +0000 2019,nl,enroctoob,Rotterdam ,'Verkiezingen laten zien dat Europese democratie springlevend is' /via @NOS https://t.co/Z4KzVEp1DX,https://nos.nl/l/2286462,,NOS,0,0
Mon May 27 11:20:13 +0000 2019,nl,JosvanGoethem,Hengelo,#Democratie? #Verkiezingen laten zien dat #Europese #democratie springlevend is? 3% hogere opkomst bewijst slechts dat 60% nog steeds geen vertrouwen heeft! https://t.co/FxCr7LzKBY via @NOS,https://twitter.com/i/web/status/1132969752203280384,"Democratie, Verkiezingen, Europese, democratie",,0,0
Mon May 27 11:20:04 +0000 2019,nl,ziggy0001,,"Europese verkiezingen hebben helemaal niets met democratie te maken... Geen idee waar je voor kiest, de poppenkast doet waar ie zin in heeft...",https://twitter.com/i/web/status/1132969716769808384,,,0,0
Mon May 27 11:19:07 +0000 2019,nl,praatnederlands,"Amsterdam, Nederland",PvdA grootste bij Europese verkiezingen in Nederland #ep2019 #eu #timmermans https://t.co/FCXaUO5P9f #EUInternationalAcademy RT europanu https://t.co/DirEGofvIY #EUIAOJ at https://t.co/p60n4cz7LF,"http://bit.ly/2HXfT6v, https://twitter.com/i/web/status/1132969475031093248","ep2019, eu, timmermans",,0,0
Mon May 27 11:18:15 +0000 2019,nl,WilcoBoom,,De vorige Europese lijsttrekker van de SP baalt als een stekker van Brusselmans-spotje https://t.co/4t3oMcgwAw,https://www.ad.nl/dossier-europese-verkiezingen/filmpje-sp-over-hans-brusselmans-was-miskleun~a7326bbe/?utm_source=twitter&utm_medium=social&utm_campaign=socialsharing_web,,,1,2
Mon May 27 11:17:50 +0000 2019,nl,renedebat,"Zeeland, Nederland","Victorie in #Frankrijk ! Rassemblement National (RN), de partij van de #eurosceptische en #nationalistische Marine #LePen, wint de #Europese verkiezingen van de beweging van de uitgesproken pro-Europese president Emmanuel #Macron in Frankrijk. ..... 1/2 https://t.co/OwW6KZlNzH",https://twitter.com/i/web/status/1132969153839730688,"Frankrijk, eurosceptische, nationalistische",,0,0
Mon May 27 11:16:33 +0000 2019,nl,europanu,Nederland,PvdA grootste bij Europese verkiezingen in Nederland #ep2019 #eu #timmermans https://t.co/OLFGLUr6yd,https://www.europa-nu.nl/id/vkyuge7xvtog?ctx=vh6ukzb3nnt0,"ep2019, eu, timmermans",,1,0
Mon May 27 11:15:13 +0000 2019,nl,lieropp,,"@Infocadl2015 https://t.co/m5GinlMWg9

'De politieke afstraffing vindt in Zweden meer op rechts plaats.'",https://www.volkskrant.nl/nieuws-achtergrond/europese-verkiezingen-hoe-de-belangrijkste-lidstaten-stemmen~b1d31355/?referer=https%3A%2F%2Fwww.google.com%2F,,Infocadl2015,0,0
Mon May 27 11:11:09 +0000 2019,nl,dreoudman,"appingedam, netherlands",Europese verkiezingen: triomf voor het gezonde verstand https://t.co/WowMPuWsYk,http://bit.ly/2JGRLIn,,,0,0
Mon May 27 11:10:17 +0000 2019,nl,OrionWebbox3,Delft,"""Het werkt opzich heel simpel en het is goed te doen!"", zegt @vincent_bijlo over het zelfstandig stemmen met de Soundbox (aangepaste #Webbox3) en stemmal. Gebruikt bij de Europese verkiezingen #EP2019 in o.a. @GemeenteUtrecht.
Hoor meer in @AudioHorizon
https://t.co/6vh6hNxOLN https://t.co/UpHvAyPB1L",https://twitter.com/i/web/status/1132967254579208193,,vincent_bijlo,0,0
Mon May 27 11:09:22 +0000 2019,nl,peetsmeets,Limburg,"Laagste opkomst in Limburg, maar áls we gaan maken we geen fouten (en meer Limburgse weetjes over de verkiezingen) https://t.co/f7UUAz0vGq

Hoe deed Limburg het tijdens de Europese Verkiezingen? Wie een blik werpt op de uitslagen, komt opmerkelijke weetjes tegen. Waar kreeg Jez…",https://twitter.com/i/web/status/1132967021405188101,,,0,0
Mon May 27 11:09:14 +0000 2019,nl,Homosap97831912,,Nog meer EU nieuws op andere social media o.a.: https://t.co/OLZeOk04Us - of ook: https://t.co/V6MsyDIcWH en veel méér daar nog voor degenen die? een oude foto al... maar nu?😕 Politieke vluchtelingen uit Vlaanderen binnenkort? https://t.co/mW1hKwxvPt https://t.co/lZ4IZ9FFMW,"http://europese-unie.clubs.nl/forum/topic/4720172_europese-verkiezingen?p=1#r43373473, http://maatschappelijke-belangen-beheerdersinfo.clubs.nl/forum/topic/4252443_europese-politiekde-eu?p=1#r43373475, https://twitter.com/i/web/status/1132966990535122946",,,0,0
Mon May 27 11:08:55 +0000 2019,nl,hmvandenbosh,DHaag,"PvdA in helft Nederlandse gemeenten grootste partij, PVV verliest overal https://t.co/NF4yQCVOgA via @NUnl
Als meer dan de helft van PVV en FvD  niet gaan stemmen win en verlies je al snel. Kijk naar rest van de EU daar verliezen de sociaaldemocraten dik bij hoge opkomsten.","https://www.nu.nl/europese-verkiezingen-2019/5910099/pvda-in-helft-nederlandse-gemeenten-grootste-partij-pvv-verliest-overal.html, https://twitter.com/i/web/status/1132966909077544961",,NUnl,0,1
Mon May 27 11:08:50 +0000 2019,nl,theodorus1948,"Zuid-Holland, Nederland","PvdA winnaar Europese Verkiezingen in Drenthe #rtvdrenthe

Hoe kan je ip zo een huichelaar gaan stemmen...onbegrijpelijk

https://t.co/VXzomWZ4jS",https://twitter.com/i/web/status/1132966888764579842,rtvdrenthe,,1,1
Mon May 27 11:07:53 +0000 2019,nl,nrc,24 landen,Met zijn kritiek op het Europese begrotingsbeleid en zijn belofte van minder immigranten en meer veiligheid is Matteo Salvini de grote winnaar geworden in Italië. De uitslag van de Europese verkiezingen zet de politieke verhoudingen in Rome op hun kop. https://t.co/qCoRXN32f6,https://twitter.com/i/web/status/1132966650012143616,,,0,2
Mon May 27 11:06:52 +0000 2019,nl,DlPblq,,"PvdA grootste bij Europese verkiezingen, D66 verliest en halveertMay 21, 2019 at 08:15PM @ImPblq",,,ImPblq,0,0
Mon May 27 11:06:50 +0000 2019,nl,keessensitive,,"De zwijgende meerderheid, is z’n stem weer kwijt. PVV en SP verdwijnen uit Europees Parlement, PvdA wint met zes zetels
 https://t.co/caX0G2uG2P",https://twitter.com/i/web/status/1132966384206589952,,,0,0
Mon May 27 11:06:18 +0000 2019,nl,tgooinieuws,,#VVD grootste in Gooise Meren bij Europese verkiezingen De #VVD is onder de Gooise Meren-kiezers de grootste geworden bij de verkiezingen voor het Europees Parlement... https://t.co/nzJVW2tJpM,https://twitter.com/i/web/status/1132966252065054720,"VVD, VVD",,0,0
Mon May 27 11:06:18 +0000 2019,nl,tgooinieuws,,#VVD grootste in Gooise Meren bij Europese verkiezingen Lees verder bij de bron https://t.co/Axzg5LfOC2... https://t.co/7IBpXiECr2,"http://naardernieuws.nl, http://bit.ly/2MeBPza",VVD,,0,0
Mon May 27 11:06:05 +0000 2019,nl,GemeenteUT,Nederland,Zo stemde jouw wijk bij de Europese verkiezingen https://t.co/90CDLNSg7p | https://t.co/01xh3LPrAA #Utrecht #DUIC https://t.co/NGnP8oKtfT,"http://dlvr.it/R5VMzF, http://bit.ly/BestNieuws","Utrecht, DUIC",,0,0
Mon May 27 11:04:37 +0000 2019,nl,WimdeWinEersel,,CDA de grootste in gemeente Eersel https://t.co/pooTRPNVS2,https://nos.nl/europese-verkiezingen/uitslagen-eersel?ref=twitter,,,1,0
Mon May 27 11:04:35 +0000 2019,nl,Leodeadviseur,AMS-NL,@telegraaf Alsof die Europese uitslagen ook maar I e t s zeggen over Nederlandse verkiezingen!,,,telegraaf,0,0
Mon May 27 11:03:27 +0000 2019,nl,waalwijk_nieuws,Waalwijk,Uitslagen Europese verkiezingen Waalwijk https://t.co/RlEvHRXdgD,https://waalwijk.nieuws.nl/gemeente/20190527/uitslagen-europese-verkiezingen-waalwijk/,,,0,0
Mon May 27 11:03:06 +0000 2019,nl,RonSmallenburg,"Amsterdam, Nederland","@arnhemsmeisje62 @Dranrebben @Oafaezza Graag gedaan maar, naar nu blijkt, gaat de extra zetel bij #Brexit niet naar GroenLinks, maar naar FvD. Die hebben net iets meer stemmen behaald dan GL. https://t.co/89b9ldMgqe",https://twitter.com/i/web/status/1132965447467524096,Brexit,"arnhemsmeisje62, Dranrebben, Oafaezza",0,3
Mon May 27 11:02:31 +0000 2019,nl,dreoudman,"appingedam, netherlands",Half miljoen minder stemmen voor Baudet. Ik zeg: #FVD gaat wel weer kapot!  https://t.co/jpJemvMBNS,https://www.ad.nl/dossier-europese-verkiezingen/half-miljoen-minder-stemmen-voor-baudet~a335bba6/?utm_source=twitter&utm_medium=social&utm_campaign=socialsharing_web,FVD,,0,0
Mon May 27 11:02:20 +0000 2019,nl,Roel01,Emmen Nederland,"Even naast elkaar gezet: de overheersende uitslagen Europese verkiezingen in ons land en specifiek het Noorden, naast de uitslagen van onze buren in Nedersaksen. On het Noorden de PvdA favoriet, in Nedersaksen zwaar overheersend de Duitse variant op het C…https://t.co/aNfkRslvjt",https://twitter.com/i/web/status/1132965254068092928,,,0,0
Mon May 27 11:02:02 +0000 2019,nl,Steven_vdv,"Ghent, Belgium","Dat je op meerdere nieuwssites in Vlaanderen letterlijk moet zoeken naar duiding en resultaten van de Europese verkiezingen, kan ook misschien wat verklaren waarom niemand iets weet van Europa.",https://twitter.com/i/web/status/1132965175932456962,,,0,0
Mon May 27 11:01:27 +0000 2019,nl,_pvda,,Een linkse directe van de #PvdA https://t.co/TIEdSEUCov De #PvdA heeft tijdens de Europese verkiezingen niet alleen klappen uitgedeeld aan politieke opponenten; de overt­uigende...,"http://bit.ly/2JJYLV0, https://twitter.com/i/web/status/1132965032441110529","PvdA, PvdA",,0,0
Mon May 27 11:01:26 +0000 2019,nl,_pvda,,Europese verkiezingen: zo stemde #Rotterdam https://t.co/QIu1tu8mge Afgelopen week mochten we weer naar de stembus! Deze keer voor de Europese verkiezingen. De uitslagen zijn nu bekend: van de 460.765...,"http://bit.ly/2JGoBcp, https://twitter.com/i/web/status/1132965028301344768",Rotterdam,,0,0
Mon May 27 11:01:26 +0000 2019,nl,_pvda,,"#GroenLinks en #PvdA winnen bij Europese verkiezingen, SP verliest flink https://t.co/rNpHWCI7ux #GroenLinks en #PvdA zijn afgelopen donderdag bij de Europese verkiezingen als de twee grootste winnaars uit de bus gekomen...","http://bit.ly/2K6mi1D, https://twitter.com/i/web/status/1132965025298169858","GroenLinks, PvdA, GroenLinks",,0,0
Mon May 27 11:00:04 +0000 2019,nl,nieuwsselectie,,"PvdA in helft Nederlandse gemeenten grootste partij, PVV verliest overal https://t.co/CgDCUrLwJB https://t.co/XaYm0v5DSu",http://dlvr.it/R5VM1B,,,0,0
Mon May 27 10:59:50 +0000 2019,nl,OzcanAkyol,Deventer,@jellekok Onzin. De PVV werd tweede tijdens de Europese verkiezingen van 2014.,,,jellekok,0,10
Mon May 27 10:58:56 +0000 2019,nl,nrc,24 landen,"Terwijl de uitslagen van de Europese verkiezingen binnenkomen, heeft het parlement een nieuwe tussenstand gegeven. Lees meer over de laatste verschuivingen en al het andere nieuws in ons liveblog. https://t.co/10libpi0LD",https://twitter.com/i/web/status/1132964399537430528,,,0,0
Mon May 27 10:57:34 +0000 2019,nl,Tijg55,"Dongen, Nederland",De megalomane flapdrol #Timmermans wil toch baasje spelen van de #EU. Zijn Commentaar op historische nederlaag : “ In  Spanje en Nederland hebben we gewonnen”. Mijn antwoord : in meer dan 25 landen heb je VERLOREN” Typisch #PVDA 🤮https://t.co/MgwCG2AavR via @trouw,https://twitter.com/i/web/status/1132964053725450240,"Timmermans, EU",,1,1
Mon May 27 10:57:32 +0000 2019,nl,Wilrombouts1,Bergeijk,"PvdA grootste partij in Oost-Brabant, bekijk hier de uitslag van jouw gemeente https://t.co/CsgNoG1Ke9",https://www.ed.nl/dossier-europese-verkiezingen/pvda-grootste-partij-in-oost-brabant-bekijk-hier-de-uitslag-van-jouw-gemeente~afefebbd/?utm_source=twitter&utm_medium=social&utm_campaign=socialsharing_web,,,1,1
Mon May 27 10:57:32 +0000 2019,nl,politiek,Nederland,Landelijke uitslag Europese Verkiezingen https://t.co/OyYaAu0kk6 | https://t.co/bdXjRcX3JO #Parlement #politiek,"http://dlvr.it/R5VLln, http://bit.ly/BestNieuws","Parlement, politiek",,4,0
Mon May 27 10:57:20 +0000 2019,nl,pblqmpim,,"PvdA grootste bij Europese verkiezingen, D66 verliest en halveertMay 21, 2019 at 08:15PM @ImPblq",,,ImPblq,0,0
Mon May 27 10:56:32 +0000 2019,nl,parlement,Den Haag,Landelijke uitslag Europese Verkiezingen #parlement #politiek https://t.co/mz6afAGQLO,https://www.parlement.com/id/vkyuepphv2zl?ctx=vhy5i95c1fxj,"parlement, politiek",,0,0
Mon May 27 10:53:09 +0000 2019,nl,PvdARkerk,Ridderkerk,"Kiezers bedankt voor jullie stem!
🌹Samen sterker💪❤️
Door jullie steun is er een prachtig resultaat behaald tijdens de Europese verkiezingen, ook in #Ridderkerk #PvdA #EP2019 https://t.co/IzCbssXRxA",https://twitter.com/i/web/status/1132962943270887425,,,1,8
Mon May 27 10:51:49 +0000 2019,nl,020amstelveen,,Uitslag Europese verkiezingen: GroenLinks grootste in de stad https://t.co/ARUorvuVa8,https://020amstelveen.nl/uitslag-europese-verkiezingen-groenlinks-grootste-in-de-stad/?utm_source=ReviveOldPost&utm_medium=social&utm_campaign=ReviveOldPost,,,0,0
Mon May 27 10:50:44 +0000 2019,nl,Johannemarise,Almere,Oude macht bezwijkt bij Europese verkiezingen. https://t.co/jIX0BQEFcW #FD #Europa,https://fd.nl/economie-politiek/1302680/oude-macht-bezwijkt-bij-europese-verkiezingen?utm_medium=social&utm_source=twitter&utm_campaign=SHR_ARTT_20190527&utm_content=,"FD, Europa",,0,0
Mon May 27 10:50:17 +0000 2019,nl,Hellas_nieuws,Greece & The Netherlands,Europese verkiezingen: hoe de belangrijkste lidstaten stemmen - Volkskrant https://t.co/d9IaeZjXL8,https://www.volkskrant.nl/nieuws-achtergrond/europese-verkiezingen-hoe-de-belangrijkste-lidstaten-stemmen~b1d31355/,,,0,0
Mon May 27 10:48:26 +0000 2019,nl,_Alkmaar,,Uitslag Europese Verkiezingen in Bergen NH Flessenpost uit Bergen plaatste het volgende bericht op hun website: Uitslag Europese Verkiezingen in Bergen NH. https://t.co/Z4OHiJSLCd,https://twitter.com/i/web/status/1132961756484128769,,,0,0
Mon May 27 10:48:14 +0000 2019,nl,de8fe3f3f5d24b9,,"@voidzorro @klimatheist @jesseklaver Ik ben een weldenkend mens, geen trol. Bovendien ben ik erg blij dat GL in de Europese verkiezingen meer stemmen heeft gehaald dan FvD, zodat na een eventuele Brexit GL
naar 4 zetels gaat. Verder blijf ik strijden tegen opkomend fascisme en racisme. Gewoon, vanwege het fatsoen.",https://twitter.com/i/web/status/1132961705376604160,,"voidzorro, klimatheist, jesseklaver",0,0
Mon May 27 10:46:40 +0000 2019,nl,chicohalS,,Half miljoen minder stemmen voor Baudet https://t.co/p3WU9a1P76,https://www.ad.nl/dossier-europese-verkiezingen/half-miljoen-minder-stemmen-voor-baudet~a335bba6/?utm_source=twitter&utm_medium=social&utm_campaign=socialsharing_web,,,0,0
Mon May 27 10:46:25 +0000 2019,nl,benjaminvanes,"Rotterdam, Nederland","@AmsterdamNL Ha A'dam! Vraagje, wanneer worden de definitieve uitslagen (o.a. per kandidaat) van de Europese verkiezingen gepubliceerd? De zitting was vanochtend om 10u al, en ik wacht er met smart op!",https://twitter.com/i/web/status/1132961249707347969,,AmsterdamNL,0,0
Mon May 27 10:46:15 +0000 2019,nl,HKH,🚴🏻‍♂️,"Heeft Geert Wilders al een reactie gegeven? #PvdA in helft Nederlandse gemeenten grootste partij, #PVV verliest overal
 https://t.co/HYdQjN7FCO",https://twitter.com/i/web/status/1132961207122571269,"PvdA, PVV",,0,1
Mon May 27 10:46:07 +0000 2019,nl,IRMC16,,"@muppetrunner @wierdduk Timmermans zal nog even mogen plakken als VP van de EC. Daarna een borrel als afscheid want Manfred zal zijn eigen VP willen. De vraag is wat Timmermans gaat doen. Voor andere baantjes heeft hij immers totaal geen interesse.
https://t.co/VU5CLNG51n",https://twitter.com/i/web/status/1132961174042099713,,"muppetrunner, wierdduk",0,0
Mon May 27 10:45:50 +0000 2019,nl,ahuijsen,Germany,"Zou men in Nederland eindelijk doorhebben dat we het niet van de rechtse partijen moeten hebben? 

https://t.co/JavsWJupYD",https://www.nu.nl/europese-verkiezingen-2019/5910099/pvda-in-helft-nederlandse-gemeenten-grootste-partij-pvv-verliest-overal.html,,,0,0
Mon May 27 10:45:50 +0000 2019,nl,chicohalS,,"Europese verkiezingswinst opsteker voor Kurz, maar motie van wantrouwen ligt klaar https://t.co/kP482xn3rU",https://www.ad.nl/dossier-europese-verkiezingen/europese-verkiezingswinst-opsteker-voor-kurz-maar-motie-van-wantrouwen-ligt-klaar~a3067fef/?utm_source=twitter&utm_medium=social&utm_campaign=socialsharing_web,,,0,0
Mon May 27 10:45:42 +0000 2019,nl,EllyWeers,"Oosterhout, Noord-Brabant",In Oosterhout stemde 20% voor Timmermans! https://t.co/vGwrJZChDP,https://nos.nl/europese-verkiezingen/uitslagen-oosterhout?ref=facebook,,,0,0
Mon May 27 10:45:29 +0000 2019,nl,chicohalS,,Bekijk hier alle uitslagen https://t.co/wjKd4ly4fo,https://www.ad.nl/dossier-europese-verkiezingen/bekijk-hier-alle-uitslagen~a731492e/?utm_source=twitter&utm_medium=social&utm_campaign=socialsharing_web,,,0,0
Mon May 27 10:44:12 +0000 2019,nl,ProDemos,Den Haag,En natuurlijk gaat Tomas Vanheste ook uitgebreid in op de uitslag van de Europese verkiezingen. Toegang is gratis. Meld je aan via https://t.co/cCMcZlIxj6 #EP2019 #EuropeanElectionResults https://t.co/hKEAAhTufB,https://twitter.com/i/web/status/1132960688161382401,,,1,1
