created_at;lang;screen_name;location;full_text;urls;tags;mentions;retweet_count;favorite_count;parsed_text;emoji;english;clean
2019-05-29 14:06:19;lt;Sputnik_lietuva;Vilnius, Lietuva;"Lietuvoje įvyko prezidento ir Europos Parlamento rinkimai. Žmonės išreiškė savo valią ir dabar turi teisę reikalauti iš naujojo prezidento ir EP narių gerinti gyvenimo kokybę ir santykius su kaimyninėmis valstybėmis
https://t.co/SBR8n24bQT";https://sputniknews.lt/satires/20190529/9171064/rinkimai-baigesi-kas-laukia-tautos.html;;;0;0;Lietuvoje įvyko prezidento ir Europos Parlamento rinkimai. Žmonės išreiškė savo valią ir dabar turi teisę reikalauti iš naujojo prezidento ir EP narių gerinti gyvenimo kokybę ir santykius su kaimyninėmis valstybėmis;;Took place in lithuania's presidential and European Parliament elections. The people have expressed their will and now has the right to demand from the new president and members of the EP to improve the quality of life and relations with neighbouring states;took place lithuanias presidential european parliament elections people expressed right demand new president members ep improve quality life relations neighbouring states
2019-05-27 07:03:18;lt;geltona;;EP rinkimai Europoje: ES populistams nepavyko;;;;0;0;EP rinkimai Europoje: ES populistams nepavyko;;The EP elections in Europe: the EU populistams failed;ep elections europe eu populistams failed
2019-05-27 07:03:00;lt;informacija;vilniusbot@gmail.com;EP rinkimai: nuosaikieji atsilaikė, bet dirbs daugiau liberalų, žaliųjų ir populistų https://t.co/oEF15lBUyi;https://www.15min.lt/naujiena/aktualu/pasaulis/ep-rinkimai-nuosaikieji-atsilaike-bet-dirbs-daugiau-liberalu-zaliuju-ir-populistu-57-1150538?utm_source=rssfeed_default&utm_medium=rss&utm_campaign=rssfeed;;;0;0;EP rinkimai: nuosaikieji atsilaikė, bet dirbs daugiau liberalų, žaliųjų ir populistų;;EP elections: the moderate survived, but will work in more liberal, the greens and the populist;ep elections moderate survived work liberal greens populist
2019-05-27 07:01:39;lt;ITGASOCIACIJA;;"EP rinkimai baigėsi, bet aktualios Lietuvai temos lieka.
https://t.co/N1lkgCTKsS";https://www.delfi.lt/verslas/nuomones/linas-sesickas-mobilumo-paketo-pataisos-gali-priestarauti-sutarciai-del-es-veikimo.d?id=80776075;;;0;0;EP rinkimai baigėsi, bet aktualios Lietuvai temos lieka.;;The EP elections ended, but relevant for Lithuania topic remains.;ep elections ended relevant lithuania topic remains
2019-05-27 06:12:20;lt;darkooo;Vilnius, Lithuania;EP rinkimai jau įdomesni - Maldeikienės traukinys panašu, kad pakeliui visus vagonus pametė ir tik lokomotyvas pasiekė finišą. Lemiamas šuolis tapo kryčiu :) Paksas ir Zuokas galutinai mirė. Guogai nepaėjo pokeris su Puteikiu. Uspaskis su Tomaševskiu ant savo auditorijos išjojo.;https://twitter.com/i/web/status/1132892270833938432;;;0;13;EP rinkimai jau įdomesni - Maldeikienės traukinys panašu, kad pakeliui visus vagonus pametė ir tik lokomotyvas pasiekė finišą. Lemiamas šuolis tapo kryčiu :) Paksas ir Zuokas galutinai mirė. Guogai nepaėjo pokeris su Puteikiu. Uspaskis su Tomaševskiu ant savo auditorijos išjojo.;;The EP elections are already more interesting - Maldeikienės the train seems to be the way all cars lost and only the locomotive reached the finish line. The decisive jump became kryčiu :) Paksas and Zuokas finally died. Guogai nepaėjo poker with Puteikiu. Uspaskis with Tomaševskiu on your audience išjojo.;ep elections already interesting maldeikienės train seems way cars lost locomotive reached finish line decisive jump became kryčiu paksas zuokas finally died guogai nepaėjo poker puteikiu uspaskis tomaševskiu audience išjojo
2019-05-27 00:10:38;lt;KaMykolas;Naktis.;"Viena įdomesnių savivaldybių - Šalčininkų. Top 3 pasirinkimai:
1. Tomaševskio blokas
2. Pakso judėjimas
3. Darbo Partija

Vilniaus rajone - panaši situacija, tik kad nedorieji Krikdemai perskyrė trijulę. Source: https://t.co/DsXj0yIzS3
#Rinkimai2019";https://twitter.com/i/web/status/1132801246455390208;;;0;1;Viena įdomesnių savivaldybių - Šalčininkų. Top 3 pasirinkimai: 1. Tomaševskio blokas 2. Pakso judėjimas 3. Darbo Partija Vilniaus rajone - panaši situacija, tik kad nedorieji Krikdemai perskyrė trijulę. Source:;;One of the more interesting municipal - Šalčininkai. Top 3 choices: 1. In tomaševski's block 2. Paksas movement 3. The labour Party in Vilnius district - a similar situation, only that the wicked Krikdemai perskyrė triplet. Source:;one interesting municipal šalčininkai top choices tomaševskis block paksas movement labour party vilnius district similar situation wicked krikdemai perskyrė triplet source
