created_at;lang;screen_name;location;full_text;urls;tags;mentions;retweet_count;favorite_count;parsed_text;emoji;english;clean
2019-06-03 06:55:12;und;sheepico;;"Pokiaľ ide o politické zoskupenia, európske voľby nepriniesli rozhodujúceho víťaza – je to však iný príbeh, pokiaľ ide o otázky v oblasti klímy.

https://t.co/MekAqlvmHQ";https://twitter.com/i/web/status/1135439776885215234;;;0;0;Pokiaľ ide o politické zoskupenia, európske voľby nepriniesli rozhodujúceho víťaza – je to však iný príbeh, pokiaľ ide o otázky v oblasti klímy.;;As far as the political grouping, the european elections have not produced major winners – but it is a different story, as regards the issues in the area of climate change.;far political grouping european elections produced major winners – different story regards issues area climate change
2019-05-29 14:53:22;und;jakub_feltovic;Slovak Republic;Napriek tomu, že existuje pomerne veľká skupina európskych voličov, ktorá si želá zmenu vedenia Európskej politiky, voľby celkovo vyhrali umiernené, nie extrémistické sily. Som rád, že zvíťazili hlavné európske frakcie, napriek tomu, že sú oproti minulosti početne oslabené.;https://twitter.com/i/web/status/1133748171677622272;;;0;0;Napriek tomu, že existuje pomerne veľká skupina európskych voličov, ktorá si želá zmenu vedenia Európskej politiky, voľby celkovo vyhrali umiernené, nie extrémistické sily. Som rád, že zvíťazili hlavné európske frakcie, napriek tomu, že sú oproti minulosti početne oslabené.;;Despite the fact that there is a relatively large group of european voters, who wishes to change the leadership of the European policy options, overall, won a moderate, not extremist forces. I'm glad to have won the major european factions, despite the fact that they are compared to the past are weakened.;despite fact relatively large group european voters wishes change leadership european policy options overall moderate extremist forces im glad major european factions despite fact compared past weakened
2019-05-27 17:07:16;und;Europarl_SK;Brusel, Štrasburg;Teraz po voľbách sa budú poslanci zaraďovať do politických skupín a rozhodnú aj o novom predsedovi Európskej komisie. Viac na https://t.co/5Nt9CYsVvO https://t.co/VmIK89ViV7;https://twitter.com/i/web/status/1133057093752246274;;;2;3;Teraz po voľbách sa budú poslanci zaraďovať do politických skupín a rozhodnú aj o novom predsedovi Európskej komisie. Viac na;;Now after the elections, will be members of the divided into political groups and decide about the new president of the European commission. More on;elections members divided political groups decide new president european commission
2019-05-27 07:16:34;und;Biztweeteu;Praha, Česká republika;Európske voľby ukázali, že slovenské utrapravicové spektrum nových lídrov nehľadá. https://t.co/ptZ7stAuIh;https://biztweet.eu/article/4230-novi-kamarati-kollarovi-nepomohli-so-sulikom-si-zostali-sami;;;0;0;Európske voľby ukázali, že slovenské utrapravicové spektrum nových lídrov nehľadá.;;The european elections have shown that the british utrapravicové range of new leaders is not looking.;european elections shown british utrapravicové range new leaders looking
